companyName,profileUrl,location,logoUrl,companyType,revenue,establishedYear,description,isVerified,api_enrichment_status,api_error_message,is_qualified,qualification_reason,api_raw_response_preview,api_confidence_score,api_notes,api_findings,api_company_linkedin,api_website,api_num_employees,api_industry,api_short_summary,api_has_div8_estimators,api_icp_match,api_logic,api_lead_linkedin_profiles,api_decision_makers,api_estimator_leads,api_lead_count,api_relevant_lead_count
"Omega Door Co. of Kansas City, Inc.",https://www.thomasnet.com/company/omega-door-co-of-kansas-city-inc-20068512/profile?cov=NA&format=json&heading=23639008&limit=2589&searchsource=suppliers&searchterm=Doors&what=Doors&which=prod&coverage_area=NA&pg=70,"Kansas City, KS 66103",/_sda/_next/image?url=https%3A%2F%2Fcdn.thomasnet.com%2Fritekit%2Fomega-kc.com.png&w=256&q=75,"Service Company* , Manufacturer",$10 - 24.9 Mil Revenue,,Manufacturer of doors. Installation service,No,Success,,False,"Confidence score 8.0 >= 7.0; Employee count 51 (from '51-200 (LinkedIn lists ~22 employees, estimates vary)') >= 10; Has estimator: no explicit div 8 estimator role found; estimating functions likely handled internally by project managers and sales staff; ICP match: yes. similar to companies like overly door co. and acudor products, inc., due to focus on commercial; No decision makers found","{""notes"": ""Omega Door Co. of Kansas City, Inc., known as Omega Door and Hardware, is a specialized commercial and industrial door manufacturer and installer located in Kansas City, KS. The company off",8.0,"Omega Door Co. of Kansas City, Inc. (Omega Door and Hardware) is a relevant medium-sized company in the commercial door manufacturing and installation industry with experienced management, multiple service capabilities including emergency repair, and aligns well with other comparable door industry firms.","LinkedIn Company Profile: https://www.linkedin.com/company/omega-door-and-hardware|Company LinkedIn: https://www.linkedin.com/company/omega-door-and-hardware|Website: https://www.omega-kc.com/ offering commercial and industrial door products and services.|Estimated employee count not explicit; presence of managers and sales staff suggests mid-sized workforce.|Company name: Omega Door Co. of Kansas City, Inc. operating as Omega Door and Hardware|Employees Estimate: 51-200 (LinkedIn indicates 22 employees linked)|No dedicated DIV 8 estimator found but estimating tasks handled by project management and sales|Company Description: Provider and installer of commercial doors including hollow metal, coiling, sectional doors, and finish hardware, with emergency repair service|Similar Companies: Overly Door Co., Acudor Products, Inc., with similar product and service focus|No direct emails or phone numbers for individuals found, general office phone 913.647.3667 available on official website|No confirmed CEO found on LinkedIn or other sources yet|Location: Kansas City, US|No explicit email or phone found; company contact page may provide this.|Location: 924 Division St, Kansas City, KS (confirmed local presence).|Location: 924 Division St, Kansas City, KS 66103|LinkedIn company profile: https://www.linkedin.com/company/omega-door-and-hardware.|No explicit CEO identified yet|ICP Match: Yes, similar to other door manufacturers/suppliers like Overly Door Co., Acudor Products, voestalpine Roll Forming, differentiated by strong local focus and 24/7 service|Industry: Construction (Commercial Door Manufacturing and Installation)|Key Personnel Identified: Dave Vogel (Project Manager/Sales Specialist), Ann McElvain (Commercial Sales), Rich Delarber (Project Manager), Patricia R. (Purchasing/Order Management), Corey Kessler (Vice President, LinkedIn page dead)|Industry: Commercial and industrial door manufacturing and installation.|Estimated employees: LinkedIn lists ~22 employees, typical estimate ~51-200|Summary: Medium-sized regional door manufacturer/installer with experienced management and sales, multiple service capabilities, relevant for door industry engagements|Estimated Employees: 11-50 (LinkedIn), possibly up to 51-200|Key people identified: Corey Kessler (VP Operations), Dave Vogel (Project Manager/Sales), Ann McElvain (Commercial Sales), Rich Delarber (Project Manager), Patricia R. (Purchasing and Order Management)|Services: New construction door supply, commercial door repair service with 24-hour emergency availability|Company is similar to other door suppliers like Overly Door Co. and Acudor Products, focusing on door manufacturing and installation, with a strong local service emphasis.|Key personnel identified on LinkedIn include Corey Kessler (Vice President), Dave Vogel (Project Manager/Sales Specialist), Ann McElvain (Commercial Sales), Rich Delarber (Project Manager), Patricia R. (Purchasing and Order Management).|Main phone: 913.647.3667|Business model similar to Overly Door Co., Acudor Products, with strong local service focus|CompanyName: Omega Door and Hardware (Omega Door Co. of Kansas City, Inc.)|Main office phone: 913.647.3667|Company name: Omega Door Co. of Kansas City, Inc. (aka Omega Door and Hardware)|Website: https://www.omega-kc.com|Industry: Construction; specializing in commercial and industrial door manufacturing, hardware supply, and installation|No dedicated DIV 8 estimator title found; estimating roles likely within project management or sales|Official Website: https://www.omega-kc.com|No explicit DIV 8 estimator role found but project managers/sales staff likely cover estimating functions internally|Key People Identified: Corey Kessler (VP), Dave Vogel (Project Manager/Sales Specialist), Ann McElvain (Commercial Sales), Rich Delarber (Project Manager), Patricia R. (Purchasing & Order Management), Brandon Tenpenny (Project Manager), Jill Winger (Sales Support/PM), Jason Brashear (Construction)|No public emails found for decision-makers|No clear evidence if DIV 8 estimators are on staff; project managers and sales roles may cover estimation functions.|Company is named Omega Door Co. of Kansas City, Inc., operating as Omega Door and Hardware.|Industry: Commercial and industrial door manufacturing and installation",https://www.linkedin.com/company/omega-door-and-hardware,https://www.omega-kc.com,"51-200 (LinkedIn lists ~22 employees, estimates vary)","Construction; specializing in commercial and industrial door manufacturing, hardware supply, and installation","Medium-sized regional door manufacturer and installer offering commercial doors, frames, finish hardware, coiling and sectional doors, with 24/7 emergency repair and installation services in Kansas City.",No explicit DIV 8 estimator role found; estimating functions likely handled internally by project managers and sales staff,"Yes. Similar to companies like Overly Door Co. and Acudor Products, Inc., due to focus on commercial door manufacturing, installation, and local service emphasis.","The company's similarity lies in its product offerings (commercial and industrial doors, frames, hardware), its service model emphasizing installation and 24/7 emergency repairs, and a strong local market focus akin to other regional door suppliers and manufacturers.",,,,8.0,0.0
Aluminum Products of Cape Cod,https://www.thomasnet.com/company/aluminum-products-of-cape-cod-30755450/profile?cov=NA&format=json&heading=23639008&limit=2589&searchsource=suppliers&searchterm=Doors&what=Doors&which=prod&coverage_area=NA&pg=71,"Dennisport, MA 02639",,Manufacturer*,$1 - 4.9 Mil Revenue,1949.0,"Manufacturer of aluminum products and vinyl replacement windows to the consumer industry. Products include storm windows and doors, shutters, gutters, and porch enclosures.",No,Success,,False,"Confidence score 9.0 >= 7.0; Employee count 8 (from '8-13') < 10; No estimator detected: No estimators found in titles or company details; ICP mismatch: no, because the company offers a broader range of aluminum and vinyl exterior residential products c; No decision makers found","{""notes"": ""Aluminum Products of Cape Cod, Inc. is a family-owned company since 1962, located at 476 Main Street, Dennis Port, MA 02639. Their official website is https://www.apofcc.com and the main co",9.0,"Aluminum Products of Cape Cod, Inc. is a small, family-owned local business with about 8-13 employees, specializing in aluminum and vinyl residential exterior products and installation since 1962. They do not appear to have specialized Division 8 estimators on staff and focus on broader home exterior product offerings and installation services rather than being direct competitors with major door manufacturers. Leadership includes President Paul L. Hunter and Manager Matthew Hunter. The company holds an A+ BBB rating and serves primarily the Cape Cod area.","BBB Profile: Not accredited but A+ rated, in business for 61 years.|Company Facebook page is present but LinkedIn expected to yield more professional data relevant for staffing and company structure.|Products include aluminum windows, storm windows and doors, shutters, gutters, and porch enclosures.|Industry: Residential aluminum and vinyl exterior products manufacturing and installation|Key decision-makers and contacts are still being investigated.|No public emails of executives confirmed but possible email format includes AOL and apofcc domain|Key product categories are storm doors, storm windows, porch enclosures, shutters, gutters.|Location: 476 Main Street, Dennisport, MA 02639|Number of Employees: Estimated 8-13|Company has been operating for over 60 years in Cape Cod area, focusing on aluminum and vinyl replacement windows and related products.|Company focuses on consumer market for home improvement aluminum products.|Physical address is 476 Main St, Dennis Port, MA 02639, with phone number (508) 256-9901.|Gerard Cooper is a Glazier at the company (LinkedIn profile).|Website: https://www.apofcc.com|LinkedIn company profile not yet located—search suggested to confirm employee count and find key personnel.|Location: 476 Main Street, Dennis Port, MA 02639|The company was founded in 1962 and is family owned and operated.|Aluminum Products of Cape Cod is a family-owned manufacturer and installer of aluminum and vinyl exterior residential products since 1962.|Key Products: Storm windows and doors, vinyl sliding doors, shutters, gutters, porch enclosures|No public evidence of employ DIV 8 estimators (door/frame/hardware cost estimators).|Contact Info: Main phone (508) 256-9901, Alt phone (508) 398-8546, General email info@apofcc.com|Company targets residential consumers primarily, differentiating by offering additional exterior products beyond doors and windows.|BBB Rating A+|No Div 8 estimators specialized in door hardware estimating identified on staff.|Website: https://www.apofcc.com/|The company is located in Dennisport, MA with approximately 8 employees and holds an A+ BBB rating.|LinkedIn Profile of Matthew Hunter: https://www.linkedin.com/in/matthew-hunter-50442716|Estimated employee count and precise industry classification not yet confirmed.|Services include installation by qualified and fully insured installers.|Phone: (508) 256-9901; Website: https://www.apofcc.com|Leadership: Paul L. Hunter (President), Matthew Hunter (Manager), Gerard Cooper (Glazier)|LinkedIn Key Person: Matthew Hunter, Manager, over 20 years at company; Gerard Cooper, Glazier; Paul L. Hunter, President (identified via BBB).|No direct evidence yet on employee number or presence of DIV 8 estimators.|Company is more diversified and full-service installation focused compared to specialized door manufacturers|Number of Employees: Approximately 8 (per BBB)|No key decision-makers identified yet; next step is targeted LinkedIn search per role starting with CEO.|Matthew Hunter is a Manager at the company with over 20 years of tenure (LinkedIn profile).|No identified Division 8 estimator roles|The company operates as a local exterior products and installation provider, differing from larger or specialized door manufacturers like Overly Door Co. or Acudor Products.|Focus on local Cape Cod residential market|Company differs from typical door manufacturers by offering broader range of exterior residential products plus installation services, family-owned since 1962.|Official company website is https://www.apofcc.com where detailed product info is available.|Industry: Manufacturing and installation of aluminum and vinyl windows, storm doors, gutters, shutters, porch enclosures; residential consumer focus.|Paul L. Hunter is identified as President per BBB, but no verified LinkedIn profile or contact info yet.|No specific LinkedIn company profile located yet; some individual employee profiles found linked to the company.|Located in Dennis Port, MA; serving the Cape Cod area.|They offer storm windows and doors, shutters, gutters, porch enclosures, and vinyl sliding doors, with in-house fabrication and insured installation.|Known company phone is (508) 256-9901; website: https://www.apofcc.com for more direct contact and info.|No direct evidence of DIV 8 estimators found so far.|Presence on Facebook https://facebook.com/101805105927941|Company Name: Aluminum Products of Cape Cod, Inc.",,https://www.apofcc.com,8-13,Residential aluminum and vinyl exterior products manufacturing and installation,"Aluminum Products of Cape Cod, Inc. is a family-owned manufacturer and installer of aluminum and vinyl exterior residential products since 1962, offering storm windows and doors, shutters, gutters, porch enclosures, and vinyl sliding doors primarily serving Cape Cod local residential customers with an emphasis on insured installation and free estimates.",No,"No, because the company offers a broader range of aluminum and vinyl exterior residential products combined with installation services focused on the local Cape Cod market, unlike specialized door manufacturers like Overly Door Co., Acudor Products, Inc., and voestalpine Roll Forming Corporation.","This company differs from typical door manufacturers by providing diversified exterior products beyond just doors (including windows, shutters, gutters, porch enclosures) along with in-house fabrication and insured installation services targeting local residential consumers, rather than focusing solely on door manufacturing or hardware supply like other companies named.",,,,3.0,0.0
Century Building Materials,https://www.thomasnet.com/company/century-building-materials-30171286/profile?cov=NA&format=json&heading=23639008&limit=2589&searchsource=suppliers&searchterm=Doors&what=Doors&which=prod&coverage_area=NA&pg=71,"Lindenhurst, NY 11757",,Distributor*,$5 - 9.9 Mil Revenue,1997.0,"Distributor of building materials. Product line includes lumber, masonry, windows, skylights, decking, drywall, insulation, doors, tile, grout, moulding, roofing, siding, rebar and mesh.",No,Success,,False,Confidence score 9.0 >= 7.0; Employee count 11 (from '11-50') >= 10; No estimator detected: No estimators found in titles or company details; ICP mismatch: no. century building materials differs from specialized door suppliers or manufacturers such as over; No decision makers found,"{""notes"": ""Century Building Materials is a regional wholesale distributor of a wide range of building materials located at 275 Sunrise Hwy, Lindenhurst, NY 11757, USA. Founded in 1951, it supplies con",9.0,"Century Building Materials is relevant as a building materials distributor with some door product offerings but is not a door manufacturer or specialized door hardware supplier. It does not align closely with companies focused solely on door supply or manufacturing and lacks Division 8 estimators on staff. The company has a physical showroom and specialty distribution rights for certain brands in Long Island, emphasizing broad product distribution rather than niche door industry specialization.","Company Name: Century Building Materials Co|Has an Outdoor Display Center showroom for customer engagement|Industry: Wholesale Building Materials|No clear information available on employing Division 8 estimators, suggesting limited or no specific estimating staff for door hardware components.|Broad product offering including doors but not manufacturing; product distribution focus|Specialty distribution rights: Nicolock pavers, Dryvit Energy Efficient Exteriors in Long Island|Key personnel identified: Michael Smith (Director), Al Ferrante (VP), Lenny Timpone (Sales Leader), Ted Fischer (Experienced Professional)|No explicit evidence yet about DIV 8 estimators on staff; needs additional investigation.|Website: https://www.centurybuilding.com|Social Media: Facebook https://www.facebook.com/CenturyBuildingMaterials, Instagram https://www.instagram.com/centurybuildingmaterials|DIV 8 Estimators: No evidence found to confirm presence of Div 8 estimators on staff|LinkedIn company profile exists at https://www.linkedin.com/company/century-building-materials-co but employee and leadership data need further research.|Exclusive Long Island distributor of some specialty products (Nicolock, Dryvit)|Not a door manufacturer; therefore 'ICP Match' as door supplier/manufacturer: No|No evidence of specialized DIV 8 estimators on staff|The company is more generalized wholesale building materials distributor rather than a direct competitor or exact match to door suppliers/manufacturers like Overly Door Co., Acudor Products, or voestalpine Roll Forming Corporation.|Key personnel identified preliminarily: Michael Smith (Director of Building Materials and Leasing), Lenny Timpone (Sales Leader), Ted Fischer (Experienced professional)|Location: 275 Sunrise Hwy, Lindenhurst, New York 11757, USA|Preliminary identification of a potential key person: Ted Fischer with industry experience linked to Century Building Materials Co.|Product Line: Lumber, masonry, windows, skylights, decking, drywall, insulation, doors, tile, grout, moulding, roofing, siding, rebar, mesh, Diabolo Tools, Dryvit Energy Efficient Exteriors, Nicolock pavers, and related building materials|Location: 275 Sunrise Hwy, Lindenhurst, NY 11757, USA|Website: https://centurybuilding.com|Official website is http://www.centurybuilding.com/, representing a longstanding distributor (since 1951) serving contractors and DIY customers in Queens to Montauk area.|Century Building Materials is a building materials distributor based in Lindenhurst, NY with over 70 years of history.|No confirmed Division 8 estimators on staff|Social media presence includes Facebook https://www.facebook.com/CenturyBuildingMaterials/ and Instagram https://www.instagram.com/centurybuildingmaterials/.|Industry: Wholesale Building Materials Distributor|Product lines span lumber, masonry, doors, windows, decking, drywall, insulation, roofing & siding, moulding, rebar and mesh, plus specialty products like Nicolock pavers and Dryvit exteriors.|Company: Century Building Materials, www.centurybuilding.com, Lindenhurst, NY 11757|Not a direct door supplier or manufacturer like Overly Door Co., Acudor Products, voestalpine Roll Forming Corporation; more of a broad building materials distributor|Century Building Materials Co LinkedIn page exists at https://www.linkedin.com/company/century-building-materials-co with 11-50 employees and classified under Wholesale Building Materials industry.|Employee estimate: 11-50|Specialty: Broad building materials distributor with an Outdoor Display Center for showcasing products|Estimated Number of Employees: 11-50|Social: Facebook https://www.facebook.com/CenturyBuildingMaterials, Instagram https://www.instagram.com/centurybuildingmaterials|Company: Century Building Materials Co|Company distributes a broad range of building materials including doors but is not specialized purely in door supply or manufacturing.|Company Size on LinkedIn: 7 employees connected, small to mid-sized company|LinkedIn Followers: 13|Contact details include phone (631) 888-8810, email sales@centurybuilding.com, and an active website https://centurybuilding.com.|General contact: sales@centurybuilding.com, (631) 888-8810|ICP Match: No, differs from specialized door manufacturers/suppliers due to broader product range and general contractor market focus|General company contact phone: (631) 888-8810|LinkedIn company profile: https://www.linkedin.com/company/century-building-materials-co|They serve contractors and homeowners, focusing on supply rather than door manufacturing, making the company less similar to specialist door suppliers or manufacturers like Overly Door Co.|Contact Info: General phone (631) 888-8810, email sales@centurybuilding.com; specific contacts' emails/phones not publicly available|They have a physical showroom and an Outdoor Display Center to showcase materials and finished looks.|Employees: 11-50|General company contact email: sales@centurybuilding.com|Products: Wide range including lumber, masonry, windows, skylights, decking, drywall, insulation, doors (interior and exterior), tile, grout, moulding, roofing, siding, rebar, mesh, specialty products|Key People Found: Michael Smith (Director of Building Materials and Leasing), Lenny Timpone (Building Materials and MRO sales leader), Ted Fischer (experienced professional associated with the company but no confirmed title)",https://www.linkedin.com/company/century-building-materials-co,https://centurybuilding.com,11-50,Wholesale Building Materials,"Century Building Materials is a well-established wholesale distributor of building materials located in Lindenhurst, NY, serving contractors and homeowners in Long Island since 1951. Their product range includes lumber, masonry, windows, skylights, decking, drywall, insulation, doors, tile, grout, moulding, roofing, siding, rebar, mesh, and specialty products like Nicolock pavers and Dryvit Energy Efficient Exteriors. They operate an Outdoor Display Center and showroom for product visualization and selection.",No evidence found of Division 8 estimators on staff; the company functions primarily as a general building materials distributor rather than specialized door estimating or manufacturing.,"No. Century Building Materials differs from specialized door suppliers or manufacturers such as Overly Door Co., Acudor Products, Inc., and voestalpine Roll Forming Corporation because it offers a broader range of building materials and focuses on distribution rather than door manufacturing or specialized door hardware estimating.","Century Building Materials is a general wholesale building materials distributor with a wide product offering, which includes doors among many other products. Unlike the specialized door suppliers and manufacturers that focus exclusively on doors and related hardware, Century serves general contractors and homeowners with diverse building materials and does not appear to have dedicated Division 8 estimating staff or specialized door manufacturing capabilities.",,,,4.0,0.0
