companyName,profileUrl,location,logoUrl,companyType,revenue,establishedYear,description,isVerified,api_enrichment_status,api_error_message,is_qualified,qualification_reason,api_raw_response_preview,api_confidence_score,api_notes,api_findings,api_company_linkedin,api_website,api_num_employees,api_industry,api_short_summary,api_has_div8_estimators,api_icp_match,api_logic,api_lead_linkedin_profiles,api_decision_makers,api_estimator_leads,api_lead_count,api_relevant_lead_count
Rae-Lite Industries Ltd.,https://www.thomasnet.com/company/rae-lite-industries-ltd-30688850/profile?cov=NA&format=json&heading=23639008&limit=2589&searchsource=suppliers&searchterm=Doors&what=Doors&which=prod&coverage_area=NA&pg=71,"Melville, SK S0A2P0",,Manufacturer*,$1 - 4.9 Mil Revenue,1989.0,,No,Failed or No Data,Unexpected error for Rae-Lite Industries Ltd.: ValueError('Out of range float values are not JSON compliant'),False,Unexpected error for Rae-Lite Industries Ltd.: ValueError('Out of range float values are not JSON compliant'),,,,,,,,,,,,,,,,,
Cadwell Joinery,https://www.thomasnet.com/company/cadwell-joinery-30829876/profile?cov=NA&format=json&heading=23639008&limit=2589&searchsource=suppliers&searchterm=Doors&what=Doors&which=prod&coverage_area=NA&pg=70,"Warwick, MA 01378",,Custom Manufacturer*,,,"Manufacturer of custom windows and doors. Types include pegged mortise, tenon style, and storm windows.",No,Success,,False,"Confidence score 8.5 >= 7.0; Employee count 10 (from 'Small operation, likely fewer than 10') >= 10; No estimator detected: No estimators found in titles or company details; ICP mismatch: no, cadwell joinery differs from typical door suppliers such as overly door co. and acudor products,; No decision makers found","{""notes"": ""Cadwell Joinery, operating also as Cadwell Windows, is a specialized woodworking company based in Warwick, Massachusetts, focusing on period appropriate windows, doors, entrances, and woodw",8.5,"The company is highly specialized in custom historic window and door craftsmanship and operates on a small scale, making it distinct from typical door manufacturers and suppliers. No evidence of Div 8 estimators was found, and no LinkedIn company profile exists. Contact details exist but are not widely publicized, and key personnel information is limited to the founder and primary woodworker, Jack Cadwell.","Company likely operates in manufacturing and construction industry in Warwick, MA region.|Cadwell Joinery is located at 122 Hastings Pond Rd, Warwick, MA 01378, confirmed via Cylex listing.|Phone and fax numbers are available: Phone (978) 544-6452, Fax (815) 399-4491.|Founder: Jack Cadwell (likely CEO-level)|Employee count, industry classification, and presence of DIV 8 estimators remain unknown.|Location: Warwick, Massachusetts|Next steps required include website scraping and targeted LinkedIn title-specific searches to identify key decision-makers and specialists.|The company's product and market focus appears distinct from mass producers and aligns with traditional craftsmanship.|Company likely operates in the manufacturing industry with a focus on custom and traditional joinery window and door products.|Products: Custom windows, doors, entrances using pegged mortise and tenon joinery|Official website is www.cadwellwindows.com, providing a channel for more detailed company information and contact methods.|No key personnel identified yet; aggressive LinkedIn searches for specific roles are needed to locate decision-makers.|Industry: Specialized woodworking focusing on period appropriate windows and doors, historic preservation|Small specialized woodworking shop, artisanal scale|Cadwell Joinery is a manufacturer specializing in custom wood windows and doors, including pegged mortise and tenon style and storm windows.|No evidence found of Div 8 estimating staff|Company Name: Cadwell Joinery / Cadwell Windows|Business hours are consistently 9 AM to 5 PM daily, indicating a standard operational schedule.|Company distinct from typical door manufacturers due to niche historic restoration focus|No publicly listed contact emails or phone numbers on the official website|Website: https://www.cadwellwindows.com/|Business Model: Small, specialized custom manufacturer/restorer, focusing on historic fabric preservation|Based in Warwick, Massachusetts|Similar companies nearby are mostly in woodworking and construction but no direct comparison confirms identical ICP status with door suppliers like Overly Door Co.|Specializes in period-appropriate custom wooden windows, doors, and entrances|Key Individual Mentioned: Jack Cadwell (Expert craftsman and woodworker, likely owner or primary operator)|Focuses on historic restoration and new custom parts matching originals|Potential official website is www.cadwellwindows.com as per Cylex business directory listing but requires direct verification.|No customer reviews found yet, indicating limited online feedback or recent listing.|No information yet on number of employees or employee roles like DIV 8 estimators.|Uses pegged mortise and tenon style joinery|No LinkedIn profiles or social media links directly associated found in this resource|Company name: Cadwell Windows (aka Cadwell Joinery)|No explicit employee count found; likely small operation|Primary business is manufacturing custom wood windows and doors, specializing in pegged mortise and tenon styles and storm windows.|Website: https://www.cadwellwindows.com|Company appears distinct from large-scale door suppliers by its traditional joinery focus.|No clear LinkedIn company profile for Cadwell Joinery found; similar named companies appear unrelated.|No LinkedIn profile or social media links found for the company or key personnel yet.|No detailed leadership team or contact info publicly available on website|No verified key decision-maker profiles (CEO, COO, President, VP, Director, Estimator) identified linked to Cadwell Joinery in Massachusetts yet.|No explicit information on number of employees or presence of Div 8 estimators|No official website or LinkedIn company profile has been discovered yet from initial web search results.|Not a typical mass door manufacturer, differs from Overly Door Co and Acudor Products in market and product focus|Cadwell Joinery manufactures custom wood windows and doors with pegged mortise and tenon styles and storm windows.|No current data on number of employees, leadership, or whether Div 8 estimators are employed.",,https://www.cadwellwindows.com,"Small operation, likely fewer than 10","Specialized woodworking focusing on period appropriate windows and doors, historic preservation","Cadwell Joinery is a small, specialized manufacturer and restorer of custom wood windows and doors using traditional pegged mortise and tenon joinery with a focus on historic preservation.",No,"No, Cadwell Joinery differs from typical door suppliers such as Overly Door Co. and Acudor Products, Inc. due to its artisanal scale, focus on historic restoration, and custom craftsmanship rather than mass production.","Cadwell Joinery operates as a small, artisanal woodworking shop specializing in traditional joinery methods and historic fabric preservation, focusing on custom historic windows and doors. This contrasts with the mass manufacturing and broader market focus of companies like Overly Door Co. which serve wider construction markets with standard door products.",,,,0.0,0.0
All Partitions and Parts,https://www.thomasnet.com/company/all-partitions-and-parts-30834808/profile?cov=NA&format=json&heading=23639008&limit=2589&searchsource=suppliers&searchterm=Doors&what=Doors&which=prod&coverage_area=NA&pg=71,"TROY, MI 48083",,Distributor*,,,"Distributor of restroom partition stalls and hardware. Made from laminated plastics and stainless steel materials. Products include doors, panels, grab bars, headrails, lockers, and pilasters. Dressing compartments, curtains, benches, pedestals, dividers, paper towel dispensers, hooks, and hand dryers are offered. Other products such as mirrors, racks, receptacles, vanity tops, baby changing stations, and directional signs are available.",No,Success,,False,"Confidence score 8.5 >= 7.0; Employee count 11 (from '11-50') >= 10; No estimator detected: No estimators found in titles or company details; ICP mismatch: no, because all partitions and parts acts as a distributor rather than a manufacturer like overly do; No decision makers found","{""notes"": ""All Partitions and Parts LLC is a distributor of restroom partitions and hardware specializing in laminated plastics and stainless steel products. Their product range is comprehensive, incl",8.5,"All Partitions and Parts is relevant to the door supply industry primarily as a distributor of restroom partitions and related hardware, but not as a manufacturer. They stock products from multiple brands and have a focused market segment in commercial restroom partitions and accessories. There is no public information indicating DIV 8 estimator staff, and no executives' information is currently publicly available. Further personnel identification efforts are ongoing.","No key individual contacts identified yet; further specific personnel search planned.|They distribute products from multiple brands including Accurate, Global, Hadrian, Scranton Products, etc.|Type: Partnership|LinkedIn followers: 86|No direct manufacturing; primarily a distributor|Need targeted LinkedIn searches for CEO, VP, estimator, and sales manager roles to find key decision makers|Description: Distributor of toilet partitions and restroom accessories from multiple manufacturers|All Partitions and Parts is a distributor specializing in restroom partitions and hardware located in Minnesota.|Company LinkedIn profile is https://www.linkedin.com/company/all-partitions-and-parts-llc.|ZoomInfo's page at https://www.zoominfo.com/c/all-partitions--parts-llc/7214273 returned access denied (403), limiting data from that source.|No direct evidence found of DIV 8 estimators on staff yet, follow up needed.|Offers broad product range including toilet partition stalls, doors, panels, pilasters, grab bars, headrails, lockers, restroom accessories, and hardware|Company size approx. 11-50 employees|Company products include a broad range of restroom partitions and accessories from various manufacturers.|Official company website is https://www.allpartitions.com/|Industry classification likely in commercial restroom partition sales and distribution.|Company name: All Partitions and Parts LLC|Likely different from manufacturing door suppliers like Overly Door Co. or voestalpine|All Partitions and Parts LLC is a distributor of restroom partition stalls and hardware made from laminated plastics and stainless steel.|No confirmed DIV 8 estimators identified yet; requires further LinkedIn personnel search by role.|Key decision-maker searches for CEO, VP, Sales Manager, Operations Manager have been initiated but yielded limited public info so far.|Industry classified as Wholesale|No publicly identified DIV 8 estimators on staff found.|Key contact phone: 1-866-255-8645, email: help@allpartitions.com|Management team with over 20 years of industry experience|No public listings of DIV 8 estimators on staff|Differentiated from door manufacturers like Overly Door Co. and voestalpine by product focus and market role; they distribute rather than produce doors and hardware.|Company size is approximately 14 employees; revenue <$5 million (ZoomInfo).|No CEO, Vice President, Estimator, Sales Manager, or Operations Manager currently publicly linked to the company on LinkedIn.|Their primary industry is distribution of restroom partitions and accessories rather than door or hardware manufacturing.|The LinkedIn company profile is https://www.linkedin.com/company/all-partitions-and-parts-llc but is sparsely populated currently.|All Partitions and Parts LLC is a Troy, MI based distributor specializing in restroom partitions and hardware, not a manufacturer.|Product lines include doors, panels, grab bars, headrails, lockers, pilasters, and various restroom accessories.|Website: https://www.allpartitions.com|No leadership or executive names publicly found on LinkedIn or website|Official website is https://www.allpartitions.com and LinkedIn company URL is https://www.linkedin.com/company/all-partitions-and-parts-llc.|An official website exists at https://www.allpartitions.com but lacks detailed personnel information.|Company acts as a distributor rather than manufacturer, differing from door manufacturers like Overly Door Co.|Located at 1411 Combermere Drive, Troy, MI, USA|The company operates primarily as a distributor, not a manufacturer, differentiating it from companies like Overly Door Co. and Acudor Products.|No direct emails or phone numbers publicly located yet; further role-specific LinkedIn profile searches are warranted.",https://www.linkedin.com/company/all-partitions-and-parts-llc,https://www.allpartitions.com,11-50,Building Products Distribution,"All Partitions and Parts LLC is a Troy, MI based distributor specializing in restroom partition stalls and hardware primarily made from laminated plastics and stainless steel. They distribute a broad product range including doors, panels, grab bars, headrails, lockers, pilasters, and various restroom accessories such as paper towel dispensers and baby changing stations. The company operates mainly as a distributor rather than a manufacturer, differentiating it from door manufacturers like Overly Door Co. and Acudor Products.",No,"No, because All Partitions and Parts acts as a distributor rather than a manufacturer like Overly Door Co., Acudor Products, or voestalpine Roll Forming Corporation. Their focus is on restroom partitions and accessories distribution, differing from door manufacturing producers.","The company differs from other door suppliers as it is not involved in manufacturing doors or hardware but distributes restroom partitions and related accessories from multiple manufacturers. This distribution role, product focus on restroom partitions rather than general doors, and service orientation make it distinct from manufacturers like Overly Door Co. who produce doors and door hardware directly.",,,,0.0,0.0
Gilwin Company,https://www.thomasnet.com/company/gilwin-company-30756498/profile?cov=NA&format=json&heading=23639008&limit=2589&searchsource=suppliers&searchterm=Doors&what=Doors&which=prod&coverage_area=NA&pg=71,"Modesto, CA 95354",,Manufacturer*,$1 - 4.9 Mil Revenue,1990.0,"Manufacturer of vinyl windows and doors. Types include sliding, single hung and fixed windows. Insulated glass units and patio doors are also available.",No,Success,,False,"Confidence score 9.5 >= 7.0; Employee count 2 (from '2-14 employees (LinkedIn range 2-10, with 14 employees listed)') < 10; No estimator detected: No estimators found in titles or company details; ICP match: yes. gilwin company is similar to other door and window manufacturers such as overly door co. and ac; No decision makers found","{""notes"": ""Gilwin Company is a privately held manufacturer of vinyl windows and doors located in Modesto, California, specializing in sliding, single hung, and fixed windows, as well as insulated glas",9.5,"Gilwin Company is a niche, regional manufacturer specializing in vinyl window and door products with an estimated 2-14 employees. The company prioritizes customer relationships and competitive pricing. No evidence of DIV 8 estimators or C-suite executives is publicly available. Key sales and development personnel have been identified, supporting sales operations within their service territories. The company is relevant as a specialized vinyl window and door manufacturer in the wholesale building materials industry.","Company is located in Modesto, CA|LinkedIn company profile: https://www.linkedin.com/company/gilwin-co.|Key personnel identified: Dan Bedwell (Developer and Production Home Sales Rep), Jeff Machado (Territory Manager), Wanda Sai (Office Manager), Rollie Cochran (former Health and Safety Manager).|Official website: https://gilwin.com (site pages 'About Us' and 'Contact' return 404 errors).|Location: 2354 Lapham Drive, Modesto, California 95354, USA|Company size and specialization differentiate it from similar companies like Gilkey Window Co., which is larger|Key people identified are Dan Bedwell (Developer and Production Home Sales Rep) and Jeff Machado (Territory Manager).|Workforce: LinkedIn lists 14 employees with roles like Developer and Production Home Sales Rep (Dan Bedwell), Window Installer (Larry Casaus), Receptionist (Kelly Paper), but no confirmed C-suite or DIV 8 estimator role yet.|Company's products align with other door/window manufacturers but with focus on vinyl products.|Company is primarily focused on window manufacturing and supply, specializing in vinyl windows for residential applications, differentiating from other door/door frame manufacturers.|Located at 2354 Lapham Dr, Modesto, CA 95354, USA.|No current evidence found of DIV 8 estimators on staff|LinkedIn company profile: https://www.linkedin.com/company/gilwin-co|Gilwin is differentiated from other door suppliers by its product focus on vinyl residential windows and doors rather than broad door/frame/hardware manufacturing.|Further searches needed for C-suite and senior leadership with titles relevant to estimating, sales, operations|Size: Estimated 2-10 employees per LinkedIn company profile|Estimated number of employees is 2-10|Gilwin Company is a small vinyl window and door manufacturer based in Modesto, CA.|Industry: Wholesale Building Materials|Official website: https://gilwin.com|Facebook page inaccessible via scraping tool; limited additional personnel data from that source.|No confirmed DIV 8 estimators on staff; requires further research.|Gilwin Co LinkedIn profile URL is https://www.linkedin.com/company/gilwin-co|Industry is Wholesale Building Materials|Website: https://gilwin.com/|LinkedIn Company Profile: https://www.linkedin.com/company/gilwin-co|Gilwin Company official website is https://gilwin.com/|Company name: Gilwin Company|Customer service: Emails sales@gilwin.com and gilwincompany@gilwin.com, phone 209-522-9775|Product offerings include vinyl sliding, single hung, fixed windows, insulated glass units, and patio doors focused on energy efficiency and durability|Products: Vinyl residential windows and doors including sliding, single hung, fixed windows, insulated glass units, patio doors, custom sizes, and specialty shapes (round, half round, rake, eyebrow, arches). Does not build casement or garden windows.|Gilwin Company manufactures vinyl windows and doors including sliding, single hung, fixed windows, patio doors, and insulated glass units.|Estimated company size: 2-10 employees per LinkedIn, consists of approx. 14 employees listed on LinkedIn.|No C-suite executives (CEO, COO, CFO) identified on public LinkedIn profiles; searches returned no concrete leads.|Facebook page exists (https://www.facebook.com/157349230797865) but limited information available due to scraper restrictions.|Company industry is Wholesale Building Materials focused on vinyl windows and doors.|Gilwin Company is similar to other door/window manufacturers like Overly Door Co. and Acudor Products, Inc. due to product lines and market focus.|The company manufactures sliding, single hung, and fixed vinyl windows, along with insulated glass units and patio doors.|Industry: Manufacturing (specializing in vinyl windows and doors).|Contact numbers and generic sales emails are available on the company website.|Gilwin Company manufactures vinyl windows and doors including sliding, single hung, fixed windows, insulated glass units, and patio doors.|Estimated company size is very small, likely under 20 employees, focusing on regional sales in California.|No evidence of DIV 8 estimators on LinkedIn or public profiles.|Has a Facebook page: https://www.facebook.com/157349230797865|Industry classified as Wholesale Building Materials.|Company contact phone number found: 209-522-9775; generic sales and info emails indirectly referenced: sales@gilwin.com, gilwincompany@gilwin.com.|No direct evidence of DIV 8 door/hardware estimators on staff found.|No publicly identifiable C-suite executives or DIV 8 estimators found; company appears privately held with limited public leadership visibility.|Identified one employee profile: Larry Casaus - Window Installer at Gilwin Co.",https://www.linkedin.com/company/gilwin-co,https://gilwin.com,"2-14 employees (LinkedIn range 2-10, with 14 employees listed)",Wholesale Building Materials,"Gilwin Company is a small, privately held manufacturer of vinyl windows and doors based in Modesto, California. They specialize in sliding, single hung, and fixed vinyl windows, insulated glass units, and patio doors, serving primarily the central and northern California residential market with a focus on new construction and retrofit applications.",No,"Yes. Gilwin Company is similar to other door and window manufacturers such as Overly Door Co. and Acudor Products, Inc. due to its product focus on vinyl windows and doors, regional California market presence, and customer-centric approach, though it differs in company size and specialized product lineup.","Gilwin Company differs from many door suppliers by focusing exclusively on vinyl residential windows and doors rather than broader door/frame/hardware manufacturing. The company operates regionally in California, emphasizing customer service, high-quality construction, and competitive pricing. Unlike larger competitors, its small size and limited leadership visibility set it apart, but the product line and market focus align with similar manufacturers.",,,,3.0,0.0
