companyName,profileUrl,location,logoUrl,companyType,revenue,establishedYear,description,isVerified,api_enrichment_status,api_error_message,is_qualified,qualification_reason,api_raw_response_preview,api_confidence_score,api_notes,api_findings,api_company_linkedin,api_website,api_num_employees,api_industry,api_short_summary,api_has_div8_estimators,api_icp_match,api_logic,api_lead_linkedin_profiles,api_decision_makers,api_estimator_leads,api_lead_count,api_relevant_lead_count
"House of Glass, Inc.",https://www.thomasnet.com/company/house-of-glass-inc-30981010/profile?cov=NA&format=json&heading=23639008&limit=2589&searchsource=suppliers&searchterm=Doors&what=Doors&which=prod&coverage_area=NA&pg=70,"Aberdeen, SD 57401",/_sda/_next/image?url=https%3A%2F%2Fcdn.thomasnet.com%2Fritekit%2Fhouse-of-glass.com.png&w=256&q=75,Custom Manufacturer*,$5 - 9.9 Mil Revenue,,"Custom manufacturer of glass and doors. Storefront, curtain wall, window, and glass entrances are offered. Automatic, commercial garage, aluminum, and industrial doors are available. Paints are also provided.",No,Success,,False,"Confidence score 8.5 >= 7.0; Employee count 50 (from '50') >= 10; Has estimator: Found estimator in employee titles; ICP mismatch: no; the company differs from typical door-only manufacturers like overly door co., acudor products, ; No decision makers found","{""notes"": ""House of Glass, Inc. is a custom manufacturer and installer of glass and doors, located in Aberdeen, South Dakota, with an estimated 50 employees. Their product offerings include storefront",8.5,"Though not a typical door supplier manufacturer, House of Glass, Inc. is relevant to the door manufacturing industry because it provides various door products alongside broader glass solutions and professional estimating services. Their leadership and key personnel have been identified and linked to verified roles, supporting company association and operational capacity in door and glass projects.","Official website is https://house-of-glass.com; contact email sales@hginc.biz and phone (605) 225-2010.|Key personnel include Stan Albrecht (President), Kevin Brick (General Manager), Rob Fortin (Overhead Door Manager), Aaron Rempher (Estimator), Evan Vostad (Estimator/Operations), and Melanie Rogers (Interior Design Consultant).|Official website found: https://house-of-glass.com|Several potential key personnel identified via LinkedIn searches include Leon Cruz (VP), Matthew Cooney (President), and Joe Quail (General Manager), but confirmation of their current status and affiliation with 'House of Glass, Inc.' (East Syracuse) is pending.|Official website: https://house-of-glass.com|Primary industry: Glass and door manufacturing and installation; residential and commercial renovations|Has DIV 8 estimators: Yes, confirmed estimators on staff, including Aaron Rempher and Evan Vostad, though there is no explicit published confirmation of DIV 8 certification|LinkedIn profiles found for House of Glass relate to different entities in NY or Florida or Illinois; no direct LinkedIn profile for Aberdeen, SD company found.|They have about 50 employees, operate locally within a 150-mile radius of Aberdeen, SD, and offer both residential and commercial renovation projects.|The company specializes in custom manufacturing and installation of glass and doors, including storefront, curtain walls, various door types, paint, and hardware for residential and commercial clients.|Company LinkedIn page: https://www.linkedin.com/company/house-of-glass|Notes: While not a typical door supplier manufacturer, they are relevant because they supply various door products alongside glass solutions and have professional estimators likely capable of providing detailed bid proposals for door and glass projects. Their leadership and key personnel and estimators have been identified, connecting professional LinkedIn profiles to validate company association.|No direct contact or personnel information identified yet; targeted LinkedIn searches necessary to find decision-makers and specialists.|Logic: The company's broader portfolio including glass and custom installation services and their regional market focus differentiate them from other door suppliers and manufacturers focused solely on door products and large-volume supply|Social media includes Facebook, Instagram, Pinterest for additional marketing presence.|Further research steps involve scraping the company LinkedIn page and official website for accurate employee counts and detailed company info, followed by targeted LinkedIn profile searches for key decision-makers with role validation.|No verified LinkedIn company profile for the Aberdeen entity; existing https://www.linkedin.com/company/house-of-glass is a different entity in NY.|Company's product and service offerings align with door manufacturers but also include more extensive glass solutions, making them somewhat broader in market focus than some purely door manufacturers.|House of Glass, Inc. manufactures custom glass doors and storefronts including curtain walls, commercial garage doors, aluminum doors, and various industrial doors.|House of Glass, Inc. (Aberdeen, SD) is a custom manufacturer specializing in glass and door products including storefronts, curtain walls, windows, automatic doors, commercial garage doors, aluminum and industrial doors, paint, and hardware.|Short summary: Custom manufacturer and installer of glass and doors offering a broad product range including storefronts, curtain walls, windows, automatic and commercial doors, industrial doors, paints, and hardware with an emphasis on local custom service|House of Glass, Inc. is a niche manufacturer specializing in custom glass and door solutions, serving commercial clients with storefronts, curtain walls, windows, glass entrances, and various doors including automatic and industrial types.|ICP match: No exact match with door-only manufacturers like Overly Door Co. Their integration of glass manufacturing and installation, plus paints and a regional custom service, make them distinct|Key decision-maker LinkedIn profiles at Aberdeen location are not publicly identified; LinkedIn profiles known belong to similarly named but geographically distinct companies.|The company provides thermal entrances, windbreaks, and custom aluminum entrances, signifying a broad product portfolio within the glass and door manufacturing sector.|Company differs from large door manufacturers in combining glass functionality, custom service, and paint/hardware supply, positioning it as a local, service-oriented supplier/installer.|Approximate number of employees: 50|They likely differ from standard door manufacturers by offering broader glass-related services and customized solutions beyond doors.|No direct evidence found on employment of DIV 8 estimators; however, the presence of a skilled estimator role (Matthew Cooney) suggests some capability in that area.|Company website https://house-of-glass.com provides comprehensive product and service listings and contact info: sales@hginc.biz, (605) 225-2010.|House of Glass, Inc. is located at 2 North State Street, Aberdeen, SD 57401 with about 50 employees.|No explicit public evidence of DIV 8 estimators on staff, though company offers estimating services as implied by 'Request a Free Estimate' on website.|Still need to locate the company's LinkedIn profile for accurate employee count, industry information, and key personnel data.|LinkedIn profiles searched by role show key contacts primarily in operational and management roles rather than C-suite (except President).|They use CHI brand for commercial garage doors, indicating a partnership or brand preference.|No direct CFO or COO profiles linked to Aberdeen entity were definitively found.|The company differs from mass door manufacturers by integrating glass artistry and paint/hardware supply with local, customized installation services.|No current evidence they employ DIV 8 estimators; further research required.|The company operates in the Glass, Ceramics and Concrete Manufacturing industry, with headquarters in East Syracuse, New York, and appears self-owned and relatively small in employee count.|No explicit confirmation of DIV 8 estimators but estimating services are offered, suggesting some in-house cost estimation expertise.|A LinkedIn company profile exists at https://www.linkedin.com/company/house-of-glass but with limited public information, listing only 1 employee, indicating incomplete or outdated data.",https://www.linkedin.com/company/house-of-glass,https://house-of-glass.com,50,"Glass, Ceramics and Concrete Manufacturing; custom glass and door manufacturing and installation","Custom manufacturer and installer of glass and doors offering a broad product range including storefronts, curtain walls, windows, automatic and commercial doors, industrial doors, paints, and hardware with an emphasis on local custom service.","Yes, confirmed estimators on staff including Aaron Rempher and Evan Vostad, though explicit DIV 8 certification is not publicly confirmed.","No; the company differs from typical door-only manufacturers like Overly Door Co., Acudor Products, Inc., and voestalpine Roll Forming Corporation due to its integration of comprehensive glass manufacturing and installation services alongside door products and paint/hardware supply.","House of Glass, Inc. is distinct for combining custom glass manufacturing, extensive door products, and installation services with local, customized service rather than mass production or large-volume supply. Their broader portfolio, including paints and hardware, plus their regional market focus targeting residential and commercial renovations, differentiates them from other door suppliers that focus solely on door products.",,,,6.0,0.0
JAG Glass,https://www.thomasnet.com/company/jag-glass-30981106/profile?cov=NA&format=json&heading=23639008&limit=2589&searchsource=suppliers&searchterm=Doors&what=Doors&which=prod&coverage_area=NA&pg=72,"Haltom City, TX 76111",,Custom Manufacturer*,,,"Custom manufacture of glass. Storefront, insulated, automatic door, mirror, enclosures, window wall, curtain wall, and cabinetry glass are available. Installation and replacement services are offered.",No,Success,,False,"Confidence score 9.0 >= 7.0; Employee count 11 (from 'Estimated 11-50 employees') >= 10; No estimator detected: No estimators found in titles or company details; ICP match: partial. jag glass is somewhat similar to door suppliers like overly door co. and acudor products, i; No decision makers found","{""notes"": ""JAG Glass, LLC is a commercial glass manufacturing and glazing company based in Haltom City, Texas, serving the Dallas-Fort Worth area. The company was founded in 2022 and employs an estima",9.0,"JAG Glass is relevant to the door supply/manufacturing industry to the extent that they supply commercial and automatic doors integrated with their glazing products. Their core competency lies in commercial glass manufacturing and installation, serving as a complementary partner in door-related building construction rather than a direct door manufacturer competitor.","No direct contact emails or phone numbers for personnel are publicly listed; LinkedIn profiles provide best lead data sources.|No evidence found of DIV 8 estimators employed at the company, indicating limited or no dedicated door/frame/hardware cost estimating roles.|No specific information about key decision-makers or staff contacts found so far.|Justin Whittington serves as Vice President handling sales and operations.|Located in Dallas-Fort Worth Metroplex, Texas.|Website: https://jag-glass.com/|Small team with key leadership: Owners August Kuklewski and Steven Van Eman.|Key leadership includes Owner and Co-Founder August Kole Kuklewski, Co-Founder Steven Van Eman (a former GC superintendent), and Project Manager Justin Whittington with 19+ years in sales and operations.|No estimates of employee count or confirmation of employing DIV 8 estimators are available yet.|JAG Glass specializes in custom manufacturing of glass products including storefront, insulated glass, automatic doors, mirrors, enclosures, window walls, curtain walls, and cabinetry glass.|No direct contact information or social media links identified from the initial search.|Key People: August Kole Kuklewski (Owner), Steven Van Eman (Co-founder), Justin Whittington (VP and Project Manager), Derek Nelson (role unspecified).|Short Summary: Commercial glass manufacturing and glazing company specializing in storefronts, insulated glass, automatic doors, mirrors, enclosures, window walls, curtain walls, cabinetry glass, installation, and replacements.|No official company website or LinkedIn profile was identified in the search results provided.|Not a direct door manufacturer but supplies glass for automatic and storefront doors.|Their services include storefront, insulated glass, automatic doors, mirrors, enclosures, window walls, curtain walls, and cabinetry glass, focusing on new construction, renovations, repairs, and replacements.|Instagram Profile: http://instagram.com/jag_glass|Company Name: JAG Glass, LLC|ICP Match: Partially yes - while JAG Glass is broader as a commercial glazing company and not specialized solely in doors, they do supply commercial doors and related glass products, overlapping somewhat with door manufacturers like Overly Door Co.|Focus on new construction, renovations, repairs, replacement services for commercial glass.|Products and Services: Curtain walls, window walls, glass storefronts, office partitions, commercial glass doors, glass showers, mirrors, enclosures, cabinetry glass; installation and replacement services|JAG Glass, LLC is a commercial glass manufacturing and installation company based in Haltom City, Texas, founded in 2022.|Industry: Commercial Glass Manufacturing and Glazing Contractor|Notes: JAG Glass is relevant as a commercial glazing and glass manufacturer/installer with some door product overlap, making them a potential partner or supplier in commercial construction projects, but they differ by offering a wider product array beyond doors.|LinkedIn Company Profile: http://linkedin.com/company/jag-glass-llc|No explicit mention of DIV 8 estimators on staff but presence of project management and operations leadership suggests some estimating capability.|Location: 2301 Higgins Lane, Haltom City, Texas 76111, USA|Company operates in commercial glazing and glass installation.|Industry: Glass Product Manufacturing|Key contacts not identified in current data; need next steps to gather leadership and decision-maker contacts, focusing on those with relevant titles (CEO, COO, VP, Director, Estimator, Sales, Operations, Purchasing).|DIV 8 Estimators: No explicit mention found|Website: https://jag-glass.com|The company is somewhat similar to door suppliers like Overly Door Co. in that it offers automatic door services but primarily focuses on glass products, making it a complementary rather than a direct competitor or substitute.|Location: 2301 Higgins Lane, 600, Haltom City, Texas, US|Contact: Phone (817) 773-5140, Email steven@jag-glass.com (likely co-founder)|The company employs approximately 11-50 people according to LinkedIn data, with 4 profiles publicly listed.|Logic: Similar in their supply of commercial doors but JAG Glass provides wider glass and glazing products and installation services, indicating a broader market focus and service offering than pure door suppliers.|Employee Count: Not explicitly stated; further search needed|No direct evidence of DIV 8 Estimators employed, but roles indicate capability in estimating.|LinkedIn Company Page: http://linkedin.com/company/jag-glass-llc|Unable to confirm similarity to other door suppliers/manufacturers due to lack of data.|ICP Match: Partial. Provides doors but primarily a glazing contractor, not a pure door supplier.|Offers installation and replacement services for these glass products.|Estimated Employees: 11-50 (LinkedIn)|JAG Glass emphasizes quality craftsmanship, customer service, transparency, proactive communication, and project management.",http://linkedin.com/company/jag-glass-llc,https://jag-glass.com/,Estimated 11-50 employees,Glass Product Manufacturing,"Commercial glass manufacturing and glazing company specializing in storefronts, insulated glass, automatic doors, mirrors, enclosures, window walls, curtain walls, cabinetry glass, installation, and replacement services.","No explicit DIV 8 estimators were identified on staff; however, project management and operations roles suggest some estimating capability related to door, frame, and hardware components.","Partial. JAG Glass is somewhat similar to door suppliers like Overly Door Co. and Acudor Products, Inc. because they provide commercial doors and automatic doors. However, their primary focus is broader on commercial glazing and glass products, not exclusively door manufacturing.","JAG Glass differs from pure door manufacturers by offering a wide range of commercial glazing products including curtain walls, storefronts, mirrors, and cabinetry glass, alongside installation and repair services. Their market focus is commercial construction projects emphasizing quality craftsmanship, communication, and partnership, making them broader than door-only suppliers.",,,,3.0,0.0
Coral Gables Kitchen & Bath,https://www.thomasnet.com/company/coral-gables-kitchen-bath-30173416/profile?cov=NA&format=json&heading=23639008&limit=2589&searchsource=suppliers&searchterm=Doors&what=Doors&which=prod&coverage_area=NA&pg=71,"Coral Gables, FL 33134",,Distributor*,$1 - 4.9 Mil Revenue,1996.0,"Distributor Of Hardware For Kitchens, Bathrooms & Furniture.",No,Success,,False,"Confidence score 9.5 >= 7.0; Employee count 2 (from '2-10') < 10; No estimator detected: No estimators found in titles or company details; ICP mismatch: no, because coral gables kitchen & bath is primarily a distributor and service-oriented company focu; No decision makers found","{""notes"": ""Coral Gables Kitchen & Bath operates as a distributor of hardware primarily for kitchens, bathrooms, and furniture, based in Miami, Florida. The company is small, with an estimated employee",9.5,"Coral Gables Kitchen & Bath is a family-owned, small-scale regional distributor of hardware primarily for kitchens and baths. It lacks manufacturing capabilities and does not employ DIV 8 estimators, positioning it adjacent but not directly competitive or aligned with door manufacturers or specialized hardware estimators. Key personnel include President Jesus Carrillo and sales/design and account management staff, without confirmed purchasing or operations managers or C-suite roles like CEO or COO. The company serves a niche hardware distribution and design market in the Miami area with a focus on customer service rather than manufacturing expertise.","Coral Gables Kitchen & Bath operates as a distributor for kitchen, bath, furniture hardware including door hardware; no manufacturing operations.|No evidence of DIV 8 estimators or specialized door cost estimating personnel employed.|Key decision makers identified: Jesus Carrillo (President), Dina Carrillo Quevedo (Sales/Design), Cary Unzalu (Account Manager).|Coral Gables Kitchen & Bath is a family-owned distributor of kitchen, bath and furniture hardware based in Miami, Florida.|No direct emails or phone numbers for executives or key personnel found publicly.|LinkedIn company profile: https://www.linkedin.com/company/coral-gables-kitchen-&-bath|No publicly available direct emails or phone numbers for executives found.|The company appears to be family-owned and has been operating since at least 1984.|Company size is small, approximately 2-10 employees, focused on local Miami/Coral Gables market.|Dina Carrillo Quevedo serves in sales and design, holding an MBA, suggesting professional sales leadership.|No evidence found yet of DIV 8 estimators on staff.|Key decision-makers identified: President Jesus Carrillo, Dina Carrillo Quevedo (Sales/Design), and Cary Unzalu (Account Manager).|LinkedIn company profile confirms 2-10 employees, industry is Design Services.|Company website: http://www.coralgableskitchenandbath.com|The company is a distributor, not a door manufacturer, differentiating it from Overly Door Co. and similar manufacturers.|Key personnel with LinkedIn profiles confirmed: Jesus Carrillo (President), Dina Carrillo Quevedo (Sales and Design), and Cary Unzalu (Account Manager).|Industry classification: Design Services and Hardware Distribution.|Company is a distributor for hardware related to kitchens, bathrooms, and furniture, based in Coral Gables, FL.|Industry focus is design services and hardware distribution, not door manufacturing.|No evidence of DIV 8 estimators on staff, limiting involvement in door hardware cost estimating.|LinkedIn company profile and key individual profiles collected for follow-up.|Key executives include Jesus Carrillo (President), Dina Carrillo Quevedo (Sales/Design), and Cary Unzalu (Account Manager).|Company is more a distributor and service oriented rather than a door manufacturer; limited overlap with ICP companies like Overly Door Co.|Cary Unzalu holds an account manager position, supporting client relations.|The company has 2-10 employees, led by President Jesus Carrillo.|No evidence of DIV 8 estimators or specialized door estimating roles on staff.|Coral Gables Kitchen & Bath is a small hardware distributor primarily for kitchen and bath in Miami, FL.|No direct contact emails or phone numbers for key executives publicly available from LinkedIn profiles.|They specialize in door hardware such as locks and pulls but are primarily a kitchen and bath hardware provider.|Official website discovered: http://www.coralgableskitchenandbath.com/|Company is more of a regional distributor differing from door manufacturers like Overly Door Co. due to broader product focus and smaller scale.|Official website: http://www.coralgableskitchenandbath.com/|Recent LinkedIn searches for Purchasing and Operations Managers at Coral Gables Kitchen & Bath did not find verified individuals linked to the company.|Coral Gables Kitchen & Bath is a small distributor specializing in kitchen, bathroom, and furniture hardware including door hardware, based in Miami, FL.|Company appears small with a close-knit team including sales/design and account management personnel.|LinkedIn profiles for key executives: Jesus Carrillo (https://www.linkedin.com/in/jesus-carrillo-15b70745), Dina Carrillo Quevedo (https://www.linkedin.com/in/dina-carrillo-quevedo-24389940), Cary Unzalu (https://www.linkedin.com/in/cary-unzalu-64532125b).|No public evidence of DIV 8 estimators specialized in door hardware cost estimating on staff.|Family owned, operating over 25 years in Coral Gables area.|Company size is small, approximately 2-10 employees per LinkedIn; likely under 20 total.|The official website (http://www.coralgableskitchenandbath.com) corroborates the company’s distributor and design services focus.|Company is headquartered in Coral Gables, Florida and categorized under Design Services.|Next research should focus on searching for CEO role and director/estimator roles at the company on LinkedIn to identify additional decision makers or specialized personnel.|Company LinkedIn and website confirm business focus but lack detailed staff info.|Company focuses on distribution and sales rather than manufacturing, distinguishing it from door manufacturers like Overly Door Co. or Acudor Products.|Company differs from door manufacturers like Overly Door Co. or Acudor as it is not involved in manufacturing but distribution and sales.|Jesus Carrillo is the President since 1984 and is the top known executive; no CEO separate identified yet.",https://www.linkedin.com/company/coral-gables-kitchen-&-bath,http://www.coralgableskitchenandbath.com,2-10,Design Services and Hardware Distribution,"Coral Gables Kitchen & Bath is a small, family-owned distributor specializing in kitchen, bathroom, and furniture hardware including door hardware, based in Miami, Florida. The company focuses on distribution and sales rather than door manufacturing and has been operating since at least 1984.",No,"No, because Coral Gables Kitchen & Bath is primarily a distributor and service-oriented company focusing on hardware for kitchens and baths rather than a manufacturer or specialized door hardware estimator like Overly Door Co., Acudor Products, or voestalpine Roll Forming Corporation.","The company differs from door manufacturers and suppliers as it operates mainly as a distributor and design services provider for kitchen, bath, and furniture hardware, including door hardware like locks and pulls. It does not engage in door manufacturing or employ DIV 8 estimators who specialize in door, frame, and hardware cost estimating. Its market focus is regional (Miami/Coral Gables) and small scale with approximately 2-10 employees, contrasting with larger manufacturing companies specializing in door products and estimating.",,,,3.0,0.0
