companyName,profileUrl,location,logoUrl,companyType,revenue,establishedYear,description,isVerified,api_enrichment_status,api_error_message,is_qualified,qualification_reason,api_raw_response_preview,api_confidence_score,api_notes,api_findings,api_company_linkedin,api_website,api_num_employees,api_industry,api_short_summary,api_has_div8_estimators,api_icp_match,api_logic,api_lead_linkedin_profiles,api_decision_makers,api_estimator_leads,api_lead_count,api_relevant_lead_count
"A&H Sales, Inc.",https://www.thomasnet.com/company/a-h-sales-inc-30758457/profile?cov=NA&format=json&heading=23639008&limit=2589&searchsource=suppliers&searchterm=Doors&what=Doors&which=prod&coverage_area=NA&pg=71,"Roswell, GA 30076",,Manufacturers' Rep*,$1 Mil Revenue,1995.0,"Manufacturer’s representative of cabinets for construction sectors. Shelving, mirrors, door hardware, shower and garage doors are also available.",No,Success,,False,"Confidence score 8.5 >= 7.0; Employee count 9 (from 'Approximately 9 employees (ZoomInfo data), LinkedIn cites 2-10 employees') < 10; No estimator detected: No estimators found in titles or company details; ICP mismatch: no. the company differs from direct door suppliers and manufacturers such as overly door co., acudor; No decision makers found","{""notes"": ""A&H Sales, Inc. is headquartered at 5010 Old Ellis Pt, Roswell, Georgia, 30076, United States. It operates as a manufacturer's representative company specializing in cabinets, shelving, mir",8.5,Relevant to the door supply/manufacturing industry only as a representative firm; no direct manufacturing or in-house estimating for Division 8 products confirmed. Key leadership includes President Steve Steinberg and Operations Manager John Pocchio. Website is currently down limiting direct data access. Estimated to be a small firm (approx. 9 employees) with focus on sales and operations in construction product representation. Contact details require further discovery from ZoomInfo.,"LinkedIn profile information for key personnel exists but profiles require detailed scraping to confirm titles and contact info.|No confirmed Division 8 estimators identified on staff yet, though further search is needed.|No direct manufacturing operations found; the company is a manufacturer's representative, differentiating it from direct door manufacturers like Overly Door Co., Acudor Products, or voestalpine Roll Forming Corporation.|A&H Sales, Inc. is a manufacturer's representative focusing on cabinets, shelving, mirrors, door hardware, shower, and garage doors for construction sectors.|Official website ahsales.com is currently down, limiting direct access to company data.|Official website located at http://www.ahsales.com/, an Atlanta-based manufacturer's representative focusing on cabinets, shelving, mirrors, door hardware, shower doors, and garage doors.|Company operates as a manufacturer's representative specializing in cabinets, shelving, mirrors, door hardware, shower and garage doors for construction sectors.|Official website of A&H Sales, Inc. not yet identified.|Steve Steinberg is President and a key decision-maker with a LinkedIn profile at https://www.linkedin.com/in/steve-steinberg-817a38b.|No explicit LinkedIn company profile was scraped yet; URL https://www.linkedin.com/company/a-&-h-sales-inc may be valid for further employee identification.|The company's official website, ahsales.com, is currently unavailable (503 error), limiting direct access to company details.|The company’s industry is construction supply focusing on door hardware and related cabinetry representation.|The official company website (http://www.ahsales.com) is currently down (503 error), limiting information access.|The company has approximately 9 employees per ZoomInfo; LinkedIn lists 2-10 employees with minimal followers.|Company is primarily a manufacturer's representative and not a direct manufacturer, differentiating it from similar companies like Overly Door Co.|A&H Sales, Inc. is a manufacturer's representative company based in Roswell, GA, specializing in cabinets, shelving, mirrors, door hardware, shower doors, and garage doors.|Emails and phone numbers of key personnel are not currently available publicly, but may be found on platforms like ZoomInfo.|No explicit evidence found that A&H Sales employs Division 8 estimators; further probing required.|Key executives include Steve Steinberg (President) and Carmen Onde (President), with John Pocchio as Operations Manager.|Contact information like emails and phone numbers for executives are not publicly listed; further discovery needed to obtain these details.|No confirmation found of Division 8 estimators on staff.|A&H Sales, Inc. is a manufacturer’s representative for cabinetry, door hardware, shelving, mirrors, shower, and garage doors in the Southeast US, headquartered in Roswell, Georgia.|Steve Steinberg identified as President of A & H Sales, Inc., based in Roswell, via LinkedIn profile https://www.linkedin.com/in/steve-steinberg-817a38b.|LinkedIn profiles provide location as Roswell, Georgia, USA, which aligns with company location verification.|No comprehensive LinkedIn company profile under ""A&H Sales, Inc."" identified so far.|John Pocchio identified as Operations Manager at A&H Sales with LinkedIn profile https://www.linkedin.com/in/john-pocchio-2104a541.|A&H Sales differs from door manufacturers as it acts as a representative not directly manufacturing products, but has overlap with door suppliers through hardware and door products.|John Pocchio is Operations Manager with LinkedIn profile https://www.linkedin.com/in/john-pocchio-2104a541; less publicly available contact info.|Steve Steinberg is the President of A&H Sales, Inc. with over 30 years at the company and prior experience at The Overhead Door Company, indicating strong industry expertise.|John Pocchio serves as Operations Manager, suggesting senior operational role within the company.|No available data on estimated number of employees or presence of division 8 estimators.|No confirmed Division 8 estimators found; role presence unknown.|Estimated number of employees and industry classification remain unconfirmed; likely a smaller manufacturer's rep firm in construction products.|Contact details for key people (emails, phones) are listed on ZoomInfo and need to be scraped for outreach.|The company operates as a rep rather than a direct manufacturer unlike similar companies such as Overly Door Co. or Acudor Products, indicating a different business model.|No LinkedIn company profile for A&H Sales, Inc. identified yet.|No LinkedIn employee profiles found for key decision-makers.|Company has approximately 9 employees based on ZoomInfo data.",https://www.linkedin.com/company/a-&-h-sales-inc,http://www.ahsales.com,"Approximately 9 employees (ZoomInfo data), LinkedIn cites 2-10 employees","Manufacturer's representative specializing in construction products including cabinets, shelving, mirrors, door hardware, shower and garage doors","A&H Sales, Inc. is a manufacturer's representative based in Roswell, GA, focusing on cabinet and door-related products for the construction sector, serving mainly multifamily builders in the Southeast US. They represent various products including cabinetry, shelving, mirrors, door hardware, shower and garage doors without direct manufacturing operations.",No confirmed Division 8 estimators employed on staff,"No. The company differs from direct door suppliers and manufacturers such as Overly Door Co., Acudor Products, Inc., and voestalpine Roll Forming Corporation because A&H Sales operates as a manufacturer's representative rather than manufacturing products directly, although it deals in door hardware and doors.","A&H Sales is primarily a manufacturer's representative specializing in cabinetry and related products including door hardware and doors, supporting construction sectors mainly through representation and sales rather than direct manufacturing. This business model separates them from typical door manufacturers and suppliers who produce items in-house. Their market focus is on providing construction sectors in the Southeast with cabinetry and door hardware solutions, but they do not directly manufacture these products.",,,,3.0,0.0
All Partitions and Parts,https://www.thomasnet.com/company/all-partitions-and-parts-30834808/profile?cov=NA&format=json&heading=23639008&limit=2589&searchsource=suppliers&searchterm=Doors&what=Doors&which=prod&coverage_area=NA&pg=71,"TROY, MI 48083",,Distributor*,,,"Distributor of restroom partition stalls and hardware. Made from laminated plastics and stainless steel materials. Products include doors, panels, grab bars, headrails, lockers, and pilasters. Dressing compartments, curtains, benches, pedestals, dividers, paper towel dispensers, hooks, and hand dryers are offered. Other products such as mirrors, racks, receptacles, vanity tops, baby changing stations, and directional signs are available.",No,Success,,False,Confidence score 8.5 >= 7.0; Employee count 14 (from 'Approximately 14-23') >= 10; No estimator detected: No estimators found in titles or company details; ICP mismatch: no. while the company partially overlaps with door suppliers/manufacturers by offering doors and har; No decision makers found,"{""notes"": ""All Partitions & Parts, LLC is a Michigan-based distributor specializing in restroom partitions and supporting hardware with over 23 years of operation. Their product portfolio includes lam",8.5,"The company is primarily a distributor specializing in restroom partitions and hardware with over 23 years of operations and a small employee base. It has limited online executive presence and no confirmed internal Division 8 estimators, relying on external estimation resources likely. It is distinct from door manufacturers with a niche product focus and B2B distribution model.","Distinct from door manufacturers like Overly Door Co. or Acudor Products who produce doors; this company focuses on distribution and related parts.|Provides detailed product specifications, installation instructions, and design assistance on their website.|Company: All Partitions & Parts, LLC|Management listed as Ms. Deborah Berschbach, who might be a key decision-maker; no direct email or detailed contact found.|Customer support available via phone (1-866-255-8645) and email (help@allpartitions.com).|No dedicated LinkedIn company profile found; limited online presence for executive or decision-maker contacts.|BBB Rating: A+ accredited since 2006|No LinkedIn profiles located for executives or estimators despite focused searches.|Company is 'All Partitions and Parts', a distributor of restroom partition stalls and hardware.|No public LinkedIn profiles for CEO or senior executives found; management contact includes Deborah Berschbach (unverified LinkedIn)|Product Focus: Distribution of laminated plastic and stainless steel restroom partitions, hardware, and accessories|ICP Match: Partial match with door suppliers/manufacturers but primarily a distributor with broader restroom hardware offerings|All Partitions & Parts, LLC is a BBB accredited business since 2006 with an A+ rating.|Company's product range and distribution focus make it similar but not identical to typical door manufacturers or suppliers like Overly Door Co.|Contact Email: help@allpartitions.com|Founded in 2001, organized as an LLC, with 23 years in business.|BBB accredited business located in Troy, Michigan.|All Partitions and Parts LLC is a distributor specializing in restroom partitions and hardware with approx. 14 employees.|Need to validate any future leads to ensure they work specifically at All Partitions and Parts and not similarly named companies.|Company has over 40 years in business serving contractors and repair men, focused on restroom partitions rather than general door manufacturing.|No explicit info on number of employees or whether they have Division 8 estimators.|Contact phone is 1-866-255-8645, email help@allpartitions.com, but no LinkedIn company page or employee data located yet.|Offers restroom accessories including grab bars, headrails, lockers, benches, curtains, baby changing stations, and directional signs.|Operates primarily as a distributor, not a manufacturer; products made from laminated plastics, stainless steel, and metals.|The company focuses on distribution rather than manufacturing, potentially differing from similar firms like Overly Door Co. and Acudor Products, Inc.|Contact Phone: 1-866-255-8645, (248) 435-8526|No explicit data yet on number of employees or presence of DIV 8 estimators at the company.|No key individuals identified yet; need to perform focused LinkedIn searches for executive and relevant decision-maker roles.|Located in Troy, MI, operating as a wholesale industrial products distributor specializing in restroom partitions, hardware, and accessories.|Estimated Employees: Approximately 14-23|Company Website: https://www.allpartitions.com/|No evidence of in-house Division 8 estimators on staff; estimating likely done externally or by contractors.|Product portfolio includes doors, panels, grab bars, headrails, lockers, pilasters, bathroom accessories, and replacement hardware.|Next step requires LinkedIn research to identify key personnel and confirm company details.|Contact phone number is 1-866-255-8645 and email help@allpartitions.com from the website.|Overall, it is a distributor with a broader product scope beyond just doors and frames.|The company accepts purchase orders from institutions such as schools and hospitals, indicating a B2B focus.|Products include tampon-resistant partitions made from laminated plastics, stainless steel, powder coated steel, plastic laminate, and phenolic materials.|Industry: Distribution of restroom partitions and commercial hardware|All Partitions and Parts is a distributor specializing in restroom partition stalls and hardware made from laminated plastics and stainless steel.|The company differs from door manufacturers as it distributes partitions and hardware specifically for restrooms, not general doors.|No detected DIV 8 estimators on staff - likely uses external estimating resources|Company scale and online presence suggest small to medium enterprise with limited public executive profiling|Location: Troy, Michigan, 48083|Company's official website is https://www.allpartitions.com/ offering a wide range of restroom partition products including doors, panels, grab bars, lockers, and accessories.|No ZoomInfo data accessible, limiting insight into employee count and detailed organizational structure.|No evidence of DIV 8 estimators on staff, indicating possible absence of specialized estimating roles.|Official website is https://www.allpartitions.com with extensive product and resource sections.",https://www.linkedin.com/company/all-partitions-parts-llc,https://www.allpartitions.com/,Approximately 14-23,Distribution of restroom partitions and commercial hardware,"All Partitions and Parts is a Michigan-based distributor specializing in restroom partitions and related hardware made from laminated plastics and stainless steel. Serving contractors and institutions primarily in a B2B model, they offer a broad range of restroom partition products and accessories. Founded in 2001, the company holds an A+ BBB rating and operates with a small-to-medium enterprise scale.",No,"No. While the company partially overlaps with door suppliers/manufacturers by offering doors and hardware, it primarily operates as a distributor focusing on restroom partitions and accessories rather than manufacturing doors like Overly Door Co., Acudor Products, and voestalpine Roll Forming Corporation.","All Partitions and Parts differs from door manufacturers because it focuses on distribution of laminated plastic, stainless steel, and metal restroom partitions and accessories rather than manufacturing doors. Its market focus is on contractors and institutional customers rather than broader door markets. The company emphasizes products related to restroom hardware, while door manufacturers concentrate on door fabrication and supply.",,,,1.0,0.0
Smithcodoors.com,https://www.thomasnet.com/company/smithcodoors-com-30195192/profile?cov=NA&format=json&heading=23639008&limit=2589&searchsource=suppliers&searchterm=Doors&what=Doors&which=prod&coverage_area=NA&pg=71,"Roseville, CA 95747",,Distributor*,,,Distributor of doors including accordion fold & accordion fold fire doors.,No,Success,,False,"Confidence score 9.5 >= 7.0; Employee count 15 (from 'Approximately 15 employees') >= 10; Has estimator: Found estimator in employee titles; ICP match: yes. this company is similar to overly door co., acudor products, inc., and voestalpine roll forming; No decision makers found","{""notes"": ""Smithcodoors.com, officially operating as The Smith Company, Inc., is a commercial door distributor and contractor based in Loomis, California, specializing in a wide range of commercial do",9.5,"Smithcodoors.com is a relevant and established specialty commercial door distributor/contractor with notable expertise and strong regional focus. Employing experienced DIV8 estimators and offering a broad range of rated door products and integrated services, they stand out in the commercial door market. The lack of an active company LinkedIn page is mitigated by detailed individual professional profiles and available contact information.","Industry: Specialty Commercial Door Distributor and Contractor|Emphasis on fire, smoke, sound, wind, and seismic resistance ratings|Emails and phone numbers available from official site and ZoomInfo for direct outreach.|Additional leads to be found through the company's LinkedIn page and internet searches for individual key roles.|Company Name: Smith Co Doors (Smith Company, Inc.)|Employee count: Approximately 15 employees.|Location: 3311 Swetzer Road, Loomis, CA 95650|Estimated Employees: Not explicitly stated, assumed small to mid-size skilled workforce|Has DIV 8 estimators on staff, specifically Greg Boom.|Services: Sales, installation, service, architectural design consultation, project engineering, 24/7 emergency service|ICP Match: Yes, similar to Overly Door Co., Acudor Products, Inc., voestalpine Roll Forming Corporation due to product focus and specialty doors distribution and installation|Multiple product pages and about us pages identified for deep scraping to extract more company insights.|Estimated employee count around 15; experienced staff with over 150 combined years and 10,000 projects completed.|ICP match: Yes, similar to Overly Door Co., Acudor Products, Inc., voestalpine Roll Forming Corporation|Key personnel identified: Gerry Kearney (President), Greg Boom (Estimator & Sales Manager), James McGown (Project Engineer), Liza Jane Kearney (Accounting).|Location: 3311 Swetzer Road, Loomis, CA 95650, USA.|Company specializes in coiling overhead doors, grilles, shutters, side folding accordion doors, and fire-rated rolling fire doors.|Industry: Specialty commercial door distribution and installation, including rated and non-rated door systems, closures, and partitions.|Company differentiators: Regional focus on California with extensive installation and consulting capabilities, including 24/7 emergency service; strong manufacturer relationships; over 10,000 projects completed with no liens.|Emails and phone contact formats confirmed from official website and personnel info: gerrykearney@smithcodoors.com, gregboom@smithcodoors.com, phone 916-772-3777.|Smith Co Doors located in Loomis, CA is a distributor and contractor specializing in a wide range of rated and non-rated door systems including fire, smoke, sound, wind rated doors, and specialty closures.|Likely employs DIV 8 estimators (Estimator role present)|Manufacturer Partners: Cornell Iron Works, CHI Overhead Door, RYTEC|Partnerships with Cornell Iron Works, CHI Overhead Door, and RYTEC|Notable decision-makers: Gerry Kearney (President), Greg Boom (Estimator/Sales Manager)|Key personnel identified: Gerry Kearney (President), Greg Boom (Estimator), Liza Jane Kearney (Accounting), James McGown (Project Engineer).|Key manufacturers partnered: Cornell Iron Works, CHI Overhead Door, RYTEC.|Provides sales, installation, architectural consultation, project engineering, and emergency support|Smith Co Doors website: https://smithcodoors.com/|Differentiated by regional focus (California) and full-service approach including installation and consulting|Offers: Sales, installation, design consulting, and emergency services for commercial door products.|Products serve commercial and safety-critical applications with an emphasis on fire and smoke rating, sound control, and security.|Gerry Kearney LinkedIn page is dead but contact info available: gerrykearney@smithcodoors.com, phone 916-772-3777|Greg Boom LinkedIn: https://www.linkedin.com/in/greg-boom-8729501a|Completed Projects: Over 10,000 projects in 20 years with no liens|ICP match: Yes, similar to other door suppliers but more focused on integrated services in California.|Company employs DIV 8 estimators, indicating capability in detailed door, frame, and hardware cost estimating.|Key People: Gerry Kearney (President), Greg Boom (Estimator), Liza Jane Kearney (Accounting), James McGown (Project Engineer)|Website: https://smithcodoors.com|Staff Experience: Over 150 years of collective experience|Company name: Smithcodoors.com, formally The Smith Company, Inc.|Smith Co Doors differentiates from competitors by regional focus, combined services (sales, installation, architectural consulting, project engineering) and 24/7 emergency services.|Industry: Commercial door distribution and installation|LinkedIn company page appears to be inactive or dead; focus on individual profiles for contacts.|Estimated number of employees: ~15|Official website: https://smithcodoors.com|Located in Loomis, California|Comparable to Overly Door Co., Acudor Products, voestalpine Roll Forming Corporation but more focused on California market and comprehensive service offerings.|Offers coiling overhead doors, grilles, shutters, rolling fire doors, and specialty closures|Company differentiates with regional focus, integrated services, and solid manufacturer partnerships|Distributes and installs commercial doors including accordion fold and accordion fold fire doors|Key products: Coiling overhead doors, grilles, shutters, fire-rated doors, smoke door assemblies, sound and seismic rated doors, accordion fold and rolling fire doors.|No active or updated LinkedIn company profile found yet; individual LinkedIn profiles for key personnel discovered for further validation.|DIV 8 estimator employed: Greg Boom, Estimator/Sales Manager|Emails available on website for key personnel|Product Types: Non-rated and rated doors including fire, smoke, sound, wind, seismic rated doors; coiling overhead doors, grilles, shutters; commercial sectional doors; side folding accordion doors; counter doors; rolling fire doors; specialty closures.|Company Name: The Smith Company, Inc. operating as Smithcodoors.com|Company industry likely falls within commercial door manufacturing/distribution and installation.|Company description matches distributor and installer of various door types including accordion fold fire doors.|Approximately 15 employees with extensive industry experience|No active LinkedIn company page found, reliance on individual profiles for outreach|No direct information found yet on employee count or presence of DIV 8 estimator professionals.|LinkedIn profile of the company not located yet; important for employee and leadership details.",,https://smithcodoors.com,Approximately 15 employees,Commercial door distribution and installation,"Smithcodoors.com (The Smith Company, Inc.) is a California-based commercial door distributor and contractor specializing in coiling overhead doors, grilles, shutters, accordion fold and accordion fold fire doors, and other specialty closures with emphasis on fire, smoke, sound, wind, and seismic resistance. They provide sales, installation, architectural consultation, project engineering, and 24/7 emergency support, with strong manufacturer partnerships and over 10,000 projects completed.","Yes, the company employs DIV8 estimators such as Greg Boom, Estimator/Sales Manager with over a decade of experience.","Yes. This company is similar to Overly Door Co., Acudor Products, Inc., and voestalpine Roll Forming Corporation due to its specialized commercial door product line, focus on specialty doors including fire-rated doors, and strong distribution and installation services.","Smithcodoors.com differentiates itself by focusing regionally on California, providing comprehensive services from sales through installation and emergency support, and maintaining strong partnerships with manufacturers like Cornell Iron Works, CHI Overhead Door, and RYTEC. Unlike some competitors, it emphasizes integrated project lifecycle involvement and a boutique experienced workforce (around 15 employees). Their product range includes highly specialized rated doors suitable for safety-critical commercial facilities.",,,,3.0,0.0
