"companyName","profileUrl","location","logoUrl","companyType","revenue","establishedYear","description","isVerified","api_status","api_confidence","api_company_linkedin","api_website","api_num_employees","api_industry","api_has_div8_estimators","api_icp_match","api_notes","api_company_name","api_description","api_leads_raw_json","api_lead_count","is_qualified","qualification_reason","api_error"
"Elkay Products Co., Inc.","https://www.thomasnet.com/company/elkay-products-co-inc-577969/profile?cov=NA&format=json&heading=23639008&limit=2589&searchsource=suppliers&searchterm=Doors&what=Doors&which=prod&coverage_area=NA&pg=34","Springfield, NJ 07081","","Manufacturer* , Custom Manufacturer, Distributor","$1 - 4.9 Mil Revenue","1929.0","Manufacturer & Distributor Of Material Handling Equipment. Moving Equipment/Supplies, Cargo Control Systems, Rental Industrial Equipment, Furniture/Bedding Hardware, Appliance Trucks, Cartons, Casters, Dollies & Rollers, Hand Trucks, Hoisting Equipment, Jack Lift, Lift Trucks, Moving Van Pads, Packing/Shipping Materials, Pads & Covers, Piano Moving Equipment, Polyethylene Covers & Rolls, Furniture & Warehouse Racks, Polypropylene & Steel Strapping, Straps, Ties, Slings, Tags, Sealing Tapes, Platform Trucks, Wallboards & Ramps","No","Success","9.5","https://www.linkedin.com/company/elkay-products","https://elkayprod.com","2-10","Material Handling Equipment Manufacturing and Distribution","No","No, Elkay Products Co., Inc. focuses on material handling and warehousing equipment, which is distinct from door manufacturing or supply sectors such as Overly Door Co., Acudor Products, and voestalpine Roll Forming Corporation.","Elkay Products Co., Inc. is a small manufacturer and distributor of material handling equipment including appliance trucks, casters, dollies, strapping, and similar warehouse-related hardware. They do not operate in the door manufacturing or supply sector and thus have no business overlap with door supplier companies. The company location is Springfield, New Jersey, and the estimated employee size is 2-10. No DIV 8 estimators are employed based on available searches. Key executive identified is Steve Piller, President; no additional C-suite or estimators identified so far, further research recommended.","Elkay Products Co., Inc.","Manufacturer & Distributor Of Material Handling Equipment. Moving Equipment/Supplies, Cargo Control Systems, Rental Industrial Equipment, Furniture/Bedding Hardware, Appliance Trucks, Cartons, Casters, Dollies & Rollers, Hand Trucks, Hoisting Equipment, Jack Lift, Lift Trucks, Moving Van Pads, Packing/Shipping Materials, Pads & Covers, Piano Moving Equipment, Polyethylene Covers & Rolls, Furniture & Warehouse Racks, Polypropylene & Steel Strapping, Straps, Ties, Slings, Tags, Sealing Tapes, Platform Trucks, Wallboards & Ramps","[{""name"": ""Steve Piller"", ""email"": """", ""company"": ""Elkay Products Co., Inc."", ""title"": ""President"", ""phone"": """", ""score"": ""7"", ""linkedin"": ""https://www.linkedin.com/in/stevepiller""}]","1.0","False","Good confidence score; Does not match ICP; No decision makers found",""
"American Mine Door Co.","https://www.thomasnet.com/company/american-mine-door-co-1296130/profile?cov=NA&format=json&heading=23639008&limit=2589&searchsource=suppliers&searchterm=Doors&what=Doors&which=prod&coverage_area=NA&pg=34","Cleveland, OH 44104","","Manufacturer* , Custom Manufacturer, Service Company","$1 - 4.9 Mil Revenue","1906.0","Custom mfrs. of mine doors for all types of underground mines, track or trackless.","No","Success","9.5","https://www.linkedin.com/company/american-mine-door","https://www.minedoor.com","50-52","Industrial Machinery Manufacturing","","No, this company is niche specialized in underground mine door manufacturing focusing on mining-related products, which differentiates it from general door suppliers like Overly Door Co., Acudor Products, Inc., and voestalpine Roll Forming Corporation.","American Mine Door Co. is a well-established company founded in 1906 specializing in custom high-pressure underground mine doors and related mining equipment. They cater to various underground mining sectors and offer ventilation and safety doors tailored for mining environments. Their specialization in mining equipment places them apart from general industrial door manufacturers. Company maintains active LinkedIn engagement highlighting their innovations and mining solutions. No confirmed information about the presence of DIV 8 estimators was found; further investigation required.","American Mine Door Co.","Custom mfrs. of mine doors for all types of underground mines, track or trackless.","[{""name"": ""Daniel Zenisek"", ""email"": """", ""company"": ""American Mine Door Co."", ""title"": ""Owner, New Business Development"", ""phone"": """", ""score"": ""9"", ""linkedin"": ""https://www.linkedin.com/in/daniel-zenisek-13b19320""}, {""name"": ""Peter Hallahan"", ""email"": """", ""company"": ""American Mine Door Co."", ""title"": ""Vice President Business Development"", ""phone"": """", ""score"": ""8"", ""linkedin"": ""https://www.linkedin.com/in/petehallahan""}]","2.0","False","Good confidence score; Does not match ICP; No decision makers found",""
"Tri-Boro Shelving & Partition Corp.","https://www.thomasnet.com/company/tri-boro-shelving-partition-corp-371616/profile?cov=NA&format=json&heading=23639008&limit=2589&searchsource=suppliers&searchterm=Doors&what=Doors&which=prod&coverage_area=NA&pg=34","","","Manufacturer* , Custom Manufacturer, Distributor","$10 - 24.9 Mil Revenue","1940.0","Mfr. & dist. of doors including hinged doors. Doors with 36 in. widths are available in heights of 37 in., 73 in. & 85 in. Doors with 85 in. & 73 in. heights are spot welded on each side & are available with pan reinforcement. Features include 20 gauge steel & 13 gauge frame construction, three-point locking device opening at 180 degrees, top & bottom locking rod channels & standard satin chrome finished handle with lock & 2 keys. Doors are pre-assembled & ready to install. Doors will fit offset & rolled-formed posts.","No","Success","8.5","https://www.linkedin.com/company/tri-boro-shelving-&-partition-corp/","https://triboroshelving.com","Approximately 51-200 (LinkedIn estimate)","Manufacturing and distribution of industrial shelving, storage solutions, and metal doors","No","No, the company primarily focuses on industrial shelving and storage products rather than door manufacturing or supply like Overly Door Co., Acudor Products, Inc., or voestalpine Roll Forming Corporation. The product line and business focus differ significantly.","Tri-Boro Shelving & Partition Corp. is primarily a manufacturer and distributor of industrial shelving, racks, carts, and storage solutions with a long history (70+ years). While some information mentions door products with specific features, the company's main product focus is shelving and storage equipment. The company is estimated to have 51-200 employees with key leadership including Randy Myers (COO/President Operations). No evidence of Division 08 estimators is found, and the company does not closely match the Ideal Customer Profile for door suppliers due to a different product focus. Contact information is available via official website and general emails.","Tri-Boro Shelving & Partition Corp.","Mfr. & dist. of doors including hinged doors. Doors with 36 in. widths are available in heights of 37 in., 73 in. & 85 in. Doors with 85 in. & 73 in. heights are spot welded on each side & are available with pan reinforcement. Features include 20 gauge steel & 13 gauge frame construction, three-point locking device opening at 180 degrees, top & bottom locking rod channels & standard satin chrome finished handle with lock & 2 keys. Doors are pre-assembled & ready to install. Doors will fit offset & rolled-formed posts.","[{""name"": ""Randy Myers"", ""email"": """", ""company"": ""Tri-Boro Shelving & Partition Corp."", ""title"": ""Chief Operating Officer and President of Operations"", ""phone"": """", ""score"": ""8"", ""linkedin"": ""https://www.linkedin.com/in/randy-myers-5b042575""}, {""name"": ""Trena Moyers"", ""email"": """", ""company"": ""Tri-Boro Shelving & Partition Corp."", ""title"": ""Office Manager"", ""phone"": """", ""score"": ""6"", ""linkedin"": """"}, {""name"": ""Tracy Walker"", ""email"": """", ""company"": ""Tri-Boro Shelving & Partition Corp."", ""title"": ""Social Director"", ""phone"": """", ""score"": ""5"", ""linkedin"": """"}]","3.0","False","Good confidence score; Does not match ICP; No decision makers found",""
"ePlumbing Products","https://www.thomasnet.com/company/eplumbing-products-30853531/profile?cov=NA&format=json&heading=23639008&limit=2589&searchsource=suppliers&searchterm=Doors&what=Doors&which=prod&coverage_area=NA&pg=34","Santa Ana, CA 92703","","Distributor*","","","Distributor of  kitchen, bath, and roof products. Types include water heaters, sinks, tubs, faucets, garbage disposals, vanity tops, doors, roof hatches, flashing, pumps, drinking fountains and water coolers, and parts. Same day shipping is available.","No","Success","9.0","https://www.linkedin.com/company/eplumbing-products","https://eplumbingproducts.com","11-50 employees (estimated)","Plumbing and building product distribution","No","No, because although ePlumbing Products supplies some door products, these are a minor part of a broad plumbing and building product range, making them not strongly aligned with specialized door suppliers like Overly Door Co., Acudor Products, or voestalpine Roll Forming Corporation.","ePlumbing Products is primarily a plumbing and building product distributor with a wide range of items including kitchen, bath, and roof products. Door products are only a small part of their overall catalog. The company does not employ Division 8 estimators and has limited overlap with door manufacturing or supply. Their focus remains broadly on plumbing and building products with same-day shipping as a service feature.","ePlumbing Products","Distributor of  kitchen, bath, and roof products. Types include water heaters, sinks, tubs, faucets, garbage disposals, vanity tops, doors, roof hatches, flashing, pumps, drinking fountains and water coolers, and parts. Same day shipping is available.","[{""name"": ""Jeff Hauser"", ""email"": """", ""company"": ""ePlumbing Products"", ""title"": ""President"", ""phone"": """", ""score"": ""5"", ""linkedin"": """"}, {""name"": ""Castine Hauser"", ""email"": """", ""company"": ""ePlumbing Products"", ""title"": ""Managing Partner"", ""phone"": """", ""score"": ""5"", ""linkedin"": """"}]","2.0","False","Good confidence score; Does not match ICP; No decision makers found",""
"General Forklift","https://www.thomasnet.com/company/general-forklift-426176/profile?cov=NA&format=json&heading=23639008&limit=2589&searchsource=suppliers&searchterm=Doors&what=Doors&which=prod&coverage_area=NA&pg=34","Staten Island, NY 10303","/_sda/_next/image?url=https%3A%2F%2Fcdn.thomasnet.com%2Fccp%2F00426176%2F37273.PNG&w=256&q=75","Distributor* , Service Company","$1 - 4.9 Mil Revenue","1981.0","Distributor of warehouse equipment and supplies including impact and vinyl doors. Other products include electrical tapes, floor mats, neutralizing spill kits, modular offices, oil pumps, racking, and warning signs. Safety training services are available.","No","Success","8.5","https://www.linkedin.com/company/general-forklift","https://www.genfork.com/","11-50","Machinery Manufacturing (Material handling equipment, forklift sales, parts, rentals, servicing, safety training)","No","No, General Forklift is focused on forklifts and warehouse equipment rather than door manufacturing or supply, thus it does not align with door suppliers such as Overly Door Co., Acudor Products, or voestalpine Roll Forming Corporation.","General Forklift is a privately held company founded in 1980, based in Staten Island, NY, specializing in distribution, sales, rentals, servicing, and safety training focused on forklifts and warehouse equipment, not on door manufacturing or supply. They do not employ Division 8 estimators, making them unrelated to companies specializing in door supplies. Their employee count is estimated between 11-50, and their key executive leadership includes President Chaim Farkas and COO Chris Johnson, among others.","General Forklift","Distributor of warehouse equipment and supplies including impact and vinyl doors. Other products include electrical tapes, floor mats, neutralizing spill kits, modular offices, oil pumps, racking, and warning signs. Safety training services are available.","[{""name"": ""Chaim Farkas"", ""email"": """", ""company"": ""General Forklift"", ""title"": ""President"", ""phone"": """", ""score"": ""8"", ""linkedin"": ""https://www.linkedin.com/in/chaim-farkas-7b752872""}, {""name"": ""Chris Johnson"", ""email"": """", ""company"": ""General Forklift"", ""title"": ""Chief Operating Officer"", ""phone"": """", ""score"": ""6"", ""linkedin"": """"}, {""name"": ""Fida Razak"", ""email"": """", ""company"": ""General Forklift"", ""title"": ""Administrative Clerk"", ""phone"": """", ""score"": ""4"", ""linkedin"": """"}, {""name"": ""Tatchamaphan Auparimakoon"", ""email"": """", ""company"": ""General Forklift"", ""title"": ""Sales Representative"", ""phone"": """", ""score"": ""5"", ""linkedin"": """"}]","4.0","False","Good confidence score; Does not match ICP; No decision makers found",""
"Uni Door Corp.","https://www.thomasnet.com/company/uni-door-corp-1215489/profile?cov=NA&format=json&heading=23639008&limit=2589&searchsource=suppliers&searchterm=Doors&what=Doors&which=prod&coverage_area=NA&pg=34","Gaylord, MN 55334","/_sda/_next/image?url=https%3A%2F%2Fcdn.thomasnet.com%2Fritekit%2Funidoorcorp.com.png&w=256&q=75","Manufacturer*","$10 - 24.9 Mil Revenue","1958.0","Manufacturer of wood products. Types include interior, track, fireproof and bi-fold doors, solid hardwood mouldings, door jambs and stops are available.","No","Success","9.0","https://www.linkedin.com/company/unidoor-corporation","http://unidoorcorp.com/","11-50 (LinkedIn estimate)","Wholesale Building Materials, specializing in wood product manufacturing (interior wood doors and millwork)","No confirmed evidence of Division 8 estimators on staff","Yes - Unidoor is similar to other door suppliers like Overly Door Co., Acudor Products, Inc., and voestalpine Roll Forming Corporation due to their focus on interior door manufacturing and millwork products.","Unidoor Corporation is a family-owned manufacturer of interior doors and millwork, operating from a 110,000 sq ft facility in Gaylord, Minnesota. They serve major retailers and pre-hanger companies, offering products such as molded panel, flush, bi-fold, fireproof doors, solid hardwood mouldings, jambs, and stops. The company aligns well with the door manufacturing and supply industry with a solid market presence and comprehensive product range.","Uni Door Corp.","Manufacturer of wood products. Types include interior, track, fireproof and bi-fold doors, solid hardwood mouldings, door jambs and stops are available.","[{""name"": ""Ken Garman"", ""email"": """", ""company"": ""Unidoor Corporation"", ""title"": ""Chief Operating Officer"", ""phone"": """", ""score"": ""8"", ""linkedin"": ""https://www.linkedin.com/in/ken-garman-30719a36""}, {""name"": ""Jason Campbell"", ""email"": """", ""company"": ""Unidoor Corporation"", ""title"": ""Vice President / CEO"", ""phone"": """", ""score"": ""8"", ""linkedin"": """"}, {""name"": ""James Rasmussen"", ""email"": """", ""company"": ""Unidoor Corporation"", ""title"": ""Maintenance Manager"", ""phone"": """", ""score"": ""6"", ""linkedin"": ""https://www.linkedin.com/in/james-rasmussen-b31421285""}]","3.0","False","Good confidence score; Matches ICP; No decision makers found",""
"Tefco Of Utah","https://www.thomasnet.com/company/tefco-of-utah-10043154/profile?cov=NA&format=json&heading=23639008&limit=2589&searchsource=suppliers&searchterm=Doors&what=Doors&which=prod&coverage_area=NA&pg=34","Ogden, UT 84404","","Custom Manufacturer* , Manufacturer, Service Company","","","Custom manufacturer of ornamental iron products for residential and commercial sectors. Products include railings, fencing, security doors, and spiral staircases.","No","Failed","","","","","","","","","","","","","","","Server error '502 Bad Gateway' for url 'https://api.sixtyfour.ai/enrich-company'
For more information check: https://developer.mozilla.org/en-US/docs/Web/HTTP/Status/502"
"Cowboy Glass LLC","https://www.thomasnet.com/company/cowboy-glass-llc-30980859/profile?cov=NA&format=json&heading=23639008&limit=2589&searchsource=suppliers&searchterm=Doors&what=Doors&which=prod&coverage_area=NA&pg=34","Laramie, WY 82072","","Service Company* , Custom Manufacturer","$1 - 4.9 Mil Revenue","1999.0","Installation and repair services for commercial glass. Suitable for storefronts, doors, windows, glass displays, and mirrors. Auto glass replacement service is also offered.","No","Success","8.5","","https://cowboyglass.com","Approximately 10","Residential, Commercial, and Auto Glass Installation and Repair","No","No - Cowboy Glass LLC is focused on glass installation and repair services rather than manufacturing or supplying doors, thus it does not match door suppliers like Overly Door Co., Acudor Products, Inc., or voestalpine Roll Forming Corporation.","Cowboy Glass LLC is a specialized service provider for commercial and auto glass installation and repair, including storefronts, doors, windows, glass displays, and mirrors. They do not manufacture or supply doors and therefore are distinct from door suppliers. Their business model centers on installation and repair services rather than product manufacturing or distribution.","Cowboy Glass LLC","Installation and repair services for commercial glass. Suitable for storefronts, doors, windows, glass displays, and mirrors. Auto glass replacement service is also offered.","[{""name"": ""John Pulley"", ""email"": """", ""company"": ""Cowboy Glass LLC"", ""title"": ""Owner/Operator"", ""phone"": """", ""score"": ""7"", ""linkedin"": ""https://www.linkedin.com/in/john-pulley-1b3891a0""}]","1.0","False","Good confidence score; Does not match ICP; No decision makers found",""
"Empire Pacific Windows","https://www.thomasnet.com/company/empire-pacific-windows-10013351/profile?cov=NA&format=json&heading=23639008&limit=2589&searchsource=suppliers&searchterm=Doors&what=Doors&which=prod&coverage_area=NA&pg=34","Spokane, WA 99206","","Manufacturer* , Service Company","$10 - 24.9 Mil Revenue","","Vinyl Doors, Sashes, Frames","No","Success","9.2","https://www.linkedin.com/company/empire-pacific-windows","https://www.empirepacificwindows.com/","201-500","Construction / Vinyl Window and Door Manufacturing","No public evidence of DIV 8 estimators on staff found.","Yes, Empire Pacific Windows closely aligns with other door suppliers like Overly Door Co., Acudor Products, and voestalpine Roll Forming Corporation due to its manufacturing focus on vinyl windows and doors targeting construction and replacement markets.","Empire Pacific Windows is a vinyl window and patio door manufacturer based in Tualatin, Oregon, specializing in high-quality vinyl doors, sashes, frames, and eco-friendly replacement parts. The company serves primarily the western U.S. states and extends shipping to Hawaii and Alaska. It focuses on cost-effective repair parts over full replacement and has an active market presence with estimated 201-500 employees. No confirmed DIV 8 estimators or top executive roles were publicly identified. The company is relevant to the door manufacturing and supply industry.","Empire Pacific Windows","Vinyl Doors, Sashes, Frames","[{""name"": ""John Maxwell"", ""email"": """", ""company"": ""Empire Pacific Windows"", ""title"": ""Operations Manager"", ""phone"": """", ""score"": ""7"", ""linkedin"": ""https://www.linkedin.com/in/john-maxwell-1a966323""}, {""name"": ""Sue Hopperstadt"", ""email"": """", ""company"": ""Empire Pacific Windows"", ""title"": ""Inside Sales"", ""phone"": """", ""score"": ""6"", ""linkedin"": ""https://www.linkedin.com/in/sue-hopperstadt-50815922""}, {""name"": ""Tony Gaoiran"", ""email"": """", ""company"": ""Empire Pacific Windows"", ""title"": ""Glazier / Service Technician"", ""phone"": """", ""score"": ""5"", ""linkedin"": ""https://www.linkedin.com/in/tony-gaoiran-1476518""}, {""name"": ""Michael Fields"", ""email"": """", ""company"": ""Empire Pacific Windows"", ""title"": ""Sales Staff"", ""phone"": """", ""score"": ""5"", ""linkedin"": ""https://www.linkedin.com/in/michael-fields-348bb3303""}]","4.0","False","Good confidence score; Matches ICP; No decision makers found",""
"Vico Windows Inc.","https://www.thomasnet.com/company/vico-windows-inc-30717243/profile?cov=NA&format=json&heading=23639008&limit=2589&searchsource=suppliers&searchterm=Doors&what=Doors&which=prod&coverage_area=NA&pg=34","Oakland Park, FL 33334","","Turnkey Systems Integrator* , Distributor, Service Company","$1 Mil Revenue","1980.0","Distributor of doors. Types include non-impact doors. Capabilities include replacement, repair and installation of glass panels, windows, and doors.","No","Success","8.5","","https://vicowindows.com","10-50 (estimated)","Door and Window Distribution, Installation, and Repair (including impact and non-impact windows and doors)","No","Yes, Vico Windows Inc. is similar to other door/window suppliers like Overly Door Co., Acudor Products, Inc., and voestalpine Roll Forming Corporation because it operates in the same niche focusing on distribution, repair, and installation of impact and non-impact doors and windows primarily in South Florida.","Vico Windows Inc. is a family-owned, established business specializing in the distribution and installation of doors and windows, emphasizing impact-resistant products. The company is focused on replacement, repair, and installation services. It does not appear to employ dedicated DIV 8 estimators. The company has a modest staff size and a strong local presence with a positive reputation and BBB accreditation. Despite an inactive LinkedIn company page, key personnel such as the President are identified. Overall, it is relevant to the door and window supply and installation sector, aligning well with similar suppliers in the industry.","Vico Windows Inc.","Distributor of doors. Types include non-impact doors. Capabilities include replacement, repair and installation of glass panels, windows, and doors.","[{""name"": ""Rocky Petreccia"", ""email"": """", ""company"": ""Vico Windows Inc."", ""title"": ""President"", ""phone"": """", ""score"": ""7"", ""linkedin"": ""https://www.linkedin.com/in/rocky-petreccia-41b21343""}, {""name"": ""Matthew Preat"", ""email"": """", ""company"": ""Vico Windows Inc."", ""title"": ""Organization Manager"", ""phone"": """", ""score"": ""5"", ""linkedin"": """"}, {""name"": ""Eugene Dombrov"", ""email"": """", ""company"": ""Vico Windows Inc."", ""title"": ""Windows Specialist"", ""phone"": """", ""score"": ""4"", ""linkedin"": """"}, {""name"": ""Devin Haley"", ""email"": """", ""company"": ""Vico Windows Inc."", ""title"": ""Sales Assistant"", ""phone"": """", ""score"": ""3"", ""linkedin"": """"}]","4.0","False","Good confidence score; Matches ICP; No decision makers found",""
