"companyName","profileUrl","location","logoUrl","companyType","revenue","establishedYear","description","isVerified","api_status","api_confidence","api_company_linkedin","api_website","api_num_employees","api_industry","api_has_div8_estimators","api_icp_match","api_notes","api_company_name","api_description","api_leads_raw_json","api_lead_count","is_qualified","qualification_reason","api_error"
"TNR Industrial Doors","https://www.thomasnet.com/company/tnr-industrial-doors-30581610/profile?cov=NA&format=json&heading=23639008&limit=2589&searchsource=suppliers&searchterm=Doors&what=Doors&which=prod&coverage_area=NA&pg=32","Barrie, ON L4N8X8","/_sda/_next/image?url=https%3A%2F%2Fcdn.thomasnet.com%2Fccp%2F30581610%2F184590.JPG&w=256&q=75","Manufacturer*","$10 - 24.9 Mil Revenue","2003.0","Manufacturer of industrial and commercial rubber roll-up doors. Types include access, breakaway, rolling, and garage doors. Attributes include; self-supporting steel mounting angles, frame mounted thru-beam sensors, and soft start, soft stop capability using inverter technology. Applications and industries; manufacturing, mines, docks, food processing, warehouse, automotive, parking garages, airports & railways.","No","Success","9.0","https://www.linkedin.com/company/tnr-industrial-doors","https://www.tnrdoors.com","Approximately 86 employees (with plans for growth)","Manufacturing of industrial and commercial rubber roll-up doors","No","Yes, TNR Industrial Doors matches the ICP profile similar to other door suppliers like Overly Door Co., Acudor Products, and voestalpine Roll Forming Corporation, based on product line and served industries. Their specialization in rubber roll-up doors with advanced inverter technology differentiates them within this market segment.","TNR Industrial Doors is a specialized manufacturer focused on advanced industrial and commercial rubber roll-up doors, incorporating technologies such as self-supporting steel mounting angles, frame mounted sensors, and inverter technology for soft start and stop. They serve a diverse set of industries including manufacturing, mining, docks, food processing, warehouses, automotive, parking garages, airports, and railways. The company is part of the Hörmann Group, indicating strong industry backing and recent $40 million investment into manufacturing capacity expansion in Ontario, Canada. The LinkedIn company page is currently inactive but confirmed by employee profiles. No direct evidence of DIV 8 estimators on staff was found, and estimated employee count is around mid-sized enterprise level. Key leadership and operational roles have been identified, supporting clear organizational structure.","TNR Industrial Doors","Manufacturer of industrial and commercial rubber roll-up doors. Types include access, breakaway, rolling, and garage doors. Attributes include; self-supporting steel mounting angles, frame mounted thru-beam sensors, and soft start, soft stop capability using inverter technology. Applications and industries; manufacturing, mines, docks, food processing, warehouse, automotive, parking garages, airports & railways.","[{""name"": ""Marcus von Reden"", ""email"": """", ""company"": ""TNR Industrial Doors"", ""title"": ""President"", ""phone"": """", ""score"": ""9"", ""linkedin"": ""https://www.linkedin.com/in/marcus-von-reden-91906574""}, {""name"": ""Nick Marando"", ""email"": """", ""company"": ""TNR Industrial Doors"", ""title"": ""Vice President of Operations"", ""phone"": """", ""score"": ""8"", ""linkedin"": """"}, {""name"": ""Daniel Hadcock"", ""email"": """", ""company"": ""TNR Industrial Doors"", ""title"": ""Vice President of Sales Canada"", ""phone"": """", ""score"": ""8"", ""linkedin"": """"}, {""name"": ""Mike Brunner"", ""email"": """", ""company"": ""TNR Industrial Doors"", ""title"": ""Product Specialist"", ""phone"": """", ""score"": ""7"", ""linkedin"": ""https://ca.linkedin.com/in/mike-brunner-tnrdoors""}, {""name"": ""Janet Stinson"", ""email"": """", ""company"": ""TNR Industrial Doors"", ""title"": ""Supply Chain Manager"", ""phone"": """", ""score"": ""7"", ""linkedin"": """"}]","5.0","False","Good confidence score; Matches ICP; No decision makers found",""
"Maverick Door and Millwork, Inc.","https://www.thomasnet.com/company/maverick-door-and-millwork-inc-30756399/profile?cov=NA&format=json&heading=23639008&limit=2589&searchsource=suppliers&searchterm=Doors&what=Doors&which=prod&coverage_area=NA&pg=32","Schertz, TX 78154","","Custom Manufacturer*","$1 - 4.9 Mil Revenue","1992.0","Custom manufacturer of handcrafted wood doors for residential and commercial industries. Products include rustic and conservation doors, interiors, casings, grooved, and raised panels. Capabilities include architectural millwork, woodwork and milling.","No","Success","9.0","","https://maverickdoor.com","Small to medium (estimated)","Custom handcrafted wood door manufacturing and architectural millwork","No direct evidence found","Yes, Maverick Door and Millwork, Inc. aligns closely with other door suppliers like Overly Door Co., Acudor Products, Inc., and voestalpine Roll Forming Corporation due to similar product focus on wood doors and architectural millwork, with an artisanal craftsmanship differentiation.","Maverick Door and Millwork, Inc. is a small to medium-sized custom manufacturer specializing in handcrafted wood doors and architectural millwork, primarily serving residential and commercial industries. The company emphasizes artisanal craftsmanship and quality wood products. It operates out of Schertz, Texas, servicing San Antonio and Austin regions. Their product focus and industry alignment make them a strong ICP match among door manufacturers and suppliers. There is no public evidence of Division 8 estimators on staff, and no company LinkedIn profile is available, though key leadership profiles exist for Karl Mayer (President and Owner) and Jackie Baer (Executive Administrator). The company phone is publicly listed, but direct personal contact details for executives are unavailable.","Maverick Door and Millwork, Inc.","Custom manufacturer of handcrafted wood doors for residential and commercial industries. Products include rustic and conservation doors, interiors, casings, grooved, and raised panels. Capabilities include architectural millwork, woodwork and milling.","[{""name"": ""Karl Mayer"", ""email"": """", ""company"": ""Maverick Door and Millwork, Inc."", ""title"": ""President and Owner"", ""phone"": """", ""score"": ""8"", ""linkedin"": ""https://www.linkedin.com/in/karl-mayer-97344814""}, {""name"": ""Jackie Baer"", ""email"": """", ""company"": ""Maverick Door and Millwork, Inc."", ""title"": ""Executive Administrator"", ""phone"": """", ""score"": ""6"", ""linkedin"": ""https://www.linkedin.com/in/jackie-baer-28435a46""}, {""name"": ""Craig Montgomery"", ""email"": """", ""company"": ""Maverick Door and Millwork, Inc."", ""title"": ""Owner"", ""phone"": """", ""score"": ""7"", ""linkedin"": """"}]","3.0","False","Good confidence score; Matches ICP; No decision makers found",""
"Hammel Misc. Metals, Inc.","https://www.thomasnet.com/company/hammel-misc-metals-inc-30756478/profile?cov=NA&format=json&heading=23639008&limit=2589&searchsource=suppliers&searchterm=Doors&what=Doors&which=prod&coverage_area=NA&pg=32","Ludlow, KY 41016","","Custom Manufacturer*","$1 Mil Revenue","2001.0","Custom manufacturer of metal fabricated products. Products include stairs, rails, fencing and bollards, platforms, ladders, grates gates, doors, window guards, lintels, angles and framing. Capabilities include metal fabrication, punching, drilling, shearing, bending, forming, sawing, welding and cutting.","No","Success","5.0","","","","Metal Fabrication","","No. Hammel Misc. Metals, Inc. is a family-owned broad metal fabricator producing a wide range of metal products including doors, but it is not specialized like door suppliers such as Overly Door Co., Acudor Products, Inc., or voestalpine Roll Forming Corporation. The match with door suppliers is only partial due to this broader focus.","Hammel Misc. Metals, Inc. operates primarily as a custom metal fabricator based in Wisconsin, producing a variety of metal fabricated products such as stairs, rails, fencing, bollards, gates, doors, window guards, lintels, angles, and framing through processes like punching, drilling, shearing, bending, forming, sawing, welding, and cutting. There is no verified online presence including official website or LinkedIn company profile. Employee count and presence of Division 8 estimators are unknown. It is distinct from similarly named companies such as Miscellaneous Metals, Inc. found in Maryland. The company appears to be a small to mid-sized family business with limited digital footprint. Its relevance to door manufacturing is limited by its broader metal fabrication focus and partial ICP match with specialized door suppliers.","Hammel Misc. Metals, Inc.","Custom manufacturer of metal fabricated products. Products include stairs, rails, fencing and bollards, platforms, ladders, grates gates, doors, window guards, lintels, angles and framing. Capabilities include metal fabrication, punching, drilling, shearing, bending, forming, sawing, welding and cutting.","[]","0.0","False","Does not match ICP; No decision makers found",""
"David D. Snell Building Services Ltd.","https://www.thomasnet.com/company/david-d-snell-building-services-ltd-30697950/profile?cov=NA&format=json&heading=23639008&limit=2589&searchsource=suppliers&searchterm=Doors&what=Doors&which=prod&coverage_area=NA&pg=32","Mississauga, ON L5L5Z8","","Distributor*","$1 - 4.9 Mil Revenue","1992.0","","No","Failed","","","","","","","","","","","","","","","Out of range float values are not JSON compliant"
"Western Extrusions","https://www.thomasnet.com/company/western-extrusions-77334/profile?cov=NA&format=json&heading=23639008&limit=2589&searchsource=suppliers&searchterm=Doors&what=Doors&which=prod&coverage_area=NA&pg=32","Carrollton, TX 75006","/_sda/_next/image?url=https%3A%2F%2Fcdn.thomasnet.com%2Fritekit%2Fwesternextrusions.com.png&w=256&q=75","Custom Manufacturer*","$10 - 24.9 Mil Revenue","1979.0","Aluminum Extrusions","No","Success","9.0","https://www.linkedin.com/company/5631697/","https://www.westernextrusions.com/","501-1,000 (approx. 280 on LinkedIn)","Aluminum Extrusion Manufacturing / Wholesale Building Materials","No","No. Western Extrusions partially matches ICP as a supplier of aluminum extrusion components potentially used in door and window manufacturing but is not a direct door supplier like Overly Door Co., Acudor Products, or voestalpine Roll Forming Corporation.","Western Extrusions Corporation specializes in aluminum extrusions, fabrication, anodizing, painting, and thermal barriers, serving as a component supplier rather than a finished door manufacturer or direct door supplier. They have no explicit DIV 8 estimators on staff based on available information. They emphasize quality, environmental responsibility (Environmental Distinction award 2024), and customer service. Key leadership includes Mark Aldredge (VP Operations) and Alec Wells (Director of Finishing). The company's manufacturing outputs support door and window fabrication indirectly through extrusion products rather than actual door manufacturing or supplying.","Western Extrusions","Aluminum Extrusions","[{""name"": ""Mark Aldredge"", ""email"": """", ""company"": ""Western Extrusions"", ""title"": ""Vice President - Operations"", ""phone"": """", ""score"": ""8"", ""linkedin"": ""https://www.linkedin.com/in/mark-aldredge-670b1212b/""}, {""name"": ""Alec Wells"", ""email"": """", ""company"": ""Western Extrusions"", ""title"": ""Director of Finishing"", ""phone"": """", ""score"": ""7"", ""linkedin"": ""https://www.linkedin.com/in/alec-wells-941b443b/""}]","2.0","False","Good confidence score; Does not match ICP; No decision makers found",""
"National Aircraft Service, Inc","https://www.thomasnet.com/company/national-aircraft-service-inc-30080454/profile?cov=NA&format=json&heading=23639008&limit=2589&searchsource=suppliers&searchterm=Doors&what=Doors&which=prod&coverage_area=NA&pg=33","Tecumseh, MI 49286","","Manufacturer*","$1 Mil Revenue","1977.0","Offers structural and environmental system modifications that extend the useful life of transport category aircraft. Products include temperature control products, air cycle machine systems, flow control systems, cargo/vent door safety systems and NASI flight deck security cockpit doors. Certified FAA repair station.","No","Success","8.5","","http://www.nasisystems.com/","","Aerospace/Aviation","No","Yes, partially. National Aircraft Service, Inc produces door related aircraft systems, such as cargo/vent door safety systems and flight deck security cockpit doors, aligning partially with door suppliers like Overly Door Co. However, their overall product and service scope is broader, focusing on aircraft structural and environmental modifications rather than solely door manufacturing or supply.","National Aircraft Service, Inc is an FAA certified repair station specializing in structural and environmental modifications for transport category aircraft. Their product portfolio includes temperature control products, air cycle machine systems, flow control systems, cargo/vent door safety systems, and flight deck security cockpit doors. While they provide door-related safety systems, their primary focus is on aerospace modifications and systems integration rather than being a dedicated door supplier. No direct LinkedIn profile or verified key personnel information could be found, and employee count remains unknown.","National Aircraft Service, Inc","Offers structural and environmental system modifications that extend the useful life of transport category aircraft. Products include temperature control products, air cycle machine systems, flow control systems, cargo/vent door safety systems and NASI flight deck security cockpit doors. Certified FAA repair station.","[]","0.0","False","Good confidence score; Matches ICP; No decision makers found",""
"Affordable Views","https://www.thomasnet.com/company/affordable-views-30807893/profile?cov=NA&format=json&heading=23639008&limit=2589&searchsource=suppliers&searchterm=Doors&what=Doors&which=prod&coverage_area=NA&pg=33","Mount Shasta, CA 96067","","Custom Manufacturer*","","","Custom manufacturer of frames. Products include cubicle mounting, brackets, windows, doors, faux and wood window and casings.","No","Success","7.0","","","Under 10","Manufacturing, Construction Supply (Frames and Doors)","No","No, Affordable Views is a small, possibly family-owned regional manufacturer with a limited digital footprint and offline operations, and does not match the scale or presence of major door suppliers like Overly Door Co., Acudor Products, Inc., or voestalpine Roll Forming Corporation.","Affordable Views is a custom manufacturer specializing in frames including cubicle mounting brackets, windows, doors, and wood window casings. The company has no active website or LinkedIn profile and an estimated very small employee size (under 10). No Division 8 estimators or key decision-makers were found online, indicating limited online presence and likely local or regional operation.","Affordable Views","Custom manufacturer of frames. Products include cubicle mounting, brackets, windows, doors, faux and wood window and casings.","[]","0.0","False","Good confidence score; Does not match ICP; No decision makers found",""
"Bacon, Henry, Building Materials, Inc.","https://www.thomasnet.com/company/bacon-henry-building-materials-inc-10028205/profile?cov=NA&format=json&heading=23639008&limit=2589&searchsource=suppliers&searchterm=Doors&what=Doors&which=prod&coverage_area=NA&pg=33","Issaquah, WA 98027","","Manufacturer* , Custom Manufacturer, Distributor","","","Modular Wood Kitchen Cabinets, Steel Doors & Frames, Wood Doors, Millworks, Finish Hardware","No","Success","7.5","","","5 to 9","Building Materials, specializing in modular wood kitchen cabinets, steel doors & frames, wood doors, millworks, finish hardware","Likely, but not confirmed","Yes. The company is similar to other door suppliers like Overly Door Co., Acudor Products, Inc., and voestalpine Roll Forming Corporation due to overlapping product focus in doors and finish hardware.","Bacon, Henry, Building Materials, Inc. is a small building materials supplier based in Issaquah, WA, focusing on modular wood kitchen cabinets, steel doors and frames, wood doors, millworks, and finish hardware. Though no official website or LinkedIn company page was found, the company's product range aligns with door manufacturing and supply, suggesting relevance in this sector. Key decision-maker identified is Greg Ahrens, President. No confirmed Division 8 estimators identified but likely given product line. More detailed personnel and contact information require further research.","Bacon, Henry, Building Materials, Inc.","Modular Wood Kitchen Cabinets, Steel Doors & Frames, Wood Doors, Millworks, Finish Hardware.","[{""name"": ""Greg Ahrens"", ""email"": """", ""company"": ""Bacon, Henry, Building Materials, Inc."", ""title"": ""President"", ""phone"": """", ""score"": ""7"", ""linkedin"": ""https://www.linkedin.com/in/greg-ahrens-975117b3""}]","1.0","False","Good confidence score; Matches ICP; No decision makers found",""
"Integral Windstorm Products LLC","https://www.thomasnet.com/company/integral-windstorm-products-llc-30730903/profile?cov=NA&format=json&heading=23639008&limit=2589&searchsource=suppliers&searchterm=Doors&what=Doors&which=prod&coverage_area=NA&pg=33","Pompano Beach, FL 33063","","Distributor*","$1 Mil Revenue","2009.0","Distributor of doors. Products include aluminum, aluminum clad, mahogany entry, accordion, roll down and commercial storefront.","No","Failed","","","","","","","","","","","","","","","Server error '502 Bad Gateway' for url 'https://api.sixtyfour.ai/enrich-company'
For more information check: https://developer.mozilla.org/en-US/docs/Web/HTTP/Status/502"
"Bartels USA, Inc.","https://www.thomasnet.com/company/bartels-usa-inc-30311084/profile?cov=NA&format=json&heading=23639008&limit=2589&searchsource=suppliers&searchterm=Doors&what=Doors&which=prod&coverage_area=NA&pg=33","Dania Beach, FL 33004","","Distributor*","$1 - 4.9 Mil Revenue","1999.0","Doors & architectural hardware from Germany.","No","Success","9.5","https://www.linkedin.com/company/bartels-doors-&-hardware","https://www.bartelsdoors.com/","51-200","Wholesale Building Materials","No","Yes, Bartels USA, Inc. closely aligns with comparable door suppliers like Overly Door Co., Acudor Products, Inc., and voestalpine Roll Forming Corporation due to their focus on premium German-engineered interior doors and architectural hardware aimed at the luxury, architectural segment.","Bartels USA, Inc., operating as Bartels Doors & Hardware, specializes in premium German-manufactured custom interior doors and architectural hardware with an emphasis on luxury design projects. The company offers a variety of door types including swing, sliding, glass, and barn doors, alongside high-quality hardware like levers and pull bars. Founded in 1999 and based in Dania Beach, FL, they have an estimated 51-200 employees and maintain an active online presence and showroom by appointment. They provide project management and CAD support targeting high-end customizable door solutions rather than mass production. No confirmed Division 8 estimators were identified on staff.","Bartels USA, Inc.","Doors & architectural hardware from Germany.","[{""name"": ""Sven D Hruby"", ""email"": """", ""company"": ""Bartels USA, Inc."", ""title"": ""President"", ""phone"": """", ""score"": ""8"", ""linkedin"": ""https://www.linkedin.com/in/svenhruby""}, {""name"": ""Heather Mroczkowski"", ""email"": """", ""company"": ""Bartels USA, Inc."", ""title"": ""US Operations & Brand Development"", ""phone"": """", ""score"": ""7"", ""linkedin"": ""https://www.linkedin.com/in/heather-mroczkowski-a0339367""}, {""name"": ""Klint Peacock"", ""email"": """", ""company"": ""Bartels USA, Inc."", ""title"": """", ""phone"": """", ""score"": ""5"", ""linkedin"": """"}, {""name"": ""Flavia Tapia"", ""email"": """", ""company"": ""Bartels USA, Inc."", ""title"": """", ""phone"": """", ""score"": ""5"", ""linkedin"": """"}]","4.0","False","Good confidence score; Matches ICP; No decision makers found",""
"Willemse Glass Inc.","https://www.thomasnet.com/company/willemse-glass-inc-10042044/profile?cov=NA&format=json&heading=23639008&limit=2589&searchsource=suppliers&searchterm=Doors&what=Doors&which=prod&coverage_area=NA&pg=33","Scappoose, OR 97056","","Custom Manufacturer* , Manufacturer, Service Company","$1 Mil Revenue","1991.0","Custom manufacturer of glass products and windows. Types include milgard windows, shower doors, mirrors, glass replacement units, tempered glass, laminated glass, acrylics, picture frame glass, table top glass, and glass shelving. Installation and replacement services are available.","No","Success","8.5","","https://www.willemseglassor.com","Likely small to medium-sized business (exact number unknown)","Custom glass product manufacturing and installation","No evidence of Division 8 estimators on staff","Partial - The company has some product overlap with door suppliers due to products like shower doors and windows but primarily focuses on glass products rather than full door manufacturing or supply.","Willemse Glass Inc. specializes in custom glass products and installation such as windows, shower doors, mirrors, and tempered glass. While there is some overlap with door suppliers due to shower doors and window products, they are primarily a glass manufacturing and installation firm, making their relevance to door manufacturing or supply partial but limited. No key personnel or estimators were identified, and no active LinkedIn company profile exists.","Willemse Glass Inc.","Custom manufacturer of glass products and windows. Types include milgard windows, shower doors, mirrors, glass replacement units, tempered glass, laminated glass, acrylics, picture frame glass, table top glass, and glass shelving. Installation and replacement services are available.","[]","0.0","False","Good confidence score; Does not match ICP; No decision makers found",""
"Advanced Custom Engineered Structures","https://www.thomasnet.com/company/advanced-custom-engineered-structures-30725869/profile?cov=NA&format=json&heading=23639008&limit=2589&searchsource=suppliers&searchterm=Doors&what=Doors&which=prod&coverage_area=NA&pg=33","Ronkonkoma, NY 11779","","Distributor*","$1 Mil Revenue","2012.0","Distributor of custom engineered industrial, commercial and residential doorway systems. Types of doors include industrial sectional doors, high speed doors, folding door with special panels, sliding doors, PVC curtains and strip doors, fire resistant doors, garage doors.","No","Success","2.5","","","","","","No, because Advanced Custom Engineered Structures operates primarily as a distributor rather than a manufacturer like Overly Door Co., Acudor Products, Inc., and voestalpine Roll Forming Corporation. Additionally, lack of verified data about employee roles and company specifics prevents a strong ICP match.","Advanced Custom Engineered Structures is a distributor of custom engineered industrial, commercial, and residential doorway systems including multiple door types. Due to absence of verifiable data on official web presence, staffing, and key personnel, the company's manufacturing or supply standing remains unconfirmed, with likely limited digital footprint hindering research efforts. No evidence of DIV 8 estimators employed has been found.","Advanced Custom Engineered Structures","Distributor of custom engineered industrial, commercial and residential doorway systems. Types of doors include industrial sectional doors, high speed doors, folding door with special panels, sliding doors, PVC curtains and strip doors, fire resistant doors, garage doors.","[]","0.0","False","Does not match ICP; No decision makers found",""
"Snow Millie Import & Export Inc.","https://www.thomasnet.com/company/snow-millie-import-export-inc-30705446/profile?cov=NA&format=json&heading=23639008&limit=2589&searchsource=suppliers&searchterm=Doors&what=Doors&which=prod&coverage_area=NA&pg=33","Markham, ON L3R1E2","","Distributor*","$1 Mil Revenue","","","No","Failed","","","","","","","","","","","","","","","Out of range float values are not JSON compliant"
"Sun Mountain, Inc.","https://www.thomasnet.com/company/sun-mountain-inc-30807748/profile?cov=NA&format=json&heading=23639008&limit=2589&searchsource=suppliers&searchterm=Doors&what=Doors&which=prod&coverage_area=NA&pg=33","Berthoud, CO 80513","/_sda/_next/image?url=https%3A%2F%2Fcdn.thomasnet.com%2Fritekit%2Fsunmountaindoor.com.png&w=256&q=75","Manufacturer*","$10 - 24.9 Mil Revenue","","Manufacturer of wooden products for commercial and residential sectors. Architectural, interior, exterior, bi-folding, folding, sliding, French, pantry, cellar, glass, arched, contemporary, and colonial type of doors are available. Product such as flooring systems, mouldings, box beams, blocks, panels and stair parts are available.","No","Failed","","","","","","","","","","","","","","","Server error '502 Bad Gateway' for url 'https://api.sixtyfour.ai/enrich-company'
For more information check: https://developer.mozilla.org/en-US/docs/Web/HTTP/Status/502"
