companyName,profileUrl,location,logoUrl,companyType,revenue,establishedYear,description,isVerified,api_enrichment_status,api_error_message,is_qualified,qualification_reason,api_raw_response_preview,api_confidence_score,api_notes,api_findings,api_company_linkedin,api_website,api_num_employees,api_industry,api_short_summary,api_has_div8_estimators,api_icp_match,api_logic,api_lead_linkedin_profiles,api_decision_makers,api_estimator_leads,api_lead_count,api_relevant_lead_count
Combination Door Co.,https://www.thomasnet.com/company/combination-door-co-10008875/profile?cov=NA&format=json&heading=23639008&limit=2589&searchsource=suppliers&searchterm=Doors&what=Doors&which=prod&coverage_area=NA&pg=80,"Fond Du Lac, WI 54936",,Manufacturer*,$50 - 99.9 Mil Revenue,1912.0,Wood Interior & Exterior Doors,No,Success,,False,"Confidence score 9.0 >= 7.0; Employee count 50 (from 'Estimated under 50 employees (2-10 employees on LinkedIn)') >= 10; No estimator detected: No estimators found in titles or company details; ICP match: yes, combination door co. is similar to other wood door manufacturers such as overly door co., acudo; No decision makers found","{""notes"": ""Combination Door Co. is a division of Paul Argoe Screens, Inc., specializing in wood interior and exterior doors, notably combination storm and screen doors and wood screen doors. Their off",9.0,"Relevant to the door supply and manufacturing industry, Combination Door Co. is a small-to-medium sized manufacturer focused on custom, high-quality wood interior and exterior doors. The company lacks definitive information on Division 8 estimators and employee count but maintains a solid market position with a handcrafted and technologically supported product line. Key personnel include top management with no direct contact emails but with LinkedIn profiles available.","Manufacturing: Custom sizes and multiple wood species; orders range from 1 to 5000 doors|Presence of DIV 8 Estimators: Not confirmed from available data|Key People: 1) Dan Schmidt - President/CEO, located in Fond Du Lac, WI. LinkedIn profile: https://www.linkedin.com/in/dan-schmidt-9217817. Has been in position since May 1984. 2) Brian Menard - Chief Financial Officer. Responsibilities include accounting, inventory, and HR functions. LinkedIn: https://www.linkedin.com/in/brian-menard-a539b81a. At the company since March 2011. 3) Mark Tautges - Plant Manager. LinkedIn: https://www.linkedin.com/in/mark-tautges-b2393367. 4) Andrew Sehloff - Purchasing Manager. LinkedIn: https://www.linkedin.com/in/andrew-sehloff-178b06265. 5) Sue Ottery - Logistics Manager / Customer Service / Order Entry. LinkedIn: https://www.linkedin.com/in/sue-ottery-b7a84849.|Company combines artisanal door quality with advanced manufacturing and production scale|Logic: Differentiates through custom solutions, product variety, and manufacturing scale combining traditional quality with modern technology|Company history: Operating since 1912, emphasizing quality and craftsmanship|Product focus: Custom and standard wood doors with high quality and craftsmanship|No direct evidence of DIV 8 estimators on staff found|Key people: Dan Schmidt (President/CEO), Brian Menard (CFO), Mark Tautges (Plant Manager), Andrew Sehloff (Purchasing Manager), Sue Ottery (Logistics Manager)|Estimated Employees: Not disclosed|Social media presence includes Facebook and Instagram|Official website: https://combinationdoor.com/|No current data on number of employees found|Company is similar to other custom wood door manufacturers but distinct in focus on high-quality custom wood doors|LinkedIn Company Profile: https://www.linkedin.com/company/combination-door-co|Location: Fond Du Lac, Wisconsin, United States|General contact info: Phone 800-203-5953, Email doors@combinationdoor.com (from official website). No individual direct emails or phones found so far.|Description: Specializes in combination doors, interior doors, and storm doors made from various wood species (oak, cherry, maple, poplar, knotty pine) with a focus on craftsmanship and custom work.|Official website: https://www.combinationdoor.com|Company Name: Combination Door Co.|No current data on presence of DIV 8 estimators found|Location: 3224 Savannah Hwy, North, SC 29112|LinkedIn company profile: https://www.linkedin.com/company/combination-door-co|LinkedIn profile for company not yet identified; no personnel info extracted yet|Estimated company size: Small to medium (likely under 50 employees)|Industry: Construction, specializing in wood door manufacturing and millwork|Notes: Relevant to the door supply/manufacturing industry primarily for customers seeking high-quality wood doors and customization options; further data needed regarding key personnel and estimators.|ICP Match: Yes, similar to other wood door manufacturers such as Overly Door Co., Acudor Products, Inc., and voestalpine Roll Forming Corporation, but with a custom and hand-crafted focus.|Industry: Wood Door Manufacturing (Interior & Exterior)|Product offerings: Raised panel doors, flat panel doors, louvered doors, French doors, wood screen doors, storm doors, hardware kits|Instagram: https://www.instagram.com/combinationdoorcompany/ showcases custom doors and craftsmanship|Company is a division of Paul Argoe Screens, Inc.|Social Media: Facebook (PaulArgoeScreens), Instagram (combinationdoorcompany)|Location: Fond du Lac, Wisconsin|Product Focus: Custom wood doors (stile and rail raised panel, flat panel, louvered, French doors, wood screen doors, fixed storm doors) with multiple wood species and sizes|Website: https://www.combinationdoor.com/|ICP match: Yes, similar to other wood door manufacturers with custom product focus|Market Focus: High-quality, customizable wood doors with emphasis on craftsmanship and manufacturing scalability|No evidence of Division 8 estimators employed by the company, suggests limited or no dedicated estimating staff for door, frame, and hardware components.|Company Size: 2-10 employees on LinkedIn; estimated under 50 employees overall|Contact: Phone - 800-203-5953, Email - doors@combinationdoor.com|No definitive information on employment of DIV 8 estimators found|ICP Match: Shares similarities with other specialized wood door manufacturers like Overly Door Co., Acudor Products, Inc., and voestalpine Roll Forming Corporation by focusing on wood door products and craftsmanship|Company Location: Wisconsin, USA (3224 Savannah Hwy, North, SC 29112 identified for Paul Argoe Screens)|Contact Info: Phone 800-203-5953, Email doors@combinationdoor.com|Primary industry: Wood door manufacturing (interior and exterior)|Company name: Combination Door Company|Company Name: Combination Door Company, a division of Paul Argoe Screens, Inc.|Company location: Fond du Lac, Wisconsin|Website: https://combinationdoor.com|Industry: Wood door manufacturing, specializing in interior and exterior wood doors including storm and screen combinations|Industry: Wood Interior & Exterior Doors Manufacturing|No specific key personnel identified in the current scrape; LinkedIn profiles previously found but contacts not confirmed|No clear mention of number of employees from current resources",https://www.linkedin.com/company/combination-door-co,https://www.combinationdoor.com,Estimated under 50 employees (2-10 employees on LinkedIn),Wood Interior & Exterior Doors Manufacturing,"Combination Door Co., a division of Paul Argoe Screens, Inc., specializes in manufacturing custom and standard wood interior and exterior doors, including combination storm and screen doors. The company combines artisanal craftsmanship with modern manufacturing technology, serving customers with high-quality, customizable wood door products.",No direct evidence of DIV 8 estimators employed by the company was found.,"Yes, Combination Door Co. is similar to other wood door manufacturers such as Overly Door Co., Acudor Products, Inc., and voestalpine Roll Forming Corporation. This similarity is based on their focus on custom wood door products and craftsmanship.","The company differentiates itself by combining traditional handmade craftsmanship with scalable modern manufacturing, offering a wide product variety including custom sizes, multiple wood species, and storm and screen door combinations. Unlike some competitors, they emphasize both artisanal quality and production scalability under the parent company Paul Argoe Screens, Inc.",,,,5.0,0.0
"Junior's Building Materials, Inc",https://www.thomasnet.com/company/junior-s-building-materials-inc-30943576/profile?cov=NA&format=json&heading=23639008&limit=2589&searchsource=suppliers&searchterm=Doors&what=Doors&which=prod&coverage_area=NA&pg=80,"Ringgold, GA 30736",,Distributor*,$10 - 24.9 Mil Revenue,,"Distributor of building materials for the construction industry. Products include windows, doors, beams, hardware, tools, connectors, paints, fasteners, faucets, fascia, hoses, stains, sprayers, trusses, soffits and pipe are available. Decking, railing, roofing, siding and pest control products are also offered.",No,Success,,False,"Confidence score 9.2 >= 7.0; Employee count 232 (from '232 (Junior's specific), 10,001+ (US LBM umbrella)') >= 10; No estimator detected: No estimators found in titles or company details; ICP mismatch: no, junior's building materials differs from specialized door manufacturers like overly door co., ac; No decision makers found","{""notes"": ""Junior's Building Materials, Inc is a family-owned wholesale building materials distributor in Ringgold, Georgia, serving primarily commercial and residential builders with a broad product ",9.2,"Junior's Building Materials, Inc is a significant regional wholesaler of building materials supplying doors among other products. It is part of the larger US LBM network, emphasizing distribution over manufacturing. The company leadership includes President Bob Rummel and Branch Manager Michael Johnston. While general estimating services exist, there is no evidence of specialized Division 8 estimators related to door hardware costing. Junior's is thus relevant as a complementary door product distributor, not a direct competitor or ICP match to dedicated door manufacturers or hardware specialists.","No confirmed presence of DIV 8 estimators found yet; estimating services exist but specific door hardware cost estimators unverified.|Estimated employees for US LBM: 10,001+, Junior's specific count unknown|Junior's Building Materials is similar to other door suppliers by stocking doors and windows but differs as they offer a broader set of building materials and act primarily as a distributor, not a manufacturer.|The company’s industry is principally distribution and supply within the construction sector, not manufacturing.|Junior's offers a wide product range including windows, doors, lumber, roofing, siding, tools, hardware|Part of US LBM, a large national distributor of building materials with 10,001+ employees|Official website found: https://www.juniorsbuildingmaterials.com/ with detailed product categories including windows, doors, roofing, siding, and decking.|The company offers a comprehensive product line including windows, doors (Sierra Pacific, Therma-Tru), roofing, decking, siding, hardware, etc.|Junior's is not a specialized door manufacturer like Overly Door Co. or Acudor Products, making it a complementary but not direct ICP match.|No evidence of Division 8 estimators employed at Junior's Building Materials from available LinkedIn profiles.|Contact phone number listed as (706) 937-3400 at ZoomInfo and company website.|Junior's primarily a distributor, not a door manufacturer, making it dissimilar to Overly Door Co., Acudor Products, Inc., voestalpine Roll Forming Corporation|Website: https://www.juniorsbuildingmaterials.com/|Walter Irick identified as a Construction Representative at Junior's with moderate contact potential|Junior's official website is https://www.juniorsbuildingmaterials.com which provides product lists and locations.|Estimated employees count for Junior's is unknown; US LBM employs over 10,000 employees.|Contact details such as emails and direct phone numbers for key executives are not publicly accessible in the resources reviewed.|Junior's business model is distribution-focused, unlike specialized door manufacturers|Product portfolio includes doors from brands like Sierra Pacific and Therma-Tru along with broad building materials.|Detailed contacts for C-suite or Div 8 estimator roles remain to be identified through focused searches and validation.|Branch Manager: Michael Johnston (LinkedIn: https://www.linkedin.com/in/michael-johnston-93037025b).|Social media includes Facebook and Twitter accounts.|Key identified personnel include Walter Irick (Construction Representative, score 6/10), Bob Rummel (President candidate), and Michael Johnston (Branch Manager), but requires further validation.|Junior's is a family-owned brand under US LBM umbrella serving North Georgia and Chattanooga|Junior's Building Materials is a broad building materials distributor serving Chattanooga and North Georgia as part of US LBM group.|Company LinkedIn URL relates to US LBM: https://www.linkedin.com/company/uslbm|Company is part of the larger US LBM network.|Company LinkedIn under US LBM umbrella: https://www.linkedin.com/company/uslbm.|Junior's Building Materials, Inc is a wholesale building materials distributor in Ringgold, Georgia with approx. 232 employees.|LinkedIn profile of parent company US LBM is https://www.linkedin.com/company/uslbm; no separate Junior's LinkedIn page found.|ICP match to specialized door manufacturers: No, due to broad distributor focus, not manufacturing.|Focus is on distribution and supply chain rather than manufacturing or specialized door hardware engineering.|No direct evidence of DIV 8 estimators on staff yet|No publicly found Div 8 estimators; company provides general estimating services.|Company website: https://www.juniorsbuildingmaterials.com.|Junior's Building Materials, Inc is a family-owned distributor of a wide range of building materials mainly serving commercial and residential construction sectors from locations in Georgia and Tennessee.|Next steps focus on scraping the official website and conducting targeted LinkedIn searches for CEO, estimator, VP Sales, and Director Operations roles to find key decision makers and validate company information.|They have multiple locations, including Rossville, Chattanooga, and Jasper (Georgia/North Georgia market).|Junior's Building Materials, Inc. operates as a building materials distributor primarily in the Georgia area, affiliated with US LBM.|Michael Johnston is the Branch Manager, important for regional operations and possibly sales management.|No verified LinkedIn company profile found yet; US LBM appears as a major distributor in the industry, possibly related but not the same company.|Provides estimating and delivery services|President is Bob Rummel (LinkedIn: https://www.linkedin.com/in/bob-rummel-334125b).|Key individual found: Walter Irick, Construction Representative at Junior's Building Materials Inc based in Rossville, GA. LinkedIn profile URL available.|Industry: Wholesale Building Materials|Bob Rummel is the President of Junior's Building Materials; highly relevant decision-maker with strong leadership role.|No information currently found about whether the company employs DIV 8 estimators.|The company has a broad product range including doors but is not a specialized door manufacturer or supplier like Overly Door Co. or Acudor Products.",https://www.linkedin.com/company/uslbm,https://www.juniorsbuildingmaterials.com,"232 (Junior's specific), 10,001+ (US LBM umbrella)",Wholesale Building Materials Distribution,"Junior's Building Materials, Inc is a family-owned wholesale distributor of a broad range of building materials, including windows, doors (brands like Sierra Pacific and Therma-Tru), roofing, siding, decking, and pest control products, primarily serving commercial and residential construction sectors in Georgia and Tennessee. The company operates under the US LBM network and focuses on distribution and supply chain services, including delivery and estimating, but is not a manufacturer nor specialized in Division 8 estimating.",No,"No, Junior's Building Materials differs from specialized door manufacturers like Overly Door Co., Acudor Products, Inc., and voestalpine Roll Forming Corporation because it is primarily a distributor of a wide range of building materials rather than focusing on manufacturing or specialized door hardware engineering.","Junior's offers a broad portfolio of building materials including door products as a distributor, not as a manufacturer or specialized supplier. Their business model focuses on distribution and serving local construction supply chains, whereas the other companies are specialized door manufacturers or hardware fabricators. Furthermore, no Div 8 door/frame/hardware cost estimators were found on staff, highlighting a difference in specialization.",,,,4.0,0.0
Clare Machine Works Limited,https://www.thomasnet.com/company/clare-machine-works-limited-30755292/profile?cov=NA&format=json&heading=23639008&limit=2589&searchsource=suppliers&searchterm=Doors&what=Doors&which=prod&coverage_area=NA&pg=82,"Meteghan Centre, NS B0W2K0",,Custom Manufacturer*,$1 - 4.9 Mil Revenue,,"Custom manufacturer of boat equipment and carb pot haulers. Products include lobsters, scallop drags, rudders, planetary and anchor winches, fish processing equipment, fuel tanks, stainless steel processing tables, dragger doors, net drums and stabilizers. Capabilities include welding, designing, fabrication, engineering and machining.",No,Success,,False,Confidence score 9.2 >= 7.0; Employee count 11 (from '11-50') >= 10; No estimator detected: No estimators found in titles or company details; ICP match: no; clare machine works limited is not similar to door suppliers or manufacturers like overly door c; No decision makers found,"{""notes"": ""Clare Machine Works Limited is located in Meteghan Centre, Nova Scotia, Canada, specializing in custom manufacturing of boat and fisheries equipment including lobster and scallop drags, rud",9.2,"Clare Machine Works Limited is irrelevant to the door supply or manufacturing industry due to its niche specialization in marine and fisheries equipment manufacturing. It neither produces nor supplies door hardware; therefore, it does not employ Div 8 estimators. The company’s focus on customized marine equipment and lack of publicly available leadership or key decision maker contacts emphasize its separation from the door industry.","They are not an ICP match compared to door suppliers like Overly Door Co., Acudor Products, Inc., or voestalpine Roll Forming Corporation due to distinctly different industry focus.|No current evidence suggests they employ Div 8 estimators specialized in door hardware.|The company has 11-50 employees and has a small LinkedIn presence with 36 followers and 2 employees listed.|Capabilities include welding, designing, fabrication, engineering, machining, hydraulic system services|Does not employ DIV 8 estimators relevant to door/frame/hardware estimation|Company LinkedIn: https://www.linkedin.com/company/clare-machine-works-ltd|No publicly found key decision makers (CEO, President, Operations Manager, Sales Manager, Estimator) with clear profiles or contacts yet found.|Specializations: Welding, designing, fabrication, engineering, machining, marine hydraulics|Clare Machine Works Limited operates in the marine and fisheries manufacturing industry in Nova Scotia, Canada.|Specializes in custom marine equipment such as winches, haulers, fish processing equipment, not door hardware.|Company website: https://www.claremachineworks.com|Company is located in Meteghan Centre, Nova Scotia, Canada, not Scotland as initially queried.|Presence of client testimonials endorsing their custom marine manufacturing expertise|Estimated number of employees: 11-50 based on LinkedIn|Does not employ Div 8 estimators and is not an ICP match to door manufacturers or suppliers.|Company emphasizes innovation and customer partnership in the fisheries and marine sectors.|Company name: Clare Machine Works Limited|Primary market is global marine and fisheries sectors, not building doors or related products|The official website for Clare Machine Works Limited is https://claremachineworks.com/|They specialize in manufacturing custom boat and fishery equipment, not door hardware.|Company has expertise in welding, fabrication, machining, and engineering related to marine and fishery products.|Products include lobster/scallop drags, rudders, planetary and anchor winches, fish processing equipment, fuel tanks, stainless steel processing tables, dragger doors, net drums, stabilizers|No publicly available emails or phone numbers found on LinkedIn or company website.|ICP match to door suppliers/manufacturers: No; different industry, product focus, and market|No LinkedIn profile data found in current info; social media includes Facebook page|Emphasizes innovation and machine-engineered solutions|Phone contact and emergency line are publicly listed on the company website.|Founded in 1972, family-owned and operated from Meteghan Centre, Nova Scotia, Canada|LinkedIn company profile exists at https://ca.linkedin.com/company/clare-machine-works-ltd|They are not similar to door manufacturers like Overly Door Co., Acudor Products, Inc., or voestalpine, as their product focus and market differ.|Company has 11-50 employees, 36 followers on LinkedIn, and was founded in 1972.|Two employees linked on LinkedIn; no clear C-suite or sales leadership listed publicly.|Specializes in custom manufacturing and fabrication for marine and fisheries sectors|Contact phone: 1.902.645.2216, Emergency: 1.902.837.8118|Working hours 8am-5pm|Industry: Marine and fisheries manufacturing|LinkedIn page and website provide company overview but lack detailed executive or management contacts.|They have no evidence of employing Div 8 estimators or involvement with door, frame, and hardware manufacturing or supply.|Strong industry partnerships confirmed via client testimonials, but internal leadership contacts need targeted searches|Key decision-makers not identified yet; lack of public leadership info on website or LinkedIn|Next steps involve focused LinkedIn searches for specific executive and managerial titles to locate decision-makers.|Key known personnel includes Vince Stuart (executive leadership) and Jeff Long (welder) to be further investigated for executive/decision maker roles.|Next steps include targeted LinkedIn searches for CEO, president, operations manager, sales manager, and estimators for contact identification and validation.|No publicly listed key executives or leadership team info on website|Description: Custom manufacture of boat and fisheries equipment including lobsters, scallop drags, rudders, winches, fish processing equipment, hydraulic systems|Location: Meteghan Centre, Nova Scotia, Canada|Website: https://claremachineworks.com|Their main product focus is on marine fishery equipment including hydraulic haulers, winches, fish graders, fabrication, and hydraulics.|No evidence of employing DIV 8 estimators|Not similar to door suppliers/manufacturers like Overly Door Co., Acudor Products, or voestalpine Roll Forming based on product focus and market segment|Clare Machine Works Limited is a private company in Meteghan Centre, Nova Scotia, Canada, specializing in custom manufacturing for marine and fisheries sectors.",https://www.linkedin.com/company/clare-machine-works-ltd,https://www.claremachineworks.com,11-50,Marine and Fisheries Equipment Manufacturing,"Custom manufacturer of marine boat and fisheries equipment specializing in welding, engineering, fabrication, and machining. Products include lobster and scallop drags, rudders, winches, fish processing equipment, fuel tanks, stainless steel processing tables, dragger doors, net drums, and stabilizers.",No,"No; Clare Machine Works Limited is not similar to door suppliers or manufacturers like Overly Door Co., Acudor Products, Inc., or voestalpine Roll Forming Corporation because it specializes exclusively in marine and fisheries equipment manufacturing, not door hardware or related products.","The company’s product focus is on marine boat and fishery equipment, including specialized custom manufacturing and fabrication services such as welding and machining for marine hydraulics. Its market is global marine and fisheries sectors rather than construction or building materials sectors focused on doors, frames, and hardware. This distinct product and market focus differentiates it clearly from door manufacturers and suppliers.",,,,0.0,0.0
