companyName,profileUrl,location,logoUrl,companyType,revenue,establishedYear,description,isVerified,api_enrichment_status,api_error_message,is_qualified,qualification_reason,api_raw_response_preview,api_confidence_score,api_notes,api_findings,api_company_linkedin,api_website,api_num_employees,api_industry,api_short_summary,api_has_div8_estimators,api_icp_match,api_logic,api_lead_linkedin_profiles,api_decision_makers,api_estimator_leads,api_lead_count,api_relevant_lead_count
"Moduspace, Inc.",https://www.thomasnet.com/company/moduspace-inc-30214670/profile?cov=NA&format=json&heading=23639008&limit=2589&searchsource=suppliers&searchterm=Doors&what=Doors&which=prod&coverage_area=NA&pg=82,"Laval, QC H7T1S9",,"Manufacturer* , Custom Manufacturer",$1 Mil Revenue,,"Manufacturer of doors for use in conjunction with the modular panel wall system. Doors are made with the same panel as the walls & have the same thickness in order to be flush with the system. Single doors, double doors, sliding doors & emergency doors all available. Doors are supplied with stainless steel hinges & can be delivered with many options like glazing (flush with the leave), door closers, handle, push plate, kick plate & integrated interlock.",No,Success,,False,"Confidence score 9.0 >= 7.0; Employee count 2 (from '2-10') < 10; No estimator detected: No estimators found in titles or company details; ICP mismatch: no, moduspace focuses exclusively on modular wardrobes and home storage solutions, not on manufactur; No decision makers found","{""notes"": ""Moduspace, Inc. is a small New Zealand-based company specializing in modular wardrobe systems and home storage solutions. They focus on retail furniture and home furnishings sector, with 2-",9.0,"Moduspace, Inc. is a small New Zealand-based modular wardrobe systems company, not relevant to door supply or manufacturing. They do not employ Division 8 estimators and have no involvement in door hardware or architectural door products. Their key personnel focus on leadership and operations in furniture retail and manufacturing, not door estimating or sales.","Moduspace.sg and us.moduspace.sg focus on modular acrylic display cases (collectibles), not modular panel wall doors.|No Division 8 estimators on staff.|No executives or specialists specifically focused on doors, door estimating, or door hardware were found among key personnel.|Moduspace focuses on home and retail modular wardrobe systems, distinct from companies manufacturing doors for modular panel wall systems with architectural hardware.|Key executives identified: Bryan Wong (Co-Founder, CEO), Aaron Bradshaw (Managing Director), Nigel Chan (International Sales Manager), Praneeth Sankalpa (Senior Operations Executive).|Moduspace's market focus is home and retail furniture sector, not building construction sector.|No evidence of door manufacturing or estimating-related roles found.|No data on DIV 8 estimators employed by the company available from current resources.|Company operates mainly in New Zealand with modular furniture focus.|Similar companies like Overly Door Co. and Acudor Products produce doors with architectural hardware, differing from Moduspace's product line.|Industry: Retail Furniture and Home Furnishings, not construction or door hardware manufacturing.|Not similar to door manufacturers like Overly Door Co., Acudor Products, Inc., or voestalpine Roll Forming Corporation due to different product focus and target markets.|Official website is www.moduspace.co.nz; LinkedIn company page at https://www.linkedin.com/company/moduspace.|No evidence of Division 8 estimators or door manufacturing/sales specialists within Moduspace.|Company size is small (2-10 employees), industry classified as Retail Furniture and Home Furnishings.|Moduspace, Inc. is a New Zealand-based small company (2-10 employees) specializing in modular wardrobe systems and storage solutions.|Estimated Number of Employees: 2-10|Relevant contact leads identified are primarily in leadership and sales/operations roles, suitable for engagement if needed.|No key people or executives identified from search results.|Moduspace, Inc. manufacturer of doors for modular panel wall systems is not clearly identified in current search results.|Industry: Retail Furniture and Home Furnishings|Official website: https://www.moduspace.co.nz; LinkedIn: https://www.linkedin.com/company/moduspace.|Company is not similar to door manufacturers like Overly Door Co. or Acudor Products due to different product focus and market.|No direct matches to other door manufacturers like Overly Door Co., Acudor Products, Inc., or voestalpine Roll Forming Corporation found yet.|Company Name: Moduspace, Inc.|Moduspace, Inc. appears to be a New Zealand based modular wardrobe systems company, not a door manufacturer for modular panel wall systems.|Moduspace, Inc. is a small New Zealand company with 2-10 employees focused on modular wardrobe systems and home storage solutions rather than doors or door hardware.|Key People: Bryan Wong (Co-Founder, CEO, Product Designer), Aaron Bradshaw (Managing Director), Nigel Chan (International Sales Manager), Praneeth Sankalpa (Senior Operations Executive/Production Planner).|Moduspace offers modular wardrobes tailored for modern living, emphasizing adaptability, style, and durability.|Industry classification is Retail Furniture and Home Furnishings.|No evidence of Div 8 estimators employed at Moduspace, Inc.|Company product focus differs from large door manufacturers, focusing on modular wardrobe systems, not panel wall doors.|No official website, LinkedIn company profile, or employee count found for Moduspace, Inc. related to modular panel wall system doors.|No evidence of Division 8 estimators on staff, consistent with their product focus.|Key decision-makers identified include Bryan Wong (CEO & Co-Founder), Aaron Bradshaw (Managing Director), Nigel Chan (International Sales Manager), and Praneeth Sankalpa (Senior Operations Executive/Production Planner).|LinkedIn Profile: https://www.linkedin.com/company/moduspace|Not similar to door manufacturers like Overly Door Co., Acudor Products, Inc., or voestalpine Roll Forming Corporation due to product and market focus differences.|Company website is https://www.moduspace.co.nz and LinkedIn profile is https://www.linkedin.com/company/moduspace.|Executive leadership includes Aaron Bradshaw (Managing Director), Bryan Wong (Co-Founder, CEO), Nigel Chan (International Sales Manager), and Praneeth Sankalpa (Senior Operations Executive).|Primary Business: Manufacturer of modular wardrobe systems and home storage solutions, not doors for construction.|No publicly available emails or phone contacts found for key executives.|An older source (Scribd) references moduspace.com and modular wall systems for pharma industry but requires further validation for connection to Moduspace, Inc.|Website: https://www.moduspace.co.nz|Moduspace focuses on retail modular furniture wardrobes, distinguishing it from architectural door suppliers and manufacturers.",https://www.linkedin.com/company/moduspace,https://www.moduspace.co.nz,2-10,Retail Furniture and Home Furnishings,"New Zealand company specializing in modular wardrobe and home storage systems designed for modern living, prioritizing style and functionality.",No,"No, Moduspace focuses exclusively on modular wardrobes and home storage solutions, not on manufacturing doors, frames, or hardware like Overly Door Co. or Acudor Products, Inc.","Moduspace differs from door suppliers and manufacturers because it produces modular wardrobes and retail furniture, not doors or door hardware. It operates in a different market segment focused on home furnishings rather than construction or architectural door systems.",,,,4.0,0.0
Premier Exteriors Roofing and Siding Contractor,https://www.thomasnet.com/company/premier-exteriors-roofing-and-siding-contractor-30545944/profile?cov=NA&format=json&heading=23639008&limit=2589&searchsource=suppliers&searchterm=Doors&what=Doors&which=prod&coverage_area=NA&pg=82,"Omaha, NE 68137",,"Service Company* , Custom Manufacturer",$5 - 9.9 Mil Revenue,1978.0,Replacement doors and windows.,No,Success,,False,"Confidence score 8.5 >= 7.0; Employee count 27 (from 'Approximately 27 (Zoominfo), LinkedIn shows 11-50 employees') >= 10; No estimator detected: No estimators found in titles or company details; ICP mismatch: no. premier roofing & siding contractors focuses on installation and contracting services rather tha; No decision makers found","{""notes"": ""Company Name: Premier Exteriors Roofing and Siding Contractor (also operating as Premier Roofing & Siding Contractors)\n\nWebsite: https://www.premierroofingandsiding.com/\n\nLocation: Ches",8.5,"Premier Exteriors is primarily a roofing and siding contractor with door and window replacement services in Chesapeake, VA. It is not involved in door manufacturing or specialized door supply, nor does it have specialized DIV 8 estimators on staff. Key personnel identified include President Jamie Caudill and Sales Representative Donn Price. The company maintains a moderate workforce and is BBB accredited with an A+ rating.","Products: Replacement windows (MI 1650 Series), vinyl siding, roof replacement and repair|Industry classified under 'Construction'.|Estimated employees: moderate, exact number not found.|Several companies with similar names focus on roofing, siding, and window replacement, indicating industry alignment but not exact match.|No key people identified at this time; planned LinkedIn personnel searches required.|No key decision-maker contacts found yet|Website: https://www.premierroofingandsiding.com/|Primary customers: Residential homeowners| - Tim Slack, Siding and Trim Crew Chief|No LinkedIn company profile or employee data retrieved yet|Company LinkedIn: https://www.linkedin.com/company/premier-roofing-&-siding|Official Website: https://www.premierroofingandsiding.com/|No direct focus on door supply or manufacturing found|Company Name: Premier Roofing & Siding Contractors, Inc.|No LinkedIn company page found yet; planned LinkedIn queries are needed to locate exact company profile and employees.| - Rick Phelps, Director|Industry: Construction, specializing in roofing, vinyl siding, and replacement windows.|Service area: Southeastern Virginia & Northern North Carolina| - Donn Price, Sales Representative|Location: 1215 Bainbridge Blvd, Chesapeake, VA 23324| - Jamie Caudill, President|No evidence of door supply or manufacturing; company focuses on roofing, siding, and windows.|The company is not a door manufacturer or supplier like Overly Door Co., Acudor Products, or voestalpine Roll Forming Corporation.|No evidence of DIV 8 estimators on staff found|Premier Exteriors Roofing and Siding Contractor operates primarily as a roofing and siding contractor offering replacement doors and windows in Chesapeake, VA.|Employee Count: Approximately 27 (Zoominfo), LinkedIn shows 11-50 employees.|Company official name: Premier Roofing & Siding Contractors, Inc.|Does not employ Division 8 Estimators as per available data.|Key Personnel identified from Zoominfo and company website:|Product attributes: Energy efficient windows, multiple window materials and styles|Not a direct ICP match with door suppliers/manufacturers due to product/service differences.|Company website: https://www.premierroofingandsiding.com/| - Theresa Fendley, Office Manager|No definitive official company website directly matching the full company name was found in initial search results.|No current indication of Division 8 estimators on staff.|Phone numbers: 1-757-578-1160, 1-757-230-2722|Main company phone: 1-757-543-8958.|Based in Chesapeake, VA, servicing Southeastern VA and Northern NC.|Official website: https://www.premierroofingandsiding.com/|No data so far on number of employees or whether company employs Div 8 estimators.| - Karl Scheda, Siding and Trim Crew Chief|LinkedIn company profile identified for further scraping: https://www.linkedin.com/company/premier-roofing-&-siding|Key personnel identified include Donn Price (Sales Representative) and Jamie Caudill (President).|Specializes in roofing, siding, and replacement windows but no door manufacturing or supply.|LinkedIn Company Profile: https://www.linkedin.com/company/premier-roofing-&-siding|No evidence of DIV 8 estimators on staff.|One link (https://www.premierroofingandsiding.com/replacement-windows.html) shows relevant services but it's unclear if it is the exact company.|BBB Accredited with an A+ rating, license DPOR 2705058111 valid through 8/31/2026.|Industry: Exterior Building Contractor - Roofing, Siding, and Window Replacement|Key executive contacts or leadership roles have not yet been identified.|Company name confirmed as Premier Roofing & Siding Contractors, Inc.|BBB-listed phone number: (757) 543-8958.|Approximately 27 employees (Zoominfo) and 11-50 employees per LinkedIn estimate.|Positive customer testimonials featured on website",https://www.linkedin.com/company/premier-roofing-&-siding,https://www.premierroofingandsiding.com/,"Approximately 27 (Zoominfo), LinkedIn shows 11-50 employees","Construction, specializing in roofing, vinyl siding, and replacement windows","Premier Exteriors Roofing and Siding Contractor operates as a residential contractor in Chesapeake, VA focusing on installation of windows, doors, roofing, and siding. It is not a door manufacturer or supplier but offers related replacement services.",No,"No. Premier Roofing & Siding Contractors focuses on installation and contracting services rather than manufacturing or supplying specialized doors like companies such as Overly Door Co., Acudor Products, Inc., or voestalpine Roll Forming Corporation.","The company sources products such as doors and windows from suppliers and does not manufacture or supply them directly. Its business model centers on residential installation services primarily in roofing, siding, and window/door replacements, differing from door manufacturers/suppliers who produce and distribute door products.",,,,6.0,0.0
CREATIVE HOME ENGINEERING,https://www.thomasnet.com/company/creative-home-engineering-30827185/profile?cov=NA&format=json&heading=23639008&limit=2589&searchsource=suppliers&searchterm=Doors&what=Doors&which=prod&coverage_area=NA&pg=83,"Gilbert, AZ 85297",,Custom Manufacturer*,$1 - 4.9 Mil Revenue,,"Custom manufacturer of secret doors and passageways. Types of secret doors include mirror, single and double bookcase, sliding, stone, and fireplace secret doors.",No,Success,,False,"Confidence score 9.2 >= 7.0; Employee count 5 (from '5-10') < 10; No estimator detected: No estimators found in titles or company details; ICP mismatch: no, creative home engineering differs from other door suppliers like overly door co. in that they fo; No decision makers found","{""notes"": ""Company: Creative Home Engineering is a custom manufacturer specializing in secret doors and passageways, including mirror, single and double bookcase, sliding, stone, and fireplace secret ",9.2,"Creative Home Engineering occupies a specialized niche within the door manufacturing industry focusing on secret and secure doors and architectural concealment. They do not employ Division 8 estimators and operate as a small, innovative manufacture distinct from traditional mass-market door suppliers and manufacturers.","No publicly available direct emails for leadership; contact likely via website or phone.|Industry: Architecture and Planning, specializing in secret and secure doors|Company is a niche manufacturer focused on hidden and security doors, distinct from traditional door suppliers like Overly Door Co.|Product Types: Mirror doors, bookcase doors (single and double), sliding, stone, fireplace, panic rooms, in-home vaults|Official Website: https://hiddenpassageway.com/|Leadership includes Markus Shepherd (President) and Steve Humble (CEO), identified via LinkedIn.|LinkedIn Company Profile: https://www.linkedin.com/company/creative-home-engineering|Company Name: Creative Home Engineering|Not aligned with Division 8 estimator titles publicly, no known direct Div 8 estimators found|Founded in 2003 by Steve Humble, now President and CEO.|Company has installed over 3000 secret doors globally, indicating a niche but impactful market presence|Estimated Employees: 5-10 (LinkedIn data)|No publicly available emails or direct phone numbers for executives discovered|Steve Humble LinkedIn: https://www.linkedin.com/in/steve-humble-484a79345|Approximately 9 employees focused on production, design, and business development.|Company name: Creative Home Engineering|Creative Home Engineering is based in Gilbert, Arizona and is the premier custom manufacturer of high-security secret doors and secret passageways globally.|Email domain is '@hiddenpassageway.com' with common formats being first@domain or firstinitiallastname@domain.|Phone contact on website: (480) 899-3477.|No explicit data found yet indicating if the company employs DIV 8 estimators.|Social Media: Active Instagram at https://www.instagram.com/hidden_passageway/, Facebook at https://www.facebook.com/CreativeHomeEngineering/|Founded: 2004|They do not appear to employ Division 8 estimators internally.|The company website is https://hiddenpassageway.com/, offering detailed product types including mirror, bookcase, sliding, stone, and fireplace secret doors.|Industry: Custom manufacturing of secret doors and passageways with high-security features|They differ from typical door manufacturers by focusing on custom, secure, engineered secret doors for luxury and high-security clients.|Employees: Estimated 2-10|Official website: https://hiddenpassageway.com with phone number 480-899-3477 confirmed.|LinkedIn company page confirms specialization in secret passage systems, secure hidden doors, and panic rooms with an estimated 10-50 employees.|The company is similar to other door manufacturers in specializing in door manufacturing but niche focused on secret and secure passage doors rather than general doors.|Key Person: Steve Humble, President, LinkedIn: https://www.linkedin.com/in/steve-humble-484a79345, Score 9/10|Company website: https://hiddenpassageway.com/; LinkedIn: https://www.linkedin.com/company/creative-home-engineering.|Key executives found: Steve Humble (President, CEO), Jon Harris (Marketing Director), Markus Shepherd (Manufacturing Manager), Jordan Carpenter (Shop Foreman), Todd Bredeson (Production Manager)|Instagram: https://www.instagram.com/hidden_passageway/|Creative Home Engineering is based in Gilbert, AZ, specializing in custom secret and security doors and passageways.|Estimated employee count is relatively small; exact number not specified.|The company’s market focus is luxury, secure, and custom secret door solutions, differing from conventional door suppliers.|Creative Home Engineering is a specialized manufacturer of custom secret doors and passageways based in Gilbert, AZ.|Steve Humble is the President of Creative Home Engineering and a key decision-maker.|No clear evidence of employing DIV 8 estimators found publicly|Key individuals include Steve Humble (President/CEO), Markus Shepherd (Manufacturing Manager), Travis Humble (Lead Designer), Daniel Stock (Production Manager), and Todd Bredeson (Shop Foreman).|Location: Gilbert, Arizona|No publicly identified Division 8 estimators; estimating likely integrated in manufacturing or project roles.|Company differentiates from typical door manufacturers by specialized secret door engineering and luxury/security focus|Product types: Motorized secret doors including mirror, single/double bookcase, sliding, stone, fireplace, panic rooms, vaults|Their product portfolio includes secret doors such as mirror, bookcase, sliding, stone, fireplace, panic rooms, and vaults.|Company is niche-focused on custom secret passage systems with high security, differentiating from general door manufacturers",https://www.linkedin.com/company/creative-home-engineering,https://hiddenpassageway.com,5-10,Custom manufacturing of secret doors and passageways with high-security features,"Creative Home Engineering is a specialized manufacturer based in Gilbert, AZ, focusing on custom secret and security doors including mirror, bookcase, sliding, stone, fireplace, panic rooms, and vault doors for luxury residential and commercial markets.",No,"No, Creative Home Engineering differs from other door suppliers like Overly Door Co. in that they focus on niche, custom secret and secure hidden doors rather than general commercial door manufacturing or supply.","The company specializes in custom-engineered secret doors and passageways with a focus on security and luxury, serving a niche market distinct from standard door manufacturers. Their products include secret doors, panic rooms, bulletproof windows, and vaults, emphasizing concealment and high security rather than volume door supply.",,,,4.0,0.0
