companyName,profileUrl,location,logoUrl,companyType,revenue,establishedYear,description,isVerified,api_enrichment_status,api_error_message,is_qualified,qualification_reason,api_raw_response_preview,api_confidence_score,api_notes,api_findings,api_company_linkedin,api_website,api_num_employees,api_industry,api_short_summary,api_has_div8_estimators,api_icp_match,api_logic,api_lead_linkedin_profiles,api_decision_makers,api_estimator_leads,api_lead_count,api_relevant_lead_count
Architectural Millwork of Santa Barbara,https://www.thomasnet.com/company/architectural-millwork-of-santa-barbara-30754828/profile?cov=NA&format=json&heading=23639008&limit=2589&searchsource=suppliers&searchterm=Doors&what=Doors&which=prod&coverage_area=NA&pg=80,"Santa Barbara, CA 93103",,Custom Manufacturer*,$5 - 9.9 Mil Revenue,1968.0,"Custom manufacturer of wood products for commercial and residential sectors. Products include cabinets, fire place mantels, clad and roll down screen windows, bi-folding and sliding doors, mouldings, columns and furniture. Capabilities include design, engineering and architectural millwork and woodwork.",No,Success,,False,"Confidence score 8.5 >= 7.0; Employee count 2 (from '2-20') < 10; Has estimator: Found estimator in employee titles; ICP mismatch: no, the company differs from specialized door suppliers/manufacturers like overly door co. due to it; No decision makers found","{""notes"": ""Architectural Millwork of Santa Barbara is a family-owned custom woodworking and architectural millwork company located in Santa Barbara, California. Key leadership from BBB profile and oth",8.5,"The company is a small, highly specialized custom millwork firm with a long-standing local reputation (BBB A+ since 1991; CSLB licensed). It provides doors among other woodwork products but is not a primary door manufacturer or typical door supplier customer profile. Div 8 estimating appears to be handled internally, likely by Alex Mathews. Contact information is limited to general company phone and estimator email; LinkedIn profiles are confirmed only for some key personnel. Further verification is recommended for precise role confirmations.","No direct emails found; main contact phone is 805-965-7011|Key operational managers: Mike Hendrick (Production Manager), Joseph Lungren (Designer/Drafter), Alex Mathews (Estimating)|LinkedIn key personnel: Mike Hendrick, Joseph Lungren|Industry: Construction|Official website: https://www.archmill.com/|Company founded in 1969, located at 8 North Nopal Street, Santa Barbara, CA 93103|Estimated employees: Approx. 2-20, small boutique firm|Estimated 2-10 employees per LinkedIn; BBB lists several key personnel, indicating possibly more|Location: 8 North Nopal Street, Santa Barbara, California 93103|Leadership: Glenice Mathews (CEO), Tom Mathews (President), Joe Mathews (Vice President), Terry Alcantara (CFO)|LinkedIn profiles confirmed: Mike Hendrick (Production Manager), Joseph Lungren (Designer/Drafter)|LinkedIn company page: https://www.linkedin.com/company/architectural-millwork-of-santa-barbara|Company website is https://www.archmill.com/ and LinkedIn page is https://www.linkedin.com/company/architectural-millwork-of-santa-barbara.|Specializes in custom woodworking products including cabinets, doors, mantels, mouldings, columns, furniture|BBB A+ rating since 1991, CSLB license #261772 solidifies legitimacy and reputation|Company operates as a small-sized business, highly specialized and custom-focused|Web presence on archmill.com and social media platforms including LinkedIn|Alex Mathews is believed to serve as the Div 8 estimator but confirmation is needed.|Capabilities: Design, engineering, architectural millwork and woodwork|Industry: Architectural millwork & custom woodworking in construction sector|Products: Custom wood cabinetry, fireplace mantels, bi-folding/sliding doors, roll down screens, mouldings, columns, furniture|Website: https://www.archmill.com/|Phone: (805) 965-7011|The company is not a direct ideal customer profile match for door suppliers/manufacturers like Overly Door Co. but overlaps through door products within custom millwork.|Architectural Millwork of Santa Barbara is a custom woodworking and architectural millwork firm established in 1969 in Santa Barbara, CA.|LinkedIn profiles located for Mike Hendrick and Joseph Lungren; other executives need to be found.|Email found: alex@archmill.com (estimator contact)|Leadership roles not fully confirmed on LinkedIn, further profile scraping needed|Key leadership: Glenice Mathews (CEO), Tom Mathews (President), Joe Mathews (VP), Terry Alcantara (CFO)|Products: Custom cabinets, fireplace mantels, clad and roll down screen windows, bi-folding and sliding doors, mouldings, columns, furniture|The company has approximately 2-10 employees listed on LinkedIn, but leadership roles suggest a slightly larger organization.|Key executives include Glenice Mathews (CEO), Tom Mathews (President), Joe Mathews (VP), Terry Alcantara (CFO), Mike Hendrick (Production Manager), Joseph Lungren (Designer/Drafter), and Alex Mathews (Estimator likely responsible for Division 8 estimating).|Known key personnel: Tom Mathews (President), Joe Mathews (Project Manager/VP), Glenice Mathews (CEO), Terry Alcantara (CFO), Mike Hendrick (Production Manager), Alex Mathews (Estimator), Joseph Lungren (Designer/Drafter)|Key people: Tom Mathews (President), Joe Mathews (Vice President), Mike Hendrick (Production Manager), Jenae Pash (Project Manager)|Estimated employees: 2-10|They specialize in cabinets, fireplace mantels, roll down screen windows, bi-folding and sliding doors, mouldings, columns, and custom furniture.|Industry: Construction specializing in architectural millwork and custom woodworking|Div 8 estimator presence likely through Alex Mathews, to be confirmed|Available contacts include company phone (805) 965-7011 and general emails like alex@archmill.com; specific personal contacts are limited and require further LinkedIn profile exploration.|CSLB License: #261772 active through 4/30/2026|Contact: Phone 805-965-7011, website inquiry forms|Company Name: Architectural Millwork of Santa Barbara|No direct personal emails or phone numbers of executives publicly confirmed yet|Company is BBB accredited since 1991 with A+ rating|BBB accreditation: Accredited since 1991 with an A+ rating|Their capabilities include design, engineering, architectural millwork, and woodwork.|Company offers door products but is a boutique millwork firm, not a dedicated door manufacturer, thus not ICP match to large door suppliers|Company emphasizes local community support and craftsmanship|Company size: Approximately 2-10 employees per LinkedIn; more roles identified via BBB and other sources|Alex Mathews is Estimating - potential Div 8 estimator role|No clear indication of Div 8 estimator presence|Mike Hendrick is Production Manager; Joseph Lungren is Designer/Drafter (LinkedIn verified)|LinkedIn company profile: https://www.linkedin.com/company/architectural-millwork-of-santa-barbara|Differentiated from specialized door manufacturers like Overly Door Co. by broader product and service offering|No direct emails or personal phone numbers for executives located|The firm is BBB accredited with an A+ rating and holds Caliifornia CSLB license #261772.|Primary products: Custom cabinets, fireplace mantels, mouldings, doors (bi-folding, sliding), windows, columns, furniture|Company name: Architectural Millwork of Santa Barbara|Located in Santa Barbara, CA; family-owned established 1969|Industry classified as Construction, focused on architectural millwork|ICP Match: No, company differs from specialized door manufacturers due to broader custom millwork portfolio and local boutique focus|Does not appear to be primarily a door manufacturer, but supplies doors among other millwork products|Company is broader than typical door supplier; offers diverse architectural millwork products and services|DIV 8 Estimators: Alex Mathews likely handles Division 8 estimation though explicit title not confirmed",https://www.linkedin.com/company/architectural-millwork-of-santa-barbara,https://www.archmill.com/,2-20,Construction specializing in architectural millwork and custom woodworking,"Architectural Millwork of Santa Barbara is a family-owned, boutique custom woodworking and architectural millwork firm established in 1969, providing design, engineering, and production of cabinets, fireplace mantels, doors (bi-folding, sliding), roll down screen windows, mouldings, columns, and furniture for residential and commercial sectors in Santa Barbara, CA.","Likely yes, Alex Mathews appears responsible for Division 8 estimating though explicit confirmation is pending.","No, the company differs from specialized door suppliers/manufacturers like Overly Door Co. due to its broader portfolio of custom architectural millwork products and its boutique, local community focus rather than volume door manufacturing.","Architectural Millwork of Santa Barbara offers diverse custom woodworking and architectural millwork products including doors but is not primarily a door manufacturer. They focus on custom design and high-end millwork services rather than large-scale door production and supply. This differentiates them from more specialized door-centric companies that focus on volume, standardized door products and hardware.",,,,7.0,0.0
Easton Industries Ltd.,https://www.thomasnet.com/company/easton-industries-ltd-10012703/profile?cov=NA&format=json&heading=23639008&limit=2589&searchsource=suppliers&searchterm=Doors&what=Doors&which=prod&coverage_area=NA&pg=80,"Myrtle Beach, SC 29578",,"Custom Manufacturer* , Manufacturer, Service Company",$1 - 4.9 Mil Revenue,,"Custom manufacturer of granite and marble stone products for kitchens, bathrooms and other home improvement specialty needs. Types of products include countertops, backsplashes, sinks, faucets, showers, doors, inlays, and whirlpool tubs.",No,Success,,False,"Confidence score 8.5 >= 7.0; Employee count 11 (from '11-50 (estimated)') >= 10; No estimator detected: No estimators found in titles or company details; ICP mismatch: no; the company focuses on cultured stone products rather than door supply or manufacturing, making ; No decision makers found","{""notes"": ""Easton Industries Ltd. is a custom manufacturer specializing in granite and marble stone products primarily for kitchens and bathrooms, including countertops, backsplashes, sinks, faucets, ",8.5,"Easton Industries Ltd. is a custom manufacturer focused on cultured stone products with no evidence of division 8 estimators or specialization in door supply/manufacturing. The company has BBB accreditation with an A+ rating since 2012, an estimated 11-50 employees, and key leaders include Mike Marcis (President) and Joni Visci (Director of Operations). They maintain an online presence through their website, LinkedIn, Instagram, Facebook, and YouTube channels.","Easton Industries Ltd. is a custom manufacturer specializing in granite and marble stone products mainly for kitchens and bathrooms including countertops, backsplashes, showers, sinks, faucets, doors (custom?), inlays, and whirlpool tubs.|ICP Match: No; company focuses on stone surfaces rather than door manufacturing, therefore not similar to Overly Door Co., Acudor Products, or voestalpine.|Official company website found at https://eastonind.com/ located in Myrtle Beach, SC, established in 1974.|Social Media: Facebook and YouTube found, no LinkedIn company profile located so far.|No direct phone numbers found from LinkedIn profiles.|Instagram and YouTube social media presence found but no distinct leads from these channels|Products: Custom countertops, backsplashes, sinks, faucets, showers, doors (likely stone features), inlays, whirlpool tubs.|Location: Myrtle Beach, South Carolina.|Phone: (843) 448-2354|CEO: Mike Marcis (LinkedIn: https://www.linkedin.com/in/mike-marcis-24978318)|No confirmed Division 8 estimators on staff|Company is a custom manufacturer of granite and marble stone products for home improvement in Myrtle Beach, SC.|Key people with influence (owners and operations director) identified with LinkedIn URLs and contact info.|Industry: Custom manufacturing of cultured stone products (granite, marble) for kitchens, bathrooms, and home improvement specialty needs.|Easton Industries Ltd. is a custom manufacturer focused on cultured stone and marble products for kitchens, bathrooms, and home improvement.|Company not ICP match with door suppliers like Overly Door Co. due to product and market focus differences.|Social media: Instagram @eastonindustries, Facebook and YouTube channels present but low engagement.|Company industry is construction, not door supply or manufacturing.|Location: Myrtle Beach, SC|No LinkedIn company profile or key personnel profiles found yet; requires targeted LinkedIn searches for executives (CEO, COO, directors, estimators specifically).|The company does not closely align with door supplier manufacturers such as Overly Door Co. or Acudor Products since their core products are stone and marble rather than doors or frames.|LinkedIn company profile: https://www.linkedin.com/company/easton-industries-ltd|Estimated number of employees between 20-100, exact number not confirmed.|Official website: https://www.eastonind.com/ and LinkedIn company page: https://www.linkedin.com/company/easton-industries-ltd.|Company differs from door suppliers/manufacturers; focuses on cultured stone products rather than doors or hardware.|No available direct emails or phone numbers for key people|Located in Myrtle Beach, SC, company size estimated at 11-50 employees.|Industry: Custom stone manufacturing for kitchens and bathrooms|Sales Director: Joni Visci (LinkedIn: https://www.linkedin.com/in/joni-visci-200b19131)|Website: https://eastonind.com/|Company Name: Easton Industries Ltd.|BBB Accredited Since: 2012 with A+ rating.|Estimated Employees: Approx. 20-100 (not confirmed).|Email: info@eastonind.com|Official website: https://eastonind.com/|BBB accredited since 2012 with A+ rating.|Joni Visci contact email likely joni@eastonind.com.|Logic: Products and services differ significantly, specializing in cultured stone for interiors rather than doors or hardware.|Year Established: 1974.|No emails or direct contacts for leadership or key decision makers found yet; will pursue via LinkedIn and company website.|DIV 8 Estimators: No indication of employing DIV 8 estimators as focus is on stone products, not door/frame/hardware.|Owner: Mr. Mike Marcis (based on BBB profile), no confirmed LinkedIn or other executive profiles found yet.|Not a traditional door supplier or manufacturer compared to Overly Door Co. or Acudor Products|Key leadership includes Mike Marcis (former owner and president), Cullen Marcis (current owner and president), and Joni Visci (Director of Operations, joni@eastonind.com).|Online reputation includes BBB accreditation since 2012, moderate reviews on Yelp (2.8 stars) and Angi (4.8 stars).|No evidence of DIV 8 Estimators or door manufacturing specialists.|No clear evidence that the company employs DIV 8 estimators, likely due to focus on stone products rather than door supply or manufacturing.|Company Website: https://www.eastonind.com|Key decision-makers found: Mike Marcis (President) and Joni Visci (Director of Operations).|They manufacture cultured marble, cultured granite (Eastonite), and similar stone-based home improvement products.|No DIV 8 estimators on staff; focus is on stone products, not door frame/hardware.",https://www.linkedin.com/company/easton-industries-ltd,https://www.eastonind.com,11-50 (estimated),Custom manufacturing of cultured stone products for kitchens and bathrooms,"Easton Industries Ltd. is a custom manufacturer specializing in granite and marble stone products primarily for kitchens, bathrooms, and home improvement specialty needs, including countertops, backsplashes, sinks, faucets, showers, doors (stone features), inlays, and whirlpool tubs, located in Myrtle Beach, SC.",No,"No; the company focuses on cultured stone products rather than door supply or manufacturing, making it different from door suppliers like Overly Door Co. or Acudor Products.","The company specializes in cultured stone and marble products for interiors rather than doors or door hardware, setting it apart from traditional door suppliers or manufacturers whose products focus on doors, frames, and hardware.",,,,2.0,0.0
"Premium Building Products, Inc",https://www.thomasnet.com/company/premium-building-products-inc-30715057/profile?cov=NA&format=json&heading=23639008&limit=2589&searchsource=suppliers&searchterm=Doors&what=Doors&which=prod&coverage_area=NA&pg=80,"Kennett Square, PA 19348",,"Distributor* , Custom Manufacturer",$1 Mil Revenue,2011.0,Distributor of doors. Products include interior and exterior doors.,No,Success,,False,"Confidence score 8.0 >= 7.0; Employee count 0 (from '') < 10; No estimator detected: No estimators found in titles or company details; ICP match: yes, this company is similar to other door distributors rather than manufacturers like overly door c; No decision makers found","{""notes"": ""Premium Building Products, Inc is a distributor of doors, including interior and exterior doors, located in Kennett Square, Pennsylvania. LinkedIn profiles of key executives confirm leaders",8.0,"Premium Building Products, Inc is a small to medium-sized regional distributor of door products located in Kennett Square, PA. Its business model focuses on supply and distribution rather than manufacturing, distinguishing it from integrated manufacturers. Leadership includes CEO Bob Helder and President Jeff Mostyn, but no confirmed presence of DIV 8 estimators or detailed contact info is currently available. The official website exists but is not accessible. No official LinkedIn company profile found yet. Further research may clarify employee counts and detailed leadership roles.","No company LinkedIn profile confirmed, but related profiles indicate small leadership team.|Official website is http://www.premium-bp.com but was unreachable during check.|Company fits ICP profile of door distributors, not manufacturers.|The company is similar to other door distributors, distinct from manufacturers|No confirmed exact employee count; likely a small to medium-sized enterprise.|Premium Building Products, Inc is a distributor specializing in interior and exterior doors.|LinkedIn profiles found for key executives: Jeff Mostyn (President) and Bob Helder (CEO).|No direct emails or phones for leadership found yet; next step is scraping LinkedIn profiles for contact data.|Unclear if company employs DIV 8 estimators; requires further research.|Likely a small to medium-sized company; exact employee count not found.|No confirmed number of employees or industry classification found yet.|Jeff Mostyn is President since 2010; background in building supply, educated at Penn State University.|No social media profiles or email/phone contact details found for key personnel at this stage.|Company appears based or referenced in Kennett Square, PA.|Bob Helder is the CEO, with leadership experience and education from Michigan State University.|No evidence of DIV 8 estimators on staff at this company.|The company is distinct from door manufacturers, focusing on supply distribution.|No detailed leadership contacts identified yet; require targeted LinkedIn searches.|No confirmed presence of DIV 8 estimators identified yet; requires further probing.|Premium Building Products, Inc is a distributor of interior and exterior doors, located in Kennett Square, PA.|Location: 103 Twin Creek Ln, Kennett Square, PA 19348-2460, USA|No LinkedIn company profile located yet; searching recommended.|Company specializes in distribution of interior and exterior doors.|Company differs from door manufacturers like Overly Door Co. as it is a distributor, not a manufacturer.|No direct evidence of DIV 8 estimators employed at the company found so far.|Other personnel searches (e.g., VP Sales, Estimator) have not yielded confirmed employees at this company.|Company's primary business is distribution of doors, not manufacturing, differentiating it from some peers.|No data found on employing DIV 8 estimators so far|Located in Kennett Square, PA, which should be included in search queries to refine results.|Premium Building Products, Inc is a door distributor located in Kennett Square, PA.|Key decision-makers found: CEO Bob Helder, President Jeff Mostyn, both on LinkedIn.|Company name: Premium Building Products, Inc|Official website: http://www.premium-bp.com/|Industry: Building Material and Supplies Dealers; Retail Trade sector, door and window products|No LinkedIn company profile or personnel data confirmed yet for Premium Building Products, Inc|No direct contact info (email, phone) available publicly from LinkedIn for executives.|No official company website or LinkedIn profile identified from initial search results.|Further research needed to find additional leadership such as VP Sales, Directors, or Estimators for door-specific expertise.|Official website is http://www.premium-bp.com but access issues limit info available.|Company focus: Distributor of doors (including interior and exterior)|Employee count: Not disclosed|No detailed contacts or emails found in current resources|No key decision-makers identified yet.|No current confirmed LinkedIn company profile specifically for Premium Building Products, Inc.|Key principal: Kathy Julius (likely in senior leadership)|Official website is http://www.premium-bp.com but accessibility is limited.|Company is more distribution focused than manufacturing, differentiating it from listed manufacturers.",,http://www.premium-bp.com,,"Building Material and Supplies Dealers; Retail Trade sector, door and window products","Premium Building Products, Inc is a distributor specializing in interior and exterior doors, focused on distribution rather than manufacturing, located in Kennett Square, Pennsylvania.",No,"Yes, this company is similar to other door distributors rather than manufacturers like Overly Door Co. or Acudor Products, Inc. because it focuses on distribution of door products instead of manufacturing.","The company specializes in distributing interior and exterior doors rather than manufacturing them, differentiating it from door manufacturers. It primarily serves as a regional distributor in the building materials sector, which aligns it with other door distributors in terms of market focus and product offering.",,,,2.0,0.0
