companyName,profileUrl,location,logoUrl,companyType,revenue,establishedYear,description,isVerified,api_enrichment_status,api_error_message,is_qualified,qualification_reason,api_raw_response_preview,api_confidence_score,api_notes,api_findings,api_company_linkedin,api_website,api_num_employees,api_industry,api_short_summary,api_has_div8_estimators,api_icp_match,api_logic,api_lead_linkedin_profiles,api_decision_makers,api_estimator_leads,api_lead_count,api_relevant_lead_count
Vitrerie V. D. Plus - Div. de 9042 7535 Quebec Inc.,https://www.thomasnet.com/company/vitrerie-v-d-plus-div-de-9042-7535-quebec-inc-30701190/profile?cov=NA&format=json&heading=23639008&limit=2589&searchsource=suppliers&searchterm=Doors&what=Doors&which=prod&coverage_area=NA&pg=80,"Saint-Nicolas, QC G7A2N1",,Custom Manufacturer*,$1 Mil Revenue,1990.0,,No,Failed or No Data,Unexpected error for Vitrerie V. D. Plus - Div. de 9042 7535 Quebec Inc.: ValueError('Out of range float values are not JSON compliant'),False,Unexpected error for Vitrerie V. D. Plus - Div. de 9042 7535 Quebec Inc.: ValueError('Out of range float values are not JSON compliant'),,,,,,,,,,,,,,,,,
Dalmen Products Ltd.,https://www.thomasnet.com/company/dalmen-products-ltd-30694272/profile?cov=NA&format=json&heading=23639008&limit=2589&searchsource=suppliers&searchterm=Doors&what=Doors&which=prod&coverage_area=NA&pg=81,"St Isidore, ON K0C2B0",,Manufacturer*,$10 - 24.9 Mil Revenue,1976.0,,No,Failed or No Data,Unexpected error for Dalmen Products Ltd.: ValueError('Out of range float values are not JSON compliant'),False,Unexpected error for Dalmen Products Ltd.: ValueError('Out of range float values are not JSON compliant'),,,,,,,,,,,,,,,,,
Regal Building Materials Ltd.,https://www.thomasnet.com/company/regal-building-materials-ltd-30692484/profile?cov=NA&format=json&heading=23639008&limit=2589&searchsource=suppliers&searchterm=Doors&what=Doors&which=prod&coverage_area=NA&pg=81,"Calgary, AB T2H2M8",,Distributor*,$10 - 24.9 Mil Revenue,1992.0,,No,Failed or No Data,Unexpected error for Regal Building Materials Ltd.: ValueError('Out of range float values are not JSON compliant'),False,Unexpected error for Regal Building Materials Ltd.: ValueError('Out of range float values are not JSON compliant'),,,,,,,,,,,,,,,,,
"Charter Enterprises, LLC",https://www.thomasnet.com/company/charter-enterprises-llc-10067210/profile?cov=NA&format=json&heading=23639008&limit=2589&searchsource=suppliers&searchterm=Doors&what=Doors&which=prod&coverage_area=NA&pg=81,"Monterey Park, CA 91754",,"Custom Manufacturer* , Manufacturer",$1 Mil Revenue,1985.0,"Custom manufacturer of sheet metal products. Types include grills, stoves and burners, griddles, char broilers, cookers and gas and electric deep fryers. Capabilities include metal casting and sheet metal fabrication services.",No,Success,,False,"Confidence score 9.0 >= 7.0; Employee count 500 (from 'Approximately 500 full-time employees') >= 10; No estimator detected: No estimators found in titles or company details; ICP match: no, charter enterprises, llc is not similar to door suppliers or manufacturers like overly door co.,; No decision makers found","{""notes"": ""Charter Enterprises, LLC is a custom sheet metal manufacturer specializing in commercial kitchen equipment such as grills, stoves, burners, griddles, char broilers, cookers, and both gas an",9.0,"Charter Enterprises, LLC is not relevant to the door supply/manufacturing industry due to its distinct focus on commercial kitchen equipment and metal fabrication. It does not employ DIV 8 estimators and serves a different market segment than door manufacturers or suppliers.","Company LinkedIn profile link is https://www.linkedin.com/company/charter-enterprise-llc.|No evidence of DIV 8 estimators or direct door/frame/hardware product lines — ICP match to door manufacturers is 'No'.|Relevance: Not a door supplier or manufacturer; focused on kitchen and food service equipment rather than doors or hardware|Revenue Estimate: About $70 million in gross sales|Charter Enterprises, LLC is a custom manufacturer of sheet metal products focused on cooking equipment like grills, stoves, burners, griddles, char broilers, cookers, and gas/electric deep fryers.|Revenue: Estimated $70 million in gross sales|Product Focus: Custom sheet metal products including grills, stoves, burners, griddles, char broilers, cookers, gas and electric deep fryers|Lynn Huang Education: USC - Master of Science and Bachelor of Science degrees|Location: Monterey Park, California|Industry: Commercial Kitchen Equipment Manufacturing and Metal Casting|The company emphasizes high quality standards in metal casting and sheet metal fabrication services.|Website: https://www.charterbbq.com|Next Steps: Targeted LinkedIn searches for additional leadership roles such as Sales Manager, Operations Manager, Purchasing Manager; scrape About Us page on company website; check LinkedIn company profile for more data|LinkedIn Company Profile: https://www.linkedin.com/company/charter-enterprise-llc/|Capabilities: Metal casting in iron, brass, aluminum, stainless steel; sheet metal fabrication|Company Name: Charter Enterprises, LLC|Charter Enterprises, LLC is a niche manufacturer specializing in sheet metal fabrication and metal casting for commercial kitchen equipment and BBQ grills.|Product Focus: Grills, stoves, burners, griddles, char broilers, cookers, gas and electric deep fryers|Key person identified: Lynn Huang, Co-Founder & Owner, with LinkedIn profile https://www.linkedin.com/in/lynn-huang-2281853b.|Key decision-makers' details unavailable as LinkedIn member profile scraping is unsupported for this URL.|Employee Count: Approximately 500 employees|ICP Match: No, they are not similar to door manufacturers or suppliers such as Overly Door Co., Acudor Products, Inc., or voestalpine Roll Forming Corporation|No verified LinkedIn company profile found; further LinkedIn company profile scraping recommended.|DIV 8 Estimators: Likely no, as company focus is not door hardware|Official website is likely https://www.charterbbq.com.|They have approximately 40 years of experience since founding in 1996, located in Monterey Park, CA.|Company operates primarily in metal fabrication for kitchen appliances, not door manufacturing.|Industry: Custom manufacturing of sheet metal products focused on commercial kitchen equipment|No verified social media profiles for company found; icons link to Wix pages, confirming placeholders.|Company size and detailed employee info unavailable; likely mid-sized based on operation scale.|LinkedIn Owner Profile: Lynn Huang - Co-Founder & Owner (https://www.linkedin.com/in/lynn-huang-2281853b)|Company capabilities include metal casting and sheet metal fabrication.|Key Personnel: Lynn Huang (Co-Founder & Owner) with LinkedIn: https://www.linkedin.com/in/lynn-huang-75a2993b|Charter Enterprises, LLC manufactures custom sheet metal products like grills and deep fryers.|Company offers OEM manufacturing, quality control, R&D, compliance with certifications like ETL, ISO, CSA, NSF.|The company is not similar to door suppliers such as Overly Door Co., Acudor Products, Inc., or voestalpine Roll Forming Corporation due to product and market differences.|Charter Enterprises does not appear to employ DIV 8 estimators; its industry focus differs from door manufacturing and hardware estimating.|Official Website: https://www.charterbbq.com/|No LinkedIn company profile or employee numbers have been found yet; next research steps recommended to locate and scrape LinkedIn for deeper insights and key personnel identification.|No current evidence of employing DIV 8 estimators.|DIV 8 Estimators: None found; company does not employ DIV 8 estimators|Estimated Number of Employees: Approximately 500 full-time staff|No verified VP Operations, purchasing director, estimating manager, or door manufacturing specialist found|No apparent similarity to door suppliers or manufacturers like Overly Door Co. due to product line differences.|Company website: https://www.charterbbq.com with contact phone 323-269-6868 and email info@charterbbq.com.|Capabilities: Metal casting (iron, brass, aluminum, stainless steel), sheet metal fabrication",https://www.linkedin.com/company/charter-enterprise-llc/,https://www.charterbbq.com/,Approximately 500 full-time employees,Commercial Kitchen Equipment Manufacturing and Metal Casting,"Charter Enterprises, LLC is a custom manufacturer specializing in sheet metal products focused on commercial kitchen equipment including grills, stoves, burners, griddles, char broilers, cookers, and gas and electric deep fryers. The company offers metal casting in iron, brass, aluminum, and stainless steel, along with sheet metal fabrication services.",No,"No, Charter Enterprises, LLC is not similar to door suppliers or manufacturers like Overly Door Co., Acudor Products, Inc., or voestalpine Roll Forming Corporation because it focuses on commercial kitchen equipment manufacturing rather than door or door hardware products.","The company specializes in sheet metal fabrication and metal casting for commercial kitchen equipment such as grills and deep fryers, contrasting with door suppliers that focus on doors, frames, and hardware. Their markets, product lines, and estimating needs differ significantly, including the absence of DIV 8 estimators who specialize in door, frame, and hardware cost estimating.",,,,1.0,0.0
Traffic Doors and More,https://www.thomasnet.com/company/traffic-doors-and-more-30784237/profile?cov=NA&format=json&heading=23639008&limit=2589&searchsource=suppliers&searchterm=Doors&what=Doors&which=prod&coverage_area=NA&pg=81,"Costa Mesa, CA 92626",,Distributor*,,,"Distributor of doors for high-traffic areas. Types of doors include swinging, saloon, and curtain. Applications include kitchens, coolers, refrigerators, freezers, and warehouses. Markets served include commercial, restaurant, and supermarket.",No,Success,,False,"Confidence score 8.0 >= 7.0; Employee count 0 (from '') < 10; No estimator detected: No estimators found in titles or company details; ICP mismatch: no. unlike overly door co. and acudor products, which are manufacturers, and voestalpine roll formin; No decision makers found","{""notes"": ""Traffic Doors and More is a distributor headquartered in Costa Mesa, CA (zip code 92626), specializing in doors for high-traffic applications such as commercial kitchens, coolers, warehouse",8.0,The company is a California-based distributor focused on commercial high-traffic doors and accessories with a sales and distribution business model rather than manufacturing. No publicly available company LinkedIn profile exists. No evidence of Division 8 estimators on staff was found. Key personnel identified include Randy Wall as Sales Manager and Web Master. Further research is needed to identify additional executives or decision-makers.,"Provides related products: air curtains, fly fans, plastic strip curtains, replacement parts, and fly traps.|Located in Costa Mesa, CA, serving regional commercial kitchen and warehouse door needs.|No direct mention or evidence of C-suite or key decision-makers on website; further LinkedIn search needed.|Traffic Doors and More is a California-based distributor specializing in doors for high-traffic commercial, restaurant, and supermarket applications.|No publicly available information on estimated number of employees or presence of Division 8 estimators.|Company LinkedIn profile link unclear or missing; Randy's LinkedIn mentions no official company page URL.|No confirmation on number of employees or use of Division 8 estimators within the company.|Keywords and metadata strongly associate it with commercial kitchen doors and supermarket traffic doors.|No LinkedIn company profile URL conclusively found yet; company website is https://trafficdoorsandmore.com/.|Key person identified: Randy Wall, Sales Manager and Web Master since July 2011 at Traffic Doors and More located in Costa Mesa, CA.|No clear publicly available LinkedIn company profile or employee information currently discovered.|Traffic Doors and More specializes in distributing swinging, saloon, and curtain doors for high-traffic commercial applications including kitchens, coolers, refrigerators, freezers, supermarkets, and restaurants.|Traffic Doors and More is a distributor specializing in high-traffic area doors including swinging, saloon, and curtain types serving commercial, restaurant, and supermarket markets.|Industry focus on commercial kitchen and traffic doors for restaurants, supermarkets, warehouses.|Company website: https://trafficdoorsandmore.com/|They serve markets including restaurants, supermarkets, coolers, refrigerators, freezers, and warehouses.|Company operates more as a distributor & reseller rather than manufacturer, with dealer pricing models.|No direct contact information (email, phone) for Randy Wall publicly available on LinkedIn profile.|Offers dealer pricing and has a toll-free sales/support phone line (1-877-768-0722).|Located in Costa Mesa, California, USA based on geo metadata.|Company acts more as a distributor focused on commercial-grade traffic doors rather than a manufacturer with broad door product lines.|Contact information: toll-free phone 1-877-768-0722 and email sales@trafficdoorsandmore.com.|Traffic Doors and More is a Costa Mesa, CA-based distributor specializing in commercial high-traffic doors such as swinging and saloon doors.|Targeted next step searches need to include individual key decision-makers by role due to lack of consolidated information so far.|No explicit data on number of employees or existence of Div 8 estimators on the website.|Similar to Overly Door Co. and Acudor Products Inc. based on market served and product type, different from roll-formed metal manufacturers like voestalpine.|No direct evidence found of DIV 8 estimators employed at Traffic Doors and More.|Product types include swinging doors, stainless steel doors, impact doors, PVC strip curtains, air curtains, and related accessories.|No active LinkedIn company page available; LinkedIn profile for Randy Wall (Sales Manager and Web Master since 2011) was found but no other executives identified yet.|Company appears to be a distributor/reseller rather than a primary manufacturer, differentiating it from companies like voestalpine Roll Forming Corporation.|Randy Wall actively promotes company products and trade show participation on LinkedIn, indicating a sales and marketing leadership role.|Product lines include Pro Tuff, Ruff Tuff, and V-Cam heavy-duty impact doors and PVC strip curtains and air curtains.|No public evidence found of full-time Division 8 estimators on staff, suggesting reliance on contractors or external estimating services.|Traffic Doors and More's business model is distribution-focused, distinguishing it from similar door suppliers/manufacturers like Overly Door Co., Acudor Products, or voestalpine Roll Forming Corporation which may also manufacture.|Company shares market similarities with manufacturers like Overly Door Co. and Acudor Products but differs by primarily distributing rather than manufacturing or roll forming doors.|Identified Randy Wall as Sales Manager/Web Master linked to the company from LinkedIn, potential key decision-maker.|Company operates primarily as a distributor, not a manufacturer, differentiating it from companies like Overly Door Co., Acudor Products, and voestalpine Roll Forming.|Website TrafficDoorsAndMore.com is the official company site showcasing their product range primarily geared toward restaurant kitchen and supermarket traffic doors.|Offers doors types including swinging, saloon, curtain doors, and heavy-duty impact doors (Pro Tuff, Ruff Tuff, V-Cam).|Website has extensive product information with pricing and dealer info, reflecting a strong sales and distribution focus.",,https://trafficdoorsandmore.com/,,"Commercial Door Distribution, Kitchen and High-Traffic Doors","Traffic Doors and More is a distributor based in Costa Mesa, CA, specializing in doors for high-traffic commercial applications, including swinging, saloon, and curtain doors used in kitchens, coolers, supermarkets, and warehouses. They provide branded heavy-duty impact doors and related accessories, focusing on distribution rather than manufacturing.",No,"No. Unlike Overly Door Co. and Acudor Products, which are manufacturers, and voestalpine Roll Forming Corporation specializing in metal forming, Traffic Doors and More operates primarily as a distributor and reseller rather than a manufacturer or fabricator.","Traffic Doors and More differs from manufacturers by focusing on distributing a broad selection of commercial and high-traffic door products including swinging, saloon, curtain doors, and impact doors, serving niche markets like restaurants, supermarkets, and warehouses. It offers dealer pricing and does not manufacture its own products, distinguishing it from ICP companies and industrial metal door fabricators.",,,,1.0,0.0
Modena Window Design LLC,https://www.thomasnet.com/company/modena-window-design-llc-30981243/profile?cov=NA&format=json&heading=23639008&limit=2589&searchsource=suppliers&searchterm=Doors&what=Doors&which=prod&coverage_area=NA&pg=81,"Corona, NY 11368",,Distributor*,,,"Distributor of windows and doors products. Made from vinyl and aluminum materials. Sliding, terrace, entrance, and shower doors are offered. Mirrors and glass railing are also available.",No,Success,,False,Confidence score 8.5 >= 7.0; Employee count 0 (from '') < 10; No estimator detected: No estimators found in titles or company details; ICP match: yes; modena window design llc is similar to other regional window and door distributors like overly ; No decision makers found,"{""notes"": ""Modena Window Design LLC is a wholesale distributor of vinyl and aluminum windows and doors, based in Corona, New York. The company supplies various door types including sliding, terrace, e",8.5,"Modena Window Design LLC is a significant regional distributor in the New York area specializing in vinyl and aluminum window and door products. It does not have a verified LinkedIn presence or identified executive leadership publicly available, and it employs no DIV 8 estimators. The company's lack of manufacturing activities and focus on distribution defines its role and relevance in the door supply industry.","Location: 53-04 97th Place, Corona, NY 11368|Facebook listing under a related name suggests involvement in similar products for NY metropolitan area.|Relevance: Significant distributor in NYC metro for vinyl and aluminum door and window products|Company name: Modena Window Design LLC|Notes: Company focuses on distribution to the New York market with limited public executive information; no manufacturing activities evident|Official website: http://modenawindow.com|No official LinkedIn company profile URL found; LinkedIn searches for key roles required.|LinkedIn Company Profile: No active verified profile found|Modena Window Design LLC is a New York based wholesale distributor of vinyl and aluminum windows and doors.|Website: http://modenawindow.com/|Business type: Wholesale distributor of custom vinyl and aluminum windows and doors|Phone: 917-496-7020|Product Range: Vinyl and aluminum sliding, terrace, entrance, and shower doors; mirrors; glass railings|LinkedIn Company Profile: No active page found (dead link)|Industry focus: Window and door distribution/wholesaling, mainly vinyl and aluminum products|Industry: Distributor of vinyl and aluminum windows and doors|Company operates as a distributor similar to Overly Door Co. and Acudor Products, but is not a manufacturer like voestalpine Roll Forming Corporation.|Email: office.modena11368@gmail.com|Presence of DIV 8 Estimators: None found|Instagram (@modenawindow) shows marketing content but no employee or leadership details.|Company Name: Modena Window Design LLC|Instagram Presence: @modenawindow|DIV 8 Estimators: No evidence of employment found|Location: 53-04 97th Place, Corona, New York 11368|Phone: 917-496-7020; Email: office.modena11368@gmail.com|Similarity to Other Door Suppliers: Distribution focus distinguishes it from manufacturers like Overly Door Co. or Acudor Products|Located at 53-04 97th Place, Corona, NY 11368|No official LinkedIn company profile confirmed for Modena Window Design LLC|Number of Employees: Not publicly available|Business Type: Wholesale distributor of windows and doors made from vinyl and aluminum|Instagram @modenawindow active with showroom and sales info; no personnel contacts detailed|No confirmed C-suite or senior-level decision makers found on LinkedIn associated directly with this company.|Products: Vinyl and aluminum windows (various series), sliding doors, terrace doors, entrance doors, shower doors, mirrors, glass railings|Number of Employees: Not publicly disclosed|No direct current data on number of employees or DIV 8 estimators.|No manufacturing info found; mainly distributor|Relevance: High for distribution partnerships or sales leads in NY market|No DIV 8 estimators found on staff, indicating they do not specialize in door hardware cost estimating.|They offer sliding, terrace, entrance, and shower doors, as well as mirrors and glass railings.|Instagram profile @modenawindow shows showroom information and latest updates.|Key Decision-Makers Found: None with verifiable LinkedIn or public contact details|Estimated number of employees is unknown but likely small to medium size based on distribution model.|Products: Sliding, terrace, entrance, shower doors, mirrors, glass railings|Company is similar to other vinyl and aluminum door/window distributors but specifics on manufacturing or market scope need more data.|They offer sliding, terrace, entrance, and shower doors along with mirrors and glass railings.|Logical difference: Distributor versus manufacturer|DIV 8 estimator presence not confirmed; requires further search|Website: http://modenawindow.com|Official website: http://modenawindow.com/; email: office.modena11368@gmail.com; phone: 917-496-7020.|Company is listed as distributor on Thomasnet for aluminum windows and doors.|Industry: Distribution and wholesaling of window and door products; not a manufacturer|ICP Match: Yes, similar to other regional window and door distributors but different from manufacturers|Key Personnel on LinkedIn: None conclusively linked to Modena Window Design LLC found|Modena Window Design LLC is a distributor of vinyl and aluminum windows and doors located in Corona, NY.|ICP match: Yes, similar to other window and door distributors but may differ from manufacturers like Overly Door Co. due to distribution focus|No verified LinkedIn company profile exists under the exact company name.|Official website: http://modenawindow.com/ with contact email office.modena11368@gmail.com and phone 917-496-7020.|No confirmed CEO or executive LinkedIn profiles found for the company",,http://modenawindow.com,,Distributor of vinyl and aluminum windows and doors,"Modena Window Design LLC is a New York based wholesale distributor of vinyl and aluminum windows and doors, offering sliding, terrace, entrance, and shower doors along with mirrors and glass railings, primarily serving the New York metropolitan area.",No,"Yes; Modena Window Design LLC is similar to other regional window and door distributors like Overly Door Co. and Acudor Products, Inc. because it focuses on distribution rather than manufacturing, so it differs from manufacturers like voestalpine Roll Forming Corporation.","The company operates strictly as a distributor and wholesaler of vinyl and aluminum windows and doors, without manufacturing its own products. This distribution focus distinguishes it from manufacturers who produce door components and employ DIV 8 estimators, which Modena does not. It mainly serves contractors and wholesalers in New York, similar in market scope to local distributors but distinct from integrated manufacturers.",,,,0.0,0.0
